,Comment,Sentiment Rating
164,     I had shit eyesight since I was a child. Some teachers thought I was an hyperactive kid or even a troublemaker because I kept getting off my seat.    I was just too blind to see the board and kept standing to walk to it and see what was actually on it.,0
165,"10 years ago my biology teacher always said that without science almost noone would need to have glasses, since only the ones with actually good eyesight could survive in a primitive environment.",1
166,her squinting face reminded me of the old shopkeep alien with a volcano head from redline.,2
167,"It was so sweet, I think I got Diabetes when Suika got her   labor potential   sight back.     That was a useful melon, both for espionage and improving her vision.",1
168,and her face reveal though,2
169,TOOOOUUUURRRRRNAMEEEEENT AAAAAARRRRRRC,2
170,And probably the most ridiculous one out of any shounen in a good way. I'm so excited.,1
171,I would like Chrome to participate and win that tournament for Ruri's sake.,1
172,"No amount of science or friendship power would make Chrome win the tournament, he just isn’t a fighter    Edit: science in it’s current stage can’t, i don’t think it could help Chrome  until  the tournament starts",1
173,Make guns real quick nobody will notice,2
174,parry this you casual.jpg,2
175,F2P vs P2P,2
176,Power of G U N,2
177,"They already have gunpowder and iron, Wouldn't be terribly hard to invent an early blunderbuss.",1
178,Showing up to the tournament arc in an Apache helicopter.,2
179,"  NANOMACHINES, SON  ",2
180,"He did say they were going to catch up to and  go beyond  where we were scientifically when the Great Stoning happened, so sure why not",1
181,"Bro have we been watching the same show? Friendship can get fucked, we are all about the power of SCIENCE.",0
182,"Yes, i was actually planning on saying something like that, but i decided to say what i said because neither science or friendship power can help him right now so it doesn’t matter which one i choose to say because both are the same thing, Chrome is weak and there’s nothing that can change it before the tournament starts",0
183,"Magma got mind fucked when Gen hid some flowers, you dont think Chrome can come up with something to help him best Magma?",1
184,"After the flowers trick Gen got beaten so hard that the only reason he was alive was because he was using fake blood bags, if Chrome does something similar what do you think will happen? And also i don’t think they would allow traps, venom or other tricks.",0
185,"Only gotta win once, and I doubt they have rules for things they cant even imagine",1
186,to use the words of someone else in this thread somewhere      FLAMETHROWER  ,2
187,Magma will just make sure to hit before he finishes his incantation.,1
188,Give Chrome some knock out chemical and all he needs to do is get it on Magma's face.  Game over for Magma.,2
189,Would the village allow that?    Would they allow “sorcery”?,1
190,"How would they know what is going on?  It doesn't have to be some flashy powder cloud, but something on Chrome's hands that is invisible and that Chrome has taken the 'antidote' for.  Magma all off a sudden feels really really really weak, and Chrome bitchslaps him to the ground.  Then Chrome neutralizes the chemical ringside and game over.  The village would be utterly clueless.",0
191,Could work,2
192,Making such chemicals are hard though. They’re incredibly sensitive to dosage on top of that.,1
193,Well that's true.  But I would suppose you could just refine something from nature.,1
194," Enter ""Chrome Man"" Mark I ",2
195,What makes it so crazy? I don’t personally mind spoilers.,0
196,"It's crazy in the sense that it's super creative with some stuff, outsmarting your opponents etc. It's not your usual power through and get strong type of fights, similar to how HxH in a way, but the creativity goes a bit over the top :. Which is a great thing since the series is supposed to be science based for the most part.",1
197,any idea on how many episodes it might last?,2
198,"If I had to guess, probably 2.5-3 episodes. It is pretty short for a tournament arc, but that is to be expected when you have such a small village.",1
199,You clearly must watch more Shonen,1
200,Did any JoJo parts ever had a tournament arc?,2
201,Joseph in Kars' mansion and vs Wamu in the finals was the ultimate tournament arc ofc,2
202,"I said the most ridiculous one, not the best one",0
203,I know,2
204,"I mean I honestly can't think of any shounen with a more ridiculous tournament arc that was ridiculous in a good way. Though tbf, I haven't completely read or seen pretty much any of older shounen 80's and 90's because they tend to have pretty much only action and barely any plot at all.     I'm guessing sth that might get a ridiculous tournament arc later on might be Jojo. But I haven't watched past the first season because I didn't really enjoy the first two parts. It's just that I can't enjoy action heavy shounen with no plot. I might still continue watching someday because later parts might have more plot and thus might be more enjoyable. Or they might have other elements that make them enjoyable for me instead.",1
205,"The only comparable one is hunter x hunter, but I'd say that's hardly the best part of the series, if not mistaken it's considered one of the worst arcs of the series along with the island one, ironically I loved both. But like dr.stone it focuses more on outsmarting the opponent instead of the typical shonen power through will or some power up out of nowhere. Gon vs Hisoka is probably my favorite fight of all shonens and it's from that tournament, i'd tell you to watch it but it might be hard to understand some stuff without context.        Yu Yu hakosho also has a tournament arc that is pretty great.",1
206,"I mean, I would hardly call the tournament arc in HxH ridiculous. It's been over 3 years since I watched the anime, so I don't remember much. I'm assuming you mean Heavens Arena and not the Hunter Exam since you mentioned Gon vs Hisoka.    I tried getting into Yu Yu Hakusho, but eventually stopped reading during the Dark Tournament, because I was unable to enjoy it. It was just pure action without plot all the time. There was neither comedy nor great character interactions to make up for the lack of plot, which is why I was unable to enjoy it. I guess I just read up until the Dark Tournament because I heard of how great it is and then ended up being disappointed.    I get why others enjoy these kinds of shounen, but it's simply not the type of shounen I enjoy. I need at least plot, comedy or good character interactions on top of action to enjoy a battle shounen. Though what I consider good characters or good character interactions is quite different from what a lot of others think.    For me, characters usually get enabled through plot and comedy. So if neither is there or both of them are unenjoyable, I often can't come to like the characters either. In most cases, either plot or comedy is enough to enable the characters and make me like them. So it doesn't take both. Most 90's shounen manga or anime I've read or seen didn't really have a plot and if they have comedy, it's often pretty outdated.     Though tbf, I haven't seen or read that much from the 80's or 90's. So I'm not going to judge stuff I haven't seen yet based on this. However I still go in with low expectations when reading or watching older stuff, especially when it comes to shounen.    And tbh, for the exact same reason, I didn't enjoy the beginning of One Piece, because it was too action heavy. I only really started enjoying it when they entered the Grand Line and now it's not surprisingly one of my favourite manga.",1
207,"Yu Yu Hakusho does have that issue, but I don't think HxH has it. I don't think there's any battle shonens  100% without the issues you mentioned besides HxH and some recent ones, but if you go outside the spectrum a bit you find a lot of old stuff with good character development, the problem is that usually those series are half episodic, trigun comes to mind in that regard, or are full episodic like cowboy bebop which is something you stated not to like because there's not long running plot. I have the same opinion tbh, if there isn't a main plot it's hard to like a show, I don't mind episodic stuff if there's a main plot behind it. Regardless I still watch everything since I have a lot of time nowadays :         Hitman Reborn is episodic at first as well but gets good halfway through, I wouldn't recommend it nowadays tho.  It's hard to recommend older stuff in the battle genre mainly because of the older animation, especially long running shows like hitman reborn, rurouni kenshin and yu yu hakusho suffer a lot from that, 90% of the enjoyment of those shows are the battles, unless you're used to old animation, you won't like it nowadays. The manga's are great tho, Air gear for example, the anime has really shitty fights animation wise, but the manga has great panels and holds up even today  I didn't like either one but it's a good example . But at the time they were released that animation was great.        Not to say that there aren't any good older animated shows, eureka seven the original not the crappy AO has insane animation for the time, I'd even state that it beats 90% of the new shows on that regard, same with trigun, cowboy bebop, black lagoon, among others. But inside the battle shonen especifically the animation was really poor just due to how their releases were designed, I wish these shows were all remade like HxH 2011.         If there's an older battle shonen that I'd recommend even nowadays is Baki tv not the ovas, has good character development, has an overarching plot, it's smart battle wise more about technique instead of raw power, and the animation is really good and watchable even nowadays. Baki has two main parts, like dragon ball it starts with him young, and then you have the other arcs where he's grown up, the first part has worse animations and there's definitely parts that are kinda boring but the second part is great, also has a tournament arc. I can't recommend the netflix series, that cgi ruins everything, I'd say just watch the original tv show and for the new arcs read the manga.",1
208,"I mean, you're right although Naruto for example had a plot until the war. So the issue didn't arise until shortly before its conclusion.  Back when I read it, I didn't really mind it in that case, but I guess my taste changed since then.      I actually don't really mind episodic stuff if there's good comedy or the characters are well written. Gintama is among my favourite anime of all time despite being episodic for the most part. Though it has a plot as well, but I still really enjoyed the episodic parts. Another episodic show I really enjoyed was Asobi Asobase, though again it's mainly because of the comedy.    I actually haven't seen Trigun yet and I only watched the first episode of Cowboy Bebop, but never got to watch further. Good to know that I shouldn't be expecting a full fledged plot from them. Otherwise I would've probably gone in with too high expectations.    Yeah, I agree that older shows tend to be mostly about fights. Personally, I prefer it if the characters fight for plot reasons and not just for the sake of fighting. I haven't seen Hitman Reborn yet, but have it on my plan to watch list. And I agree with the old animation. It's another reason why I usually don't watch older anime pre 2006. Though there are some anime after 2006 that still have the dated animation. Though there are some exceptions like Monster or Gintama's first season where I didn't mind the 4:3 ratio and the older animation. Though they both had pretty good animation.    I actually watched the first 9 episodes of Eureka Seven, but didn't really enjoy it up until that point. I guess Renton was too annoying for me as an MC. It was already more than 2 years ago though so I don't remember that much.    I wasn't even aware the Baki OVA's were sequels of an older tv anime. Good to know because they were on my plan to watch list. Now I'm going to replace them with the prequel I guess. I will watch them sometime, but probably not all too soon.    I mean I would really like to find a good shounen anime I haven't seen yet that has the newer animation. I guess Sket Dance is the only one that comes to mind that I haven't seen yet, but probably should watch very soon. I know it's very similar to Gintama, so I'll probably like it. Oh, and I have to finally get up to date with Kimetsu no Yaiba.    Other than that, I've seen pretty much everything from Shounen Jump that got an anime. Though I dropped Black Clover and Kuroko no Basuke. I still kinda follow the Black Clover manga just because I got into it when the first chapter dropped and I still liked the kind of action heavy anime and manga. But now I just follow it for the sake of it, but don't really enjoy it much anymore, mainly because of some directions the writing has taken. I mean it has more plot than older manga, but it's still mainly just fights the whole time and the plot has lots of flaws.    So I'm mainly just reading currently running manga in Shounen Jump and trying out the new ones hoping it is something I enjoy. Though there are also new manga that end up surviving that I don't enjoy like Jujutsu Kaisen and Chainsaw Man. But stuff like Dr. Stone except for the first arc or Act-Age are great. From the newest batch, Mission Yozakura's Family is good so far.",1
209,"Both Cowboy bebop and trigun have plot, but cowboy bebop only in the final  eps, and trigun is halfway through, it almost becomes a completely different anime, I highly recommend watching it since it's really unique.     Eureka seven is like that too, I think it's 20+ eps of episodic stuff, when I rewatch it I just skip it tbh. The plot is really unique like trigun but if you didn't like renton, half of it is about renton and eureka, so I can't recommend if you didn't like them, as you're bound to dislike the series.    Haven't seen Sket Dance, I'll put it on my list :    Black Clover is an anime that I'm really glad I stuck with it, ep 100 was a blast to watch. Can't say it's one of my favorites, it's average at best, but watchable.     Enen no shouboutai has amazing animation, if you're not watching it you should 100%. The story and setting is pretty unique and has kept me interested so far. The only critique I have against it is the fan service in innapropriate moments, If not mistaken ep9 has the worst offense I ever seen in any anime.    I wish I had more time to read manga, the reason I watch so many anime's is mostly because I work as a digital artist, so I have them as background half the time. Therefore I'm not caught up with current shonen jump releases, dr.stone is the only one I follow currently, but I wouldn't call it a battle shonen :v",1
210,"I gotta say, it would've  been super funny if Senku could enter the fight and you can pick whatever weapon you want.    Magama:  cool sword tricks     Senku: Pulls out a gun and game over    Truly Indiana Jones",1
211,Honestly a grenade would be way easier to make with gunpowder and glass fragments or iron.,1
212,"It would be easier, but it would way more dangerous to Senku and everyone else at the tournament",0
213,Blowing someone's arm off might not make a very good impression.,0
214,"Hmm yeah.     He can also make a Molotov, which might be even easier",1
215, Did you say the T-word?      grandhype,2
216,T as MUSCLE!,2
217,   Shounen-ness intensifies   ,2
218, Hyped Gigguk noises ,2
219,It's exhilarating!,1
220,Gonna be hard to top Chainsaw Man tournament arc,1
221,I can hear Gigguk's voice while reading this,2
222,Is that a gigguk reference?,2
223,yeah obviously,1
224,"So we're using the trope of ""Kinro's problem would be so easily fixed if he just talked about it"", but it makes a lot of sense why he doesn't want to admit it.    I find it super heartwarming that the very first thing they did with the glass was make Suika glasses instead of just plowing ahead with the main goal.",1
225,It helps that glasses blanks are an excellent test run for their glass production. Anything more complicated than a solid disk required more skill than they had,1
226,"Eh they didn't need to make glasses. Actually turning the glass into usable and solid lenses would actually be heinously difficult with the way they did it. Like I don't care how much trial and error they used, manually grinding glass into prescription lenses would be so ridiculously hard with those tools.",0
227,We have been giving the show some leeway here and there all this time. I believe we could do it once more.,1
228,"I mean, as much as it follows science, it isn't realistic what they are doing. It's all possible but not plausible. The science parts are correct but there is no way you could do all these things with such ease. Still love the shit out of it.",1
229,"Everything is turned up to 11 in Dr. Stone. Making the things they make with the relative ease they do is as reasonable for Senku as the insane feats of stamina, strength, and agility we see from Taiju, Tsukasa, or Kohaku. I think part of the reason they're so unreasonable is to make Senku and his shenanigans seem more plausible. In other words, inventing glasses is no more unreasonable than punching a lion to death.",0
230,"Yeah, it's a shounen after all.",1
231,Pretty much. They have the superpower of engineering.,1
232,It's an anime,2
233,"I mean yea ofc, but that's not the point. My point was that this was a very deliberate choice because actually making glasses is heinously difficult and there's no way senku doesn't know basic optics lol.",0
234,"Even if the prescription isn't up to today's standards, with a vision as bad as Suika's, even grossly-made lenses would make a huge difference. As for the 1080p sunflower, that's just creative license; like how the actual light emitted by the bamboo lightbulb filament 2 episodes ago would've been no stronger than a torch.",1
235,"That's not how light works. Just because they're grossly made doesn't mean they'll help, if the angle of refraction is super inconsistent on the lense, or the focal point is completely off where it should be then the image will be super fucked. Two incredibly hard things to predict and accurately achieve in the stone world. It's not a matter of bad medium and good, it's a matter of literally wouldn't be useable lol. There's a reason why glasses weren't invented until 1290 even though the study of opticslenses has been done since Mesopotamia.    This is unarguably something that's meant to be overlooked because nitpicking only takes away from the enjoyment of the scene.",1
236,     But lenses had been invented way before so the reason wasn't that making good lenses was impossible,0
237,"Making lenses ≠ making glasses. To make glasses, you have to be able make a very specific lense to fit the individual.",1
238,"Man ... We get it. We're trying to say that for the show to stay entertaining, they need to make some shortcuts.",1
239,This comment will be coming up every episode at this rate I can assure you all,1
240,"The show requires a great deal of leeway. It's not like the things they're doing aren't possible, but on the timescale they're accomplishing them on? That's pretty much impossible.    But hey, it's animation. Dimensional compression is a common trope. For example, the Simpsons compresses space so that the family can reach any iconic American landscape with no more than a day of drivingskateboarding.",1
241,"Suika's glasses are probably not perfect, but even badly fitted ones are better than no glasses at all.",0
242,They might not be perfect but they were pretty damn accurate if the show is to be trusted. It's just one of those things you aren't supposed to nitpick because it's irrelevant to the enjoyment of the show. I was just tryna say in the more meta sense that making the glasses was incredibly deliberate.,1
243,We're talking about a show where a guy can cut down a tree with one swipe of a stone knife.  I'm not going to get on their case about grinding lenses.,0
244,"That's literally not the point of my comment though. Ofc it's exaggerated I read the manga I understand how exaggerated these things are, I study electrical engineering I actually know the physics. I'm just tryna say this was a very deliberate decision to help suika and not a byproduct of convenience.",1
245,"It's just a bit exaggerated is all, for dramatic effect. It's like the lightbulb scene, where for a brief moment a single piece of bamboo with a current running through it lit up the entire night sky like a skyscraper. At a later point in the show they even acknowledge that that wasn't really how bright it actually was, it just ""felt"" like it was that bright to everyone there, because of how incredible it was for there to be any electricity at all.    Same with Suika here. Imagine spending your whole life not being able to see anything except what's immediately in front of your face, then all of a sudden you can see two feet in front of your face.  You would cry too.",0
246,"Why do you guys keep trying to tell me this. I read the manga no shit it's exaggerated. I understood that, literally all I'm saying is senkus decision to help suika is completely intentional and shows how much Senku cares about others without explicitly stating it.  As well as nitpicking this show for details is dumb as shit lol.    Yes I have experienced this exact same feeling. I use glasses lol.",1
247,Making the clear glass itself is crazy difficult as well. Glasmaking is closer to an art than it is a science.,0
248,Which is precisely why Kaiseki exists. He’s the artisan.,2
249,"Sure it would be a lot of effort to grind the glass down, but they aren't opposed to grueling manual labor to get what they want. Making the other glass stuff would require artisan skills, however, which they lacked.",1
250,"That's not my point. First of all, I've said it in like 8 different comments this is meant to be overlooked and nitpicking it removes from the enjoyment of the scene. As well as showing how much Senku actually cares about others without explicitly saying it. Because ultimately this was a very deliberate choice to help Suika.    Second of all, it's not a matter of effort it's a matter of it would be straight up useless. Making glasses is literally just as hard as any of the other artisan glass work. Just fucking grinding down a glass sheet isn't gonna give you a working usable lens lol.",1
251,"     well of course, they needed her labor potential!     evilgrin",1
252,Glasses are a great source of delta-l,1
253,she's great at resource acquisition.,1
254,Suika's labor potential LMAO everytime Senku gloats over his plan is just so funny LOL,1
255,I think that's one of those tropes that legit happens all the time irl,2
256,"     This society is developing really fast, they've already created toxic masculinity.",1
257,Such a nice tender moment when Suika could finally see the things around her and her friends clearly     araara,1
258,That face reveal deserves a stitch.     wow,1
259,     When will our eternal suffering end?,0
260,Suika a cute! A cute!     squee,1
261,CUTE = SUIKA,1
262,"Senku just loves humanity. It really is what makes him interesting and not just another ""I'm too smart for people to understand me"" type.    Cheerleading for the dignity of the human spirit is also the reason I really like No Game No Life.",1
263,"This is why I love this showmanga so much. He's just so optimistic and that's something that's always wonderful to see, especially in a male protag. That he's hopeful, eternally and with a ""we can do it with a bit of science"" attitude. Not happy go lucky but just... hopeful.    That's so refreshing.",1
264,"Which is soooo much more the real spirit of a scientist than the ""loner genius"" so many series have. Science has always been built off the backs and the works of others in the scientific community.",0
265,"Exactly. No man is an island and Dr. Stone proves that, every time that Senku while he can survive barely on his own, he needs his comrades to  succeed ",1
266,"ya and when old man Kaseki shows up. This is the main reason why Tsukasa plan is bound to failure.     Years of experiences isnt something that can be learn from textbook, nor is it something that ""pure hearted"" kids can mastered.     Sure, there are assholes adult, but meh, there are assholes humans nonetheless, right now he is strongest because guns have not been invented yet, but as soon as he is injured or if he dies, his empire will collapse.",0
267,I love how much this show just appreciates things. It's a lot like Mob Psycho 100 in how it pushes back against the cynicism you get from so much pop media and reminds you to be grateful for the world.,1
268,"Wow, it explains why I love both of the shows so much",1
269,"I love how Senkuu embraced Chrome as a fellow scientist not for how much knowledge he had, but for his natural curiosity which, in the end, is what pushes science forward.",1
270,"That's why I love ""Humanity fuck yeah"" stories or where a guy gets sent back in time and spurs on technological revolution like Lord Kalvan of Otherwhen or Release that Witch",1
271,The reverse of that would be Shinju no Nectar.,0
272,No Game No Life throws out some other kinds of   cough   sexual  cough   dignity though haha,1
273,     It's rough and coarse and it gets everywhere,2
274,Is it possible to avoid this resource?,0
275,Not from a non-believer of SCIENCE.,2
276,It’s treason then,0
277," Dory enter the chat  ""i love sand, sand is squishy""",1
278,rprequelmemes,2
279,"Jesus Christ Kohaku, They're Minerals!",2
280,"It's called Dr Stone, just gotta keep with the title drops.",2
