,Comment,Sentiment Rating
324,"im regretting how i gave up on the manga so easily last year, only made it to the manga equivalent of them starting to make gunpowder before dropping it. if someone had just told me to hold on till the island arc i probably wouldve read the whole thing",1
325,My thoughts exactly. I was getting bored already from Taijou's big dump oaf with a hear schtick. But this episode was a breath of fresh air. This episode made things a whole lot better.,1
326,"What I like about Kohaku character is, a part of her strength and dexterity came from ""daily training"". She had been carrying a 50-litre pot back and forth a step hill several times a day in who knows how many years. For her sister. Damn siblings love is my weakness. She might be hot-tempered, easy to jump to conclusion, quite like a shounen male MC, a muscle brain, etc but she's strong, reliable, quick-thinking and best of all, genuinely care about those around her, not only her sister but also her friends. She's still my top1 favourite character till the latest manga chapter.  Also my top character based on manga newest ranking: 63182 .    And Chrome my boy! His voice here was just like I imagine. Can't wait for more of his spot light.    ""..There's always an idiot who'll try anything, and the shiny monkeys will inevitably create a technological civilization."" The science never lost, as long as there are human, who full of curiosity about nature, who want to grab the natural law in their own hands. The Human Technoogical Civilization will always rise, and rise and rise again no matter how many time you tried to shot it down. Because exploration is in human's nature. That simple line and Chrome introduction had moved me really much and the science-loving part of me cried out loud the first time I read it in the manga. And the part when Senku told Chrome about the stories that happened 3700 years too. Dr.Stone never failed to make me cry at simple things like that.",1
327,"She also has a verbal tic where she Naa's a lot.     Now that I think about it, the way all the characters talk is quite unique. I dunno if the manga's writing conveyed that or not, but it's a nice touch from the VAs and script.      edit: tic, not tick ",1
328,"On the same note, I love Tsukasa because he's Captain America in disguise!!!  s",1
329,I was really starting to tear up a bit and Chrome just went and cried. That moment was just beautiful,1
330,"This episode was everything. Science, comedy, emotion. This series just gets better and better",1
331,"A weird thought, but in this new society the term scientist could totally become synonymous with mage wizard. I can just imagine Senku running around shouting that he's the imperial wizard, head of the new nation E=MC 2 and that all other nations need to submit to his empire of science.    Also, antibiotics is probably the best thing he could make right now. Improving the lifespan of the average person will greatly increase the speed of their technological advancement. Just imagine where we'd be today if the founding fathers of modern science lived as long as we do today.",1
332,Clarke's Third Law: Any sufficiently advanced technology is indistinguishable from magic. Senku may as well be a demon lord in the stone world.,2
333,New LN title: I was reincarnated on earth 3700 years after the apocalypse as a demon lord?,2
334,Is dr stone an isekai,2
335,"It is, in a weird way. And we all got tricked into not seeing it as one.",2
336,"And lately some isekai have been pulling that ""trick"" of later in the story revealing that they are still on Earth but hundred of thousands or maybe millions of years in the future.",2
337,So just the ending of planet of the apes?,2
338,Planet of the apes is an isekai...,2
339,"Arguably, the twist of Planet of the Apes is that it's  not  an isekai.",2
340,"Fun fact, that's an adaptational issue. The original novel  totally  was an isekai.",1
341,"Based on the  wikipedia summary , I don't think that's correct. The reveal is simply discovered by going on a circular return journey via spaceship rather than seeing the Statue of Liberty.",2
342,"Based on having read the novel just a few weeks ago, and then rewatched the movie right afterwards, I'd say it is. I don't think the point of the ending was that it was Earth all along  and for some reason, the spaceship ends there by mistake...  twice  , but rather than they were two different planets, and just when the guy goes back thinking he can bring the lesson home to stop it happening, it had already happened in the time he was away.    The ape civilisation in the books is much more modern compared to the one in the movie  in the movie, that was toned down for money reasons, it was cheaper to have them be more primitive , because they basically straight out took over from the pre-existing technological human civilisation. If it had been literally the same - down to the last city and monument - the protagonist would have been able to tell. Besides, he straight up comments multiple times on how different the sun and moon of that planet look from the ones of Earth. And it's not passed enough time to justify those things changing naturally in some way.",2
343,"Okay, I concede that you're right then.",1
344,Scrapped Princess did it first I think.,1
345,Which isekai are doing this? I'd really love to see them.,1
346,"I can't think of animated one at the moment but a couple recently made that reveal are  ""The manga Parallel Paradise, this one is very, very NSFW. And the light novel 'How a realist hero rebuilt the kingdom', both are still dealing with that new information. "" ",1
347,"Lately? Now and Then, Here and There did that two decades ago. Isekai was a thing in the 90s, it just wasn't LN garbage.",2
348,Futurama is an Isekai now.,2
349,"So we've been tricked into watching another Isekai? Damn, first Zombieland Saga tricked me into watching an idol show and now this.",2
350,Ohayou  I sekai Good Morning World!,2
351,"As Gigguk said, everything is isekai.",2
352,"Dude, I'd watch the SHIT out of an isekai where a Senku-like character calls himself a demon-lord and people think he's sorcerer in a fantasy world.    Something like GATE or Suisei no Gargantia, but exclusively about science.",1
353,"IIRC the manga about an isekai'd pharmacist has this, partially. The modern knowledge of medicine makes him a godlike healer.    I say partially because after a while he learns actual magic.",2
354,"Real talk, why do all LNs do that bullshit with their titles? Is the market so oversaturated that you only have your title to grab the attention of the customer?",0
355,     I'm not sure I can. Senku loves science too much to gussy it up as magic. Even in this episode people kept saying 'magic' and sorcerer' and Senku just kept correcting his title to 'scientist'.,1
356,I wonder if he'd prefer the term alchemist since alchemy was a more scientific magic.,2
357,I mean he just used a philosopher stone this episode...,2
358,"Alchemy isn't just a fantasy magic thing, it was the legitimate precursor to chemistry.    Also to note, it's much less broad than ""science"", and senku will be doing more than just chemistry.",2
359,"   Kohaku Stitch        Ruri Stitch     So I'm guessing Kohaku and Ruri are twins? I am curious about Ruri's sickness.  Her only symptoms so far from what we've seen are coughing and a weak constitution. Senku  creating an antibiotic for her isn't a bad idea , even if Ruri doesn't have an infection, the antibiotic can still be useful to someone else in the future.     Chrome is a fun character!  There's really no stopping humans and progress. If Tsukasa wants to stop all of science then he might as well kill everyone who's alive in this world.       I do wonder what generation Kohaku and Chrome are. If the first human has awakened around a hundred years ago like Senku is guessing, they're probably around 4th or 5th generation.",1
360,     Oh dear. This must be the mysterious Anime Disease. She's not wrong about only having a little while left to live.,2
361,She probably got hit by the most devastating weapon known in Japanese history -   the atomic bo..   ..anime rain!,2
362,Isn't it the common truck that is the most dangerous?,2
363,What's dangerous about a teleporter to a fantasy world where you get super powers and a harem?,2
364,"Because not all trucks are equipped with a functioning Kadokawa Device. Secondary characters, as far as we know, get this a lot.",2
365,I mean you never know. Maybe that truck from the first episode of Death Note had a Kadokawa device on it as well.,2
366,"Your fantasy world might be Konosuba, where you get neither of the two.",2
367,"Technically he could have gotten a super power, but he chose to take something useless with him instead.",2
368,"Nothing, as long you don't teleport bread.",2
369,"The biggest tragedy of Dr. Stone isn't that humanity was turned into stone, it's that without humanity to maintain Truck-kuns throughout the world the common delivery system for new people and heroes for other worlds has dried up.    Imagine how many other worlds have been wiped out because useless goddesses and other deities called for help from careless or unlucky teens and nobody ever came. Tragic.",2
370, visual aid ,2
371,"Is this Itachi’s ninja cancer again? Oh no, she’s going to have to awaken Kohaku’s mangekyou sharingan right before she dies ",2
372,I heard the only cure is to consume at least 3 hours of anime per day - In such a primitive society it's diseases like this that really threaten the population,2
373,I'd say the fair question as to what generation they are begs another question. If they are a fourth or fifth generation you'd think their ancestors would've passed down stories about the world as it had been before right? I mean we haven't really gotten into any kind of worldbuilding about these villagers yet but if they have no knowledge whatsoever about the world as it was before  even knowledge butchered down and metaphored the hell out of through the long game of telephone called human history  it may indicate that they may be older than that to the point where the stories have been forgotten. Or if that's not the case and these are in fact fourth fifth gen humans that begs the question as to why their ancestors didn't tell them about the world as it was before.      In either case I am most curious to see if these questions get answered.,2
374, A reenactment of the first generation trying to explain technology. ,2
375,True. But on the other hand humans are just as capable of coming up with religious beliefs as they are at scientific invention. Though whether it's something to do with the past or something more recent they've thought up it could go either way.,1
376,"All I can think of is the first generation were knot knowledgeable about science  or not as much as Senku , maybe they were teens, or homeless people idk, people who could survive barely by themselves.",1
377,"These questions are in fact answered in the manga and should happen eventually this season, though I won't give you a timeframe beyond that",1
378,"I agree with this. Especially when the guards at the gate said that everyone outside is criminals who was banished from the village. They might not even remember that there are alive humans in the stones, but just think of it as something natural to their nature. Thus this generation might spann back a long time for their origins to be forgotten.",1
379,"Even if she's dealing with some viral disease, due to the lack of knowledge about hygiene or medicine and limited available treatments there's a good chance of contracting a bacterial infection like pneumonia.    The other easy medication I'd expect him to produce some kind of basic anti-inflammatory medication. Of the three plants we were shown, Felwort would make the most sense for a fever. Canker root can help with symptoms of Malaria but we can safely eliminate that as she'd already be dead. Sweetroot shouldn't even be in Japan so Senku should stay clear of it.",2
380,Sounds reasonable,1
381,"I had forgotten Kohaku mentioned Ruri had gotten sick recently, so originally I thought ""well maybe she's anemic.""     After her coughing though, it's definitely something simple like a cold. There's probably enough herbs in their area that could help with the symptoms  like the ones we saw and you mentioned , but if it's a cold then all they pretty much need to do is to make sure she's hydrated  water and herbal teas  and make sure she's getting enough vitamin C and all of that.    Though if it's just a cold and it's really debilitating her, she  could  be anemic  I don't know why that's sticking with me so much  or have something worse.",0
382,"I doubt it's anemia for the sole reason that that's not something Senku can really treat, especially as their deit likely contains lots of fruit & red meat so iron & vitamin levels should be fine.    Her collapsing due to the cough matches up with a bad chest infection, probably from pneumonia, which is also conveniently treated by antibiotics.",2
383,"That's true. I also can't imagine they don't waste iron richer organs of the animals they eat like the liver, kidneys, and heart.     The biggest thing would be that hopefully Riru doesn't have and autoimmune disease as well.",2
384,I assume Senku thinks it's TB.,2
385,"That's a possibility. I was puzzled when he said antibiotic, but animal TB can infect humans. But if so, she'll require treatment for months. I'd also expect Senku to go for a synthetic antibiotic - some, like  isoniazid  are relatively simple chemicals, compared to trying to find the right mold or bacteria and cooking away for years.",2
386,"Isoniazid would only work if it was TB or another mycobacterium though.  Senku can't be sure what she's suffering from at this time - in addition to TB, it could be another bacterial infection such as pertussus or pneumonia, a viral infection, exposure-based like emphysema, or something genetic.",2
387,"I was thinking TB in particular because it has a chronic form - most bacterial infections quickly kill you, but you can suffer from TB for years and still survive.  She's probably a bit young for chronic exposure problems like emphysema.  In my opinion, a heart lung injury or deformity, whether congenital or acquired is the most likely problem, but that wouldn't be treated using antibiotics, so given that Senku has decided to make some as a treatment, I think TB is his guess.",2
388,"That is the thing I am most curious about!     It seems like Senkuu is implying that people most have un-petrified hundreds of years ago, and these are decadents of those people.    That still doesn’t explain why nothing was passed down at all?    I would also love to get a canon answer if Senkuu’s hypothesis is correct. Like technically, it is possible that maybe some people never got petrified to begin with.    Either way is fine, just please give us an exact explanation!",1
389,By passing down do you mean stories of how the world used to be? I could give you a spoiler answer but am using the app so can't do tags,2
390,It seems like a lot of people have implied that it will be revealed soon. So you don’t have to do that.    I just wanted to know if we would indeed get a canon answer on how this new civilization started and why they know nothing about the old civilization. Which it sounds like will be explained.,2
391,Yes. Should be within a few episodes,2
392,"I've been thinking about this.    It's very possible that a few average Joe's got unpetrified. But since they're average they couldn't do anything other than make basic structures and have babies.    How useful do you think you'd be if you woke up in that world? Sure you'd know about how the world used to be, but odds are you would not have a clue how to science anything. All you'd be able to do is tell stories of how things used to be. Hundreds of years later those stories would become legends and myths if they are remembered at all.",2
393,Would twins be referring to each other as big sis smaller sister?,2
394,"One came into the world first, so even with twins you have a big sister and a little sister.",2
395, The onee-chan privilege         gintamathispleasesme ,2
396,like a certain pair of twins from RE: Zero.,2
397,"The Nakano quintuplets don't, but they are just one example, so who knows.",2
398,What are you talking about? Ichika is the big sister there.,2
399,But no one calls her that.,2
400,"yes, in anime i've definitely seen that before, blue exorcist has the twin brothers have that dynamic, or at least have the younger one call the older one as ""big brother""",2
401,Twins might do so playfully or if the society placed emphasis on first born privileges.,2
402,"They aren't twins, just sisters that look alike and Rui is the elder",2
403,They are not twins but it's a really small town I don't think there is much genetic diversity.,2
404,"Maybe Chrome told Senku a bit more about her, off screen. Maybe Senku conclusion is pneumonia, who knows. I does make sense",2
405," ""If the first human has awakened around a hundred years ago""  Why a 100?",2
406,"Huh, so that one in the OP is Chrome, not Taijou...",2
407,For some reason I thought all those jokers in the OP were all going to be from being unpetrified and was extremely confused why Senku would let out a kid and an old man.,2
408,"Haha, yeah that too.",1
409,"Trust me,  that  old man would have been worth unpetrifying...",1
410,I'm glad I'm not the only one who thought he was Taiju with a headband lol.,1
411,I noticed that as well. I was curious about when the 2nd protagonist was going to appear. What role do you think he will play? Like kirito and eugeo role? Senku being kirito obviously.,1
412,Maybe like Holmes and Watson?,2
413,Phoenix Wright and Apollo Justice?,2
414,Probably like a Doctor to a Nurse.,2
415,"Low-key at first I thought the same too. Specially when Senku was about to get killed by Tsukasa, I thought it'll be a change for Taijou in honor for Senku.",1
416,"yeah when they showed everyone in a blue robe I was like ""OHH, so Taijou is gonna become one of the villagers with Senku, awesome!"" and then Chrome appeared and I realized who it was",1
417,"I love that it takes Senku all of five minutes to realize that he's dealing with a real scientist in Chrome, even when the kid himself claims to be a sorcerer. Someone who collects everything he can and learns as much as he can about what he's collected. That's the beginning of the scientific method. Certainly not all of it, but Chrome was getting there, even without Senku's help.    When Kohaku was thinking 'Why are these idiots so impressed with rocks', Chrome was demonstrating what he'd learned from them while Senku was gifting Chrome with what he already knew about them. Everything in that hut is marvellously useful. Chrome knows that. Senku is going to show him  how .",1
418,"Wow, I'm surprised, not only did the secret Joestar technique manage to survive 3700 years but it has also evolved. The Joestar bloodline is strong in Ginrou...",2
419, Gyarus also seem to have evolved         ero ,2
420,The middle one has an Ara Ara Aura,2
421,"Uh, do you know what a gyaru is? Cause those aren't gyarus.",2
422,"don't you get it? they've E V O L V E D, beyond our comprehension and understanding of current day gyarus.",2
423,Are you talking about the super tanned girls with drag queen level outfits?  I think that's like extreme gyaru.  I've seen characters labeled gyaru just because they wear some makeup   jewellery to high school.,2
424,The one on the left looks like Nico.,2
425,the twin tail one is cute,2
426,Ginroustar.,2
427,"Chrome's quite the eccentric guy, I appreciate that he represents the drive for scientific progress regardless of era. Rather nice of him to collect a bunch of materials that Senku needs to start his advancement.    Chrome really took that History lesson to heart, his scientific curiosity is pretty refreshing. I guess medicine really is the first important step here for them.",1
428,"The new direction they are taking is pretty good, even if it dragged on a little too much with waiting around for exaggerated reactions.    I hope they don't instantly let Senku persuade them, and we explore their cultural slowly accepting his fast-paced science revolution.",1
429,     Obviously once he heals their leader they are going to get behind him in full. That's why she's sick.,2
430,"Yeah that will likely be the case, but I'm hoping for at least some resistance.",1
431,I felt it could go either way honestly. The fact senku set up a little work station directly in front of the gate that they specifically mentioned he's not allowed to pass makes me think it could be half and half. Like he'll be working on medicine where everyone can see and probably ask questions as to what he's doing. He'll probably earn their trust except for the gold spear guy until senku asks to try the medicine out on the girl. Probably by taking some first to prove it's not poison or offering his life if she isn't cured. That would be my guess as to how it might play out.,1
432,"Like with most societies it will probably have 90% accept it, but then have 10% still be scared of change and will resist, potentially violently.",2
433,Kinrou already apply your idea for resistance,2
434,"I see why you want the resistance, but I hope if there is any it's actually done well.  Usually when that type of stuff happens in any story it's annoying and empty filler.  I'd like to see there actually be emotional stakes, maybe people go over to Tsukasa's kingdom and it creates emotional stakes.",1
435,"Ah yes the whole we have one problem we think is impossible to solve but is deeply important to us.            You solved it? Damn, but uh, grrr....",1
436,The resistance will come before the cure. Why would they let some random outsider just feed a strange magical substance to their sick VIP?    They'll need convincing.,1
437,"     This is hilariously cruel from a in canon perspective     Rui: why, why am I here, just to suffer?      Bochi: well yes, but actually yes you're just a plot device       Rui: surprised Pikachu",1
438,"on the one hand it  is  awfully convenient. On the other hand, their reason for keeping him out is pretty nonsensical. ""Outsiders aren't allowed in the village, because the only people outside the village are people who were exiled for crimes. You were clearly not exiled because you were never part of the village, and honestly the existence of  anyone  else should be kind of causing us to re-evaluate our assumptions about the world, but fuck it you're not coming in anyway.""",0
439,When they said that I assumed that they assumed that he was the offspring of an exile.,2
440,Yeah that's the implication,2
441,"Being suspicious of outsiders and not letting them in makes sense to me.    They're a primitive society with little if no knowledge of history and seemingly the outside world  which in world without telecomms and motorized travel makes sense, they wouldn't stray that far from water and their village .  The only people they know of for sure are people they're exiled from their village. They also know how fragile their community is.  An unknown illness or invasion could kill them all.    So they keep out anyone they don't know.",2
442,"I don't think you understand tribalism and how core it is to humanity.    Senku has shown them no benefit to his presence in their village, and letting an outsider in could cause any number of negative things.",2
443,Curious on why Senku thinks Ruri has a bacterial infection. Could be anything but hey I'm still hyped.,1
444,"Well, even if it isn't, making antibiotics should always be a priority if the resources are available. He probably decided to make it as if it is that it can be solved, and if that doesn't work then he will know that that's not the cause of her illness.",1
445,Gonna turn into an episode of house. Lol,1
446,"It's lupus, obviously!",2
447,But it’s never lupus,2
448,Except for that one time,2
449,"Hey, it actually might be.",2
450,1. Make antibiotics    2. Make Vicodin,2
451,Dr Stone is a medical drama.,2
452,clearly what we need to cure her is mousebites,2
453,If it was a virus and her immune system didn't take care of it then she would either be dead or symptomless. A long term illness like this is almost exclusively the realm of bacteria. Given the health of the sister it's unlikely to be genetic either. But really it comes down to the fact that if it's not bacterial then there's nothing Senku can do to help anyways and this is his best shot to get the village to accept him quickly.,2
454,"Well, since they won't let him into the village to examine her, that's probably his best bet. It's definitely a gamble.",2
455,"I mean it makes sense, if it was something simpler they would have cured it by now. If it’s not bacterial then senku probably wouldnt be able to make a medicine anyway. Antibiotics cover a lot of different areas",2
456,"pretty much this. Treating viruses is way harder, and antibiotics would cover most bacterial infections unless they're resistant which is probably less likely when the selective pressures of antibiotics hasn't been around for almost 4000 years. ANd if it's genetic she'd be pretty fucked even with modern tech",2
457,"Yep, its the shotgun approach, and considering their living conditions, a bacterial infection is extremely likely if its isolated to a single person. Viruses tend to sweep through a population and hes heard no mention of it being beyond a single person, so it'd be a safe play to assume its bacterial in nature.",2
458,It's the easiest thing to directly treat if you know about it and the chance of some secondary bacterial infection coming in whilst her immune system is weakened is pretty high in a world with little to no knowledge of medicine or hygiene.,2
