,Comment,Sentiment Rating
491,"YEAH same honestly, thats literally how i felt. i was like ""coulda been cuter"" and at the end of the episode i couldnt stop thinking about how cute Suika was",1
492,"I'm personally really thankful for Suika's voice. She's one of my favourites in the manga, but having an overly cutesy little anime kid voice could have been a make-or-break deal for me enjoying her in the anime.     Fortunately now she sounds closer to an actual child than an anime loli child!",1
493,read it ! you would appreciate the anime more,1
494,This is one of the few series that I somewhat regret reading the manga first. There are so many things that happen that are weeks months away or might even be saved for season 2 depending on the pacing that only being able to watch one episode a week is torture.,1
495,why does that make you regret reading the manga first? that sounds like a point towards why you would read the manga,1
496,I will! Most likely as soon as the anime finishes because I like lo look forward to the next week not knowing what happens next,1
497,"I've regretted reading the source for anything that got an anime adaptation.  I'd only read the manga LN if I was sure it would never be adapted ever.    If it's something that's actually being adapted right now, I see no reason to read spoilers for it",1
498,That's how I feel about stuff that I already read that THEN gets an anime adaptation like Shield Hero and Fire Force.,2
499,"because most adaptions  like this one  will only be adapting like a quarter of the released material, and will never catch up, or because adaptions are very hit or miss and can be worse than their manga  not like this one ",2
500,"Ya, I made the mistake of reading the source after a partial adaptation... Only for season 2, etc to be released.  Not worth it to read the source",1
501,"a 2nd season might take years to come out, and some shows will never get more seasons. even if they do it might require multiple seasons which adds up to multiple years of waiting    id rather just read the source, catch up, and join in weekly discussions. theres been lots of times where the gaps between seasons are so long i forget the last one or lose interest",1
502,Not sure why you're being downvoted. The manga is amazing and deserves a read.,1
503,I plan to once the Anime is done.,1
504, I wonder if the other μ's are awake? ,2
505,Nico Nico Niianderthal,2
506,r cursedcomments,2
507,I need to see some fanart of that,1
508,I wonder if they have the same VA because she sounds  really  similar to Nico.,2
509,her VA is Reina Kondō,2
510,Best girl Suika is finally here        wow       She's too precious been waiting for her,1
511,"Not sure how much credence I should lend this, but taking into account the village's high number of blonds, the seemingly ubiquitous interspersing of English phrases, and the weird way in which they hold their chopsticks, I think there's a high probability of the village's first generation being non-Japanese.    That and the lack of Dragon Quest knowledge.",2
512,How come the girls look like they walked in from a different anime?,2
513,"Boichi has one of these things where the guys all look different enough to stand out, but they all look like from the same manga. The girls however vary. Ruri  which I just found out if I use spellcheck, I’ll get furious if I try to spell her name  and Kohaku look the same, but every girl in the show has a good design, but you could see them in being different mangas.",1
514,Yup hyper 90s moe face with pinup anatomy is kinda his trademark. It's less pronounced in Origin though. I like how   all three  basically listed the traits of Tsukasa. They'd probably review their criteria if they actually met him though.        smugtouru ,1
515,     Or not. Because to be fair who would pass on an opportunity to date a 10th generation Joestar,2
516,Ayayaya,2
517,Gotta put some omph to that. Allow me.       AYAYAYAYAYAYE  ,2
518,      ,2
519,"The long lost descendent of Bruno Buccellati, just missing the stand",2
520,"Senku's not a stand user, so maybe we just weren't able to see it.",2
521,Senku's Stand name is S.C.I.E.N.C.E,2
522,Senku     Stand Name: She Blinded Me With Science,2
523,Ruri and Kohaku are sisters soooo... them looking similar is kind of the point?,2
524,"Yeah, that's why they don't look out of place. The other girls thus far, feel like they could be in different manga and wouldn't look different there",1
525,Ruri and Kohaku are sisters so they're supposed to look the same.,1
526,stone world nico nico nii,2
527,The Love Live anime we've all been waiting for,2
528,"I've gotten a bit more used to it, the faces are still off but they are kinda blending in more now.",2
529,Boichi has trouble drawing girls,1
530,I think they have their charms.,1
531,Yeah for sure. I've gotten over the feeling I had towards them when the PVs first came out.,1
532,"Kohaku has been growing on me, but every once in a while I'll catch myself thinking ""man, those eyes are way too far apart"".",1
533,A perfectly good pair of charms,1
534,More like he has a unique art style for drawing female characters,1
535,"Well yes, I mean, everything arty has a unique art style. Art is subjective, after all",1
536,"No. ""Trouble"" means he couldn't draw them otherwise. ""Style"" means he could, but chose not to.    Picasso doesn't have trouble drawing people normally. He chooses to draw them weird as fuck.",0
537,I doubt it. He just likes to draw them that way.,1
538,"It's the new age version of  ""am I kawaii"" . Probably the thing I dislike most about the series so far.",0
539,All girls look like they are from Alabama.,1
540,Gives me a nostalgic boner.,1
541,Guys: o        o    Girls: O&nbsp;&nbsp;&nbsp;&nbsp;&nbsp;.&nbsp;&nbsp;&nbsp;&nbsp;&nbsp;O,2
542,Last two episodes really make me want to read the manga. Should I just do it?,1
543,"A few anime only fans did that last week and don't seem to have regretted their decision. I've been reading since the manga started and it hasn't spoiled my enjoyment of the anime so far.    I'd say just go for it. Worst case is you don't enjoy it as much as a manga, spoil a couple of episodes and then continue watching as an anime only. There are no real dips in quality so there is a lot to look forward to regardless.",1
544,Yup. Started reading the manga a few days ago and already read half of it. Its a great read.,1
545,Regret because it ruined their enjoyment of watching the show blind?,2
546,I did it after the third episode. Best decision I've ever made in reguards to an Anime Manga series. I initially only planned to read a couple chapters to figure out if Senku survived that battle with Tsukasa. Then before I knew it a couple days had passed and I ended up binging everything available.,1
547,Manga reader here. Try to read atleast the chapters covered in the anime. The pace is so fast in the anime you may missout absorb certain info,1
548,It's really short,2
549,"Senku is right btw. People have waged HUNDREDS of wars over food.    Cheese? The Limburger Cheese War    Spices? War.  quite a lot over this one particularly     Salt? Venice Vs Genoa    Bread? French Revolution.    Food is an important staple and not getting enough variety can lead to malnutrition or starvation. It could also lead to over fishing, destruction of farmland, and deforestation. This is even more important when you take into factors that their living essentially in the neolithic age... no concept of bread or any dish that uses maybe more than 3 4 ingredients.",1
550,"Food-wise they need to  improve  to reach the Neolithic. Bread is 30k years old, cheese predates written history, there are evidences Proto-Indo-European speakers already ate some gruels here and there  thus they had access to flour . They have nothing of that, they're sedentary but still hunter-gatherers.      I agree with you BTW, just felt like pointing this out. ",1
551,"So if we look at screenshots, they had grilled fish  salted . They also had fruits veggies nuts and what looked like basic meats  pork and sheep are common . They also have shellfish and other basic fishing village amenities. From this you are most likely right, which means they would most likely fight another village for hunting grounds or farming areas.",2
552,They don't have domestic livestock. And food they get is hunted game.,2
553,The British took over half the world in order control the spice trade and their food was STILL fucking bland.,0
554,nan,2
555,"If he's thought about it or is even interested, he probably decided that given the current situation it's actually a pretty big risk, and it would be best to wait until things are more stable and the tech level's gone up a good bit.    They don't have contraceptives, and not only was pre-modern pregnancy dangerous, it would also cause him to lose her help for a bit, and cut into the amount of time he has to do science, even if successful.",2
556,"Lmao he said that romance is too troublesome, so he probably doesn't feel anything towards her or any of the girls. Maybe he's asexual? I mean so is Luffy lol.",1
557,Senku's only waifu is science.,1
558,"Not that kind of show. This isn't your typical cliche harem romcom anime. The focus is on science, women are nothing but trouble.",1
559,Could be Asexual for all you know,2
560,"If science was a woman, he'd fuck her.",2
561,"It's not even that, there's plenty of side characters with crushes or romantic implications. Senku though? His gender is SCIENCE.",2
562,"I'd gladly tap that ass  I may or may not have looked for Boichi's hentai works just in hope I saw someone resembling Kohaku , but I get Senku. He simply doesn't care about sex or relationships, he cares about science.",1
563,"Did your, um,   research   come to fruition? Asking for a friend",1
564,"Nobody quite like her, but  this gallery   NSFW  comes quite close.",1
565,"The Stone World gets introduced to the omnipotent proverb of 'No Ramen, No Life'.",2
566,Man I wasn't expecting to like this show so much but here I am 8 episodes in and I already lost all of my self control and read 67 chapters of the manga.,1
567,How did you like it?,2
568,At first I had only planned to read up to where the show was and keep pace but I gave in and read from chapter 20-67 in a day and I will probably catch up to current here in the next few days. It makes me want to go play one of the tech mod packs for Minecraft.,1
569,"There's a good stopping point in the next 20 or so chapters if you want to take a break, but it's not like you have to by any means.",1
570,Can we talk about how Kohaku's tits are sometimes bigger sometimes smaller?,2
571,"Timeskips shown through her periods, Now that's science.",2
572,Wow thats a good way to show the passing of time. It seems like it took them 3 days from starting iron making to the ramen cart,1
573,Can we talk about how they're great no matter what?,1
574,The age old adage: all tits are good tits.,1
575,AMEN,1
576,"Great episode, Suika finally enters the show and I love her. Certain people are going to absolutely  love  next weeks episode.",1
577,"Sukia!! My favorite character has finally entered the scene! Plus we see Chalk, who is 100%, objectively a good boy. I mean, did you see his faces? That’s a good boy right there.    Seeing Senku go full Soma was really fun to see too! I like seeing him improvise on making certain stuff when he doesn’t have everything . Plus, seeing Senku use this as a way to conquer the village is interesting.    I also love seeing the world and how much it has changed from 3,000 years!",1
578, HUFF PUFF      ;    r nocontext,2
579,reminds me of this ,2
580,"Shougeki no Senku.      Did anyone else expect  Kohako to explode and lose her clothing when eating the Ramen?      Epic that it tasted horrible to a veteran ramen eater     does anyone else think Suika looks like Temmo AND she can stealth lol ;:          Now the anime is just getting better and better, senku teaching them about the world and starting to reveal some world building, sounds like ruri at least knows about the old world from oral traditions.",1
581,The facial expressions were on point this episode,1
582,"Oh hey!  I just wanted to point out that if, like me, you think this shows whole OST is one of the best OST's of the season, if not in general...    It was finally released in Japan! And there are of course youtube versions now!   Here is a link to the full OST! ",1
583," This made me lol so hard man.     I can confirm what senku said about lamen making us slave. I found out a lamen shop where i live, and now i eat there everyday. Don't fall as low as me guys  but it was worth it. ",1
584,Lamen? You mean Ramen? I know the Rs and Ls in Japanese are kinda iffy but Ramen is written and said with an R.,2
585,"Lamen, the particularly delicious ramen made from llamas.",1
586,With llamas and leeks and lettuce and lemons.    ...Ew.,2
587," The lemons are so, like, 1990s Bon Appétit.",1
588,"It's sometimes called Lamen in Brazil  country with the largest Japanese population outside of Japan  and as mentioned below, it's an L in the original Chinese.    It's easy for English-speakers to think of it as Ramen with an R, because that's how it was transliterated for us, but the actual word isn't that simple.",2
589,"I'm learning Japanese with 2 Japanese teachers, they very clearly say Ramen with a R not a L. One is from Kyoto  40 something  the other is from Tokyo  29 .    Up until now, in my studies the Japanese R is a ""normal"" R sound. Never have I ever heard it with the sound of a L.",1
590,"Well, ramen does come from the chinese ""la mian"", so not  entirely  off-base",2
591,"This is true. Chinese call it ""la mian"", and understandably the pronunciation of it depends who, how and when it was spread across cultures, including the language when communicating the foreign dish.",2
592,IDK is this is a hot take or not but Dr.Stone might be the best comedy anime of the year so far.,1
593,"Really enjoyed this episode! Love the new village.    Most curious thing is how Ruri knew about certain things from the old world?    Also, I loved in the beginning when the villagers made the “imagine the stone statues moving” comment! Little do they know haha!    Man, I still hope we get an actual answer and how these people are up and about. Didn’t certain people never turn to stone? Did some people wake up like 400 years ago? Why does this new company civilization know nothing about the old world?    Like I just want answers!!! UGHHH!",1
594,They do know about Momotaro though...,1
595,Wish these episodes were longer they go by too fast,1
596,Same. I got frustrated when this episode ended because now we gotta wait another week for the next one!,1
597,Elders: we'll let him live aslong as he doesn't do anything strange.    Senku: let me show you the wonders of ramen.,2
598,ravioli ravioli don't lewd the melon loli,0
599,Probably too late.,2
600,"this has to be intentional- when the girls are describing what kind of man they like, it's literally tsukasa who fulfills all their criteria. makes me think this is foreshadowing some kind of split in the village. espicially since there are so many people who violent and are suspicious out outsiders and technology, making them easier to manipulate via fear of the unknown. there is going to be a tsukasa faction and a senku faction in the village.",2
601,"Must have missed it in the manga, but I had no idea suika was Japanese for watermelon!!",1
602,"Yeah on the Character introduction page for the 40 villagers, all their names are translated, and mean something. Most of them are based on Ores or Compounds.",1
603,Koizumi-san would be proud.,1
604,I liked that Fist of The North Star reference.,1
605,"Is that what it was? I mean I could have guessed, that character design is a bit iconic, but I would have been lost if the reference didn't come with the visual bit.",2
606,I'm loving this anime way way more than I initially expected,1
607,"Same. I was expecting Vinland Saga or Enen no Shouboutai to be my favorite this season, but Dr. Stone has quickly surpassed them.",1
608,"Is anyone else distracted by shipping?     I don't usually have this problem, but as each character interacts I find myself encouraged in each spark of a ship.     Kohaku mentioning that Senkuu is attractive enough, Senkuu noticing her talents, Chrome's crush on Ruri  rules out Chrome x Kohaku , and of course the best new ship of the episode: Suika x Watermelon.",1
609,"i thought senku was going to invent deep-frying at first.    if this keeps up, this will be my anime of the season, maybe even aoty.",1
610,This whole episode I was like OH HE'S GONNA MAKE BREAD    OH HE'S GONNA BREAD THE CHICKEN,1
611,this show went from ok to me just loving the hell out of this show because of the new characters and senku and chromes friendship is just so much fun to watch. these last to episode made this show my favorite this season.,1
612,"Without giving you spoilers, since odds are you don't read the manga: if you love the characters it'll get even better.",1
613,Oh my gosh Suika is so adorable     I wonder how she fits her whole body in the helmet. And I love how she's casually eavesdropping on the whole village without anyone noticing     Kohaku in her swimsuit or underwear?  Sign me up haha    I really like Senkus 10 billion percent catchphrase. Those sinister faces he makes when scheming is so hilarious    And we get a dose of Shokugeki no Senku LOL    This anime is really interesting and very novel to me. Looking forward for next episode : ,1
614,"I absolutely love this anime. Just the sheer process of bringing back the ""old world"" science and technology to the amazement of the new world civilization is both thrilling and satisfying. I love the OP and listen to it almost every day. The ED is the perfect way to end an episode. Just... this is such a good series. Even began reading the manga again  forgot to keep up .",1
615," RAMEN! THE FOOD OF THE GODS!          comfortfood       ""Maybe the stone statue people started moving."" HAH Well your not wrong.      Wow Jane's dad is a real peice of work, disowned her.      Yep, cant do blood tests to figure out whats wrong, best bet is making something general use.      Wow thats a lot of steps to reach.  I guess were movin fast.        Monkey's mind is blown hahaha, the planet is moving!      Oh shit the axis shifted over the years.  Who woulda thunk it.  GUess thats when Senku's starin was off.      MONKEY MADE A COMPASS!? OH SHIT! NICE WORK!      MELONLORD HAS RISEN!  SHES SO KAWAII!      Momotaro?  Gorilla's too, didnt even think about it.  Preistess is from modern times maybe?  Hmmm... but shes Jane's siter right? hmm...        FIREEEEEEEEEEEE!!!!!!!!!!!!!!!!!!!!!!!!!!! JESUS CHRIST THATS NIGHTMAREFUEL!      All that work for nothing... rip... iron is harder to make i guess.       Send in secret agent Melonlord!  Find everyones weakness for domination!      God these primative Gals are funny... hahaha       Wow Jane thinks Senku is attrative?  WEW BOY        DOG!? WE GOT A DOG TOO!?  AW YEAH!  GOOD BOY!      Grain?  Gonna make wheat?  Millet flour?  Wow nice work Senku!      WAIT HE MADE RAMEN!? HAHAHAHHAHAHA!  THIS IS AMAZING!  Wait iots not even perfect and they still like it haha.      HE MADE A RAMEN CART!? HAHHAHAHHA I LOVE THIS!  Oh man hahahaha this is good.",1
616,"When I see ramen, all it reminds me of is Naruto and his 35-year old self still going to the same ramen place every single day. I don’t if I should feel depressed or happy.",1
617,"     It's actually pretty expected, the Earth's axis does a full turn every... 24,000 years or so? Can't remember the exact number. But 3,700 is enough to see an effect. That's why this is a tiny but beautiful detail IMHO, it shows us Senku's human, fallible side. Rationally, he ought to know that much, since so much time passed. But he still doesn't fully grasp the  enormity  of it, and so a part of his mind ignored it. No one learns about precession of equinoxes and thinks they'll live long enough to see it with their own eyes.",2
618,"     I wonder how difficult it would be to build more efficient bellows, like pedal-operated",2
619,Why are you calling Kohaku Jane? Am I missing something.,2
620,Tarzan is man ape.      Jane is woman ape.,2
621,Ah.,1
622,I give everyone nicknames in shows to help me remember.  They are usually pretty straight forward names.,1
623,Better than me. I usually forget nearly everyone's name if they aren't said constantly.,1
624,"thats why i give nicknmes, helps with that.",1
625,Glad you've got something that works for you.,1
626,New season of Food Wars looking good,1
627,I'm not gonna lie.. I find Senku and Chrome a cool DUO,1
628,The reaction faces in this series are honestly the best.,1
629,You ever watch the documentary channel and love the full hour or more episodes? That's the type of show i believe this should be. It's really interesting but doesn't feel long enough. I feel like if i would have watch this after all 24 episodes were done i would enjoy it waaaaaay more. But it's too late and i'm hooked so o well.,1
630,Looks like it's time to wake up  Kozumi-chan ,1
631,"This has to be my favourite new show. Action, adventure, comedy, so many elements all played out so cleverly. I wanted to see them serve that ramen up so bad then the episode is over before you know it",1
632,I like how he has the recipe to litterary everything in his head. From pencilin to ramen down to the very specifics.,1
633,"He doesn't need the  recipe  for the antibiotic he's going after; on the first episode it's already shown he has good Organic Chemistry knowledge  making gasoline from plastic - most likely polyethylene , he needs some suitable raw materials and the  desired structure .    The most awesome part of this anime is, for me, those things are actually believable. It's Primitive Technology, version manga.",1
634,"Thanks for that, you're the first person in the thread who linked to what the hell he's trying to make. I had never heard of Sulfanilamide.    So if I understand what the plan is, he's gonna get some gum benzoin, distill it into benzene, turn that to aniline, turn that to acetanilide, turn that to 4-acetamidobenzenesulfonyl chloride, then turn that to 4-acetamidobenzenesulfonamide, and finally turn that into sulfanilamide?    Man, I don't know anything about chemistry, but that sounds hard.",0
635,"Based on what's shown in the anime and the manga, plus my own knowledge:    1. Coal    2. Benzene + oxygen + ethylene    3. Urine    4. Salt    5. Phenol + ammonia    6. Sulphuric acid + sodium hydroxide    7. Sulphur trioxide + hydrochloric acid    8. Chlorosulphuric acid + aniline      This is some «NurdRage meets Primitive Technology» kind of stuff.",2
636,"The manga page has more detail, and it  shows aniline coming from coal . Not sure about the exact process.",2
637,"Having good organic chemistry knowledge isn't enough. What he's doing is designing synthetic routes with the random shit he can find laying around. That's mighty hard, and I'm sure the actual consultants who helped the mangaka do it  surely professional chemists  needed to check books and the internet to be sure of every step. Scientists don't usually memorise all this information.",1
638,"Designing synthetic routes isn't that hard; it's something I'd expect from Chemistry undergrads on their second or third year. Senku's brilliance is on the engineering aspect, he's able to pull out replacements for modern apparatus, while most chemists would freeze because they don't get a Bunsen burner or a glass fritter.    I agree the mangaka is consulting professional chemists. There are some simplifications here and there  e.g. urine doesn't  contain  ammonia, but you can produce it from urine , but the process looks too viable to be random.     On coal, you mentioned below: it's just pyrolisis. If you heat mineral coal in an oxygen-free environment you'll be left with coke at one side and tar at the other. Coal tar can be distilled into a bunch of aromatics, among them benzene.     The bitch is doing that without a fractional distillation column. But at least what matters  benzene  is the most volatile of them all, this simplifies a lot of things.",2
639,"Also getting an oxygen-free environment. They don't exactly have sealed tanks to fill with a nitrogen atmosphere  or whatever method is used to do this IRL .    Also, wouldn't undergrads who design synthetic routes still use aids? He's doing all that by memory, that's the amazing bit.    About the engineering, I mean, it's not like this show is very  realistic  in that sense - Senku's equipment always works  way  better than it has any right to. So I'd say that's mostly plot convenience, though the base ideas are still often very clever.",2
