,Comment,Sentiment Rating
0,"All this episode reminded me is how much I miss Chrome in the new manga arc. Seriously, he's the best.",1
1,I like how they adapted the scene where Senku explains everything to Chrome. It's more impactful and it allows the audience to get Chrome's emotions a lot better than in written form.,1
2,"I very much enjoy this scene in manga and again in anime.    Really make you appreciate how far the we've come, and how much we took for granted.",1
3,"An important foreshadowing on this episode for manga readers:      ""Ishigami village got their ""outsiders are evil people, just like stone statues"" from the island of origin, where the bad people are turned to stone by the chief people and dropped on the sea outside the island."" ",2
4,I wonder what the genesis of that is.,2
5,"I don't think so. My theory is that they genuinely don't believe there are any people in the world other than the villagers, and if there is anyone out there it  must  be someone who was exiled long ago, so they can't be good people.  ""I don't think they are actually aware of the other island even though they have Soyuz in their ranks  who we actually saw in today's episode! "" ",2
6,"Here's a full list of the villagers and their names that the anime has left out, 40 people in total     First    Second       Also this amazing page of a proud Senku ",1
7,"This comment has been removed. Untagged, or improperly tagged spoilers are not allowed.    To use our subreddit spoiler tags use the following code.    ` ""Spoiler goes here"" `    which comes out as     ""Spoiler goes here""     In Redesign, you need to  switch to the Markdown editor  to post spoilers.    Please reply to this message when you have fixed your spoiler tags to have it reapproved.    ---    Have a question or think this removal was an error?     Message the mods.         Don't know the rules? Read them     here    r anime wiki rules  .",3
8,"     I hope anime is simply shuffling the reveal order, perhaps  ""after senku becomes the village head"" ",1
9,"They said excluding the old people and the kids, so Senku's monkeysphere calculation recently wasn't exactly right it seems.",2
10,I can't wait to see my dear Suika next episode! uwu,1
11,I can't wait for my dear Suika to see.,1
12,"Yes! And to see my dear Suika's face. I've seriously been estimating which episode she'll be introduced in and counting down since the first episode.  That moment when she got glasses was so relatable for me, cuz I also have the fuzzy eye disease, not as bad as her, something like 5 20 vision now, but I didn't realize until I tried on someone else's glasses and I was amazed by how much of the world I wasn't able to see before.",1
13,Am I tripping or did they forgot the ''calculation battle'' between Chrome and Senku ?,2
14,They skipped it    Edit: nevermind that was it. They'll explain it later iirc,2
15,What ? I laugh my ass of reading it like BRUH...,1
16,"I hope they add it in later as an aside, just like they did in the manga.",1
17,It was in the episode around the 15 minute mark,2
18,It's expanded in chapter 18.    Edith actually I misremembered it. It's the same.,2
19,"     You didn't misremember. The details of arithmetic battle was inserted later as bonus pages.      EDIT:   End of chapter 22,  here you go ",1
20,Ah I see. Too bad they didn't include it. Maybe later in a special.,1
21, Are you referring to this at the end of chapter 18 as there is nothing beyond that ,2
22,My bad. Although I could swear Senku explained how he beat him at some point later. Some arrithmetrick was employed.,1
23," ""who's hungry for ramen?"" ",2
24,"I don't but I would really want a  ""coke""  right about now.",2
25,"It's all about the  ""cotton candy"" , my dude.",2
26," ""i like that they are adding little details like kohaku knowing some english words, idk if other villagers will speak it too. update: yeah kinrou and chrome did speak some english words too.. nice."" ",1
27,Not reading your comment because I'm not up to date but your spoiler tag isn't working.,2
28,"thanks, had to switch to old reddit just to have it work..  ",1
29,"Yup! it was a neat little thing, but really hammered the point.",1
30,What chapter is this on the manga? I want to start reading,1
31,Either 18 or 19,2
32,Next week Suika...with Gen as cliffhanger,2
33,Can someone spoiler the antibiotic he makes? Only the name. No details or if he considers a different one first but fails.,2
34,"it's in chapter 20. And the name is  ""'sulfur drug from rocks'"" ",2
35,"  Original comment by  u MagnoBurakku |  Top-level comment     ---    Here we go!    The beggining of the Village introduction arc, seeing Senku trying to win over the villagers with science is going to be a blast.    I love my  evil looking hero.     ---     This message was posted by a bot because originally submitted  outside of the Source Material Corner. ",1
36,"  Original comment by  u aaa1e2r3 |  Parent comment   r anime comments cr756a dr stone episode 7 discussion ex2exq8      ---    As a manga reader, all I can say for right now is that he is best boy and you will see why in the coming episodes    ---     This message was posted by a bot because originally submitted  outside of the Source Material Corner. ",1
37,  Original comment by  u Digivam143 |  Parent comment   r anime comments cr756a dr stone episode 7 discussion ex2n3uu      ---    Lol. It is amusing watching the anime only's jump to conclusions. No spoilers but it's actually explained and it turns out to be a lot simpler than that.   Let's just say we should all thank Dr. Jenner for his miraculous discovery.    ---     This message was posted by a bot because originally submitted  outside of the Source Material Corner. ,1
38,"I like the timing of the episode break.     ""The fact that he'll be going for a sulfa drug is a smart fakeout that isn't presented as a cliffhanger twist in the manga but works really well here - most people in the thread are guessing penicillin."" ",1
39,"  Original comment by  u cortez0498 |  Parent comment   r anime comments cr756a dr stone episode 7 discussion ex3u5cp      ---            ""In one of the latest chapters Senkuu 'creates' agriculture and one of the villagers starts crying because of all the people they lost over the years due to famine starvation and the problem was quickly solved by science.""     ---     This message was posted by a bot because originally submitted  outside of the Source Material Corner. ",2
40,"  Original comment by  u beqs171 |  Parent comment   r anime comments cr756a dr stone episode 7 discussion ex2sl0y      ---    Little manga  ""She has pneumonia, they will make an antibiotic pretty fats, something around 3 episodes""     ---     This message was posted by a bot because originally submitted  outside of the Source Material Corner. ",2
41,  Original comment by  u SomaSaiba |  Parent comment   r anime comments cr756a dr stone episode 7 discussion ex2ezy5      ---    Best boy will be there in another few episodes.    ---     This message was posted by a bot because originally submitted  outside of the Source Material Corner. ,1
42,"  Original comment by  u SpaceMarine CR |  Top-level comment     ---    Beware anime onlies, that blonde guy Ginro is the real villain of this arc    ---     This message was posted by a bot because originally submitted  outside of the Source Material Corner. ",0
43,"  Original comment by  u AnActualPlatypus |  Top-level comment     ---    Here's a full list of the villagers and their names that the anime has left out, 40 people in total     First    Second       Also this amazing page of a proud Senku     ---     This message was posted by a bot because originally submitted  outside of the Source Material Corner. ",1
44,"I loved the first 6 episodes but I'm already loving this arc twice as much.       Chrome's personality and character design makes him seem like he's the MC in a regular anime, while Senku is like the rival he's constantly trying to catch up with. It feels fresh to have them be on the same side",1
45,"     Exactly this. It became much more interesting as soon as Senku met the other tribe.    Before it was:     ""Senku and the gang from the modern age try to revive the world while a 10th generation Joestar tries to hunt them down""    And now its:    ""Senku uses his knowledge and power to move primitive people who never knew how amazing the world was from stone age back to the modern age. While the Joestar is nowhere to be seen.""",1
46,"     Oh boi, did Araki really manage to get to part 10 in the last 3,700 years? This is amazing.",1
47,The 3.7k years were just a really long Za Worludo for him,2
48,Can revival fluid de-petrify Angelo?,2
49,Yo Angelo!,2
50,It’s exhilarating!,1
51,     Am I the only one who thinks he just looks exactly like Kars?,2
52,“10th generation Joestar” Broke me,1
53,Dr. Stone is not far from being an Isekai,1
54,Chrome now knows how we feel about the library of Alexandria,1
55,And how we felt when the holy library of the unhappy panda that was lost to us in the modern age.,0
56,that came back tho,1
57,Wait it's ba-  Ohh shit ,1
58,Make sure to use https,2
59,wait it came back? I thought that panda was gone for good?,2
60,"it came back after like 1 week, some rich guy funded transfer of the servers",2
61,"wow, thank you for the heads up.",1
62,what is this unhappy panda thing?,1
63,It is better known as SadPanda.    It is the modern day Library of Alexandria and it was almost lost to us a few weeks ago.,2
64,And how we feel about censorship on the new library we call Internet.,2
65,"Nah, that we can still manage. But the library is lost forever.",0
66,Can we have an F?,0
67,Haven't seen anyone talking about how the villagers sometimes mix english words in their speech and Senku repeats them in japanese to make it more clear.    Its not something that can be easily translated in text like sub or manga.,2
68,"Yeah, I'm not fluent in Japanese so I'm sure I missed some times, but I realized that was going on when Kohaku said there were ""forty"" people and Senku said ""yonjuunin""  I think . It makes sense though, I'm assuming some of the revived people were foreigners who would speak English or something, especially with the diverse hair colors among the new civilization.",2
69,"I dont know if we can take the hair colour thing as given, seeing how Senkuu has natural white hair with turquoise tips.",2
70,"That's true, honestly I didn't even consider that LOL      I guess I'm just really used to anime characters having whatever hair color, but blonde being the ""THIS IS A FOREIGNER!!!"" indicator?  shrug ",1
71,They omitted that line from Tsukasa upon meeting Kohaku,2
72,He's the beautiful love child between a man and a leek.,1
73,Truly a feat of science,1
74,Didn't senkuu say something about her being a foreigner when he noticed the blue eyes and blonde hair?,2
75,"Huh, I've read the manga, but even I didn't know about that.    That is a very interesting catch.",1
76,"I'm more astonished that they talk fluent japanese with this mixed english while we at the moment have not any idea about the moment they came back. Did they even got petrified ? At the actual moment, nobody knows.",1
77,Oh wow nice catch,1
78,"Yeah, as a manga reader i noticed that too and when it clicked why it was amazing. You'll learn why this is eventually",1
79," SMUG     Kohaku and Senkuu’s dynamic is really good because of their difference. He’s sneaky and smart and she’s honest and chivalrous, makes it very fun.",1
80,That is some 10 billion percent smugness.,1
81, Also ???% derpy Lion mane ,2
82,I want that gorilla to step on me.,1
83,You want to be gravel?,2
84,  STONE ROAD,2
85,RODA ROLLA DA,2
86,  STONE OCEAN ,2
87,  Gravel of culture  ,2
88,"3700 years into the future, humans have acquired a mutation that they no longer have armpit hair.",2
89,"I'm glad, armpit hair looks weird, whether on chicks  or  dudes.    The dudes are also completely hairless on the legs.",1
90,They could just shave with a sharp stone.,2
91,"...have you tried shaving without soap with a single blade razor?    How much worse will a ""sharp stone"" be?",2
92,"This is the weird part for me, when people post pictures of younger characters with sexual innuendo, can I ask how old you are?",2
93,"Nice try, Mr. FBI.",2
94,"Bruh, she aint even a loli, calm your farm.",2
95,Did I say she was a loli? Moron.,0
96,"I never claimed that you did, bruv    But she ain't even a loli, so calm your farm.",1
97,nan,1
98,WHO ARE YOU CALLING GORILLA CYCLOPS?!,1
99,I NEVER SAID THAT,1
100,If she’s busy Kondou should be available.,1
101,How cute...,1
102,Omg exactly haha I'm a manga reader but this scene the anime only gives me kaguya sama vibes haha,1
103,o kawaii koto,2
104,"Still can't believe this dude was lucky enough to get himself a stone waifu, who ultimately led him to her village and his new science bro        awe ",1
105,"She's no waifu, she's VALUABLE HUMAN LABOR",1
106,Fun fact;  Kohaku means amber. Probably a reference to her hair color.,1
107,"Quite a few  if not all  of the villagers are named after rocks and minerals and metals, actually. Besides Kohaku and Chrome, there's Kinro and Ginro  'golden wolf' and 'silver wolf', hence the spear thing , and then Jasper and Turquoise, Ruri's attendants. And I think 'Ruri' is a reference to lapis lazuli from the translator's notes somewhere on the scans?  There's more but I'm just naming the ones introduced this episode. :P",1
108,"I was skeptical of Chrome at first, as he didn't really appear that interesting to me. But by the end, when he cries for the millions of years of human scientific evolution lost in the Stone World, that really resonated with me. Honestly this is something we haven't really seen before. The other characters knew of the world before and that Senku has the ability to build it once again with his limitless knowledge. But we hadn't seen a person who didn't know that, that can only dream of the technology before the Stone World.     Chrome to me embodies the human curious nature, the will to discover and question the status quo. His genuine drive to discover and learn are just so endearing. I really hope to see him more, and if the OP is to go by, he seems to be one of the main protagonists : ",1
109,"Chrome really ends up being the heart and soul for this episode. He's a also a pretty solid person to interact with Senku. Instead of a big oaf, we got a Scientist  Sorcerer  in training!",1
110,Chrome has been here for only a few minutes but their  interactions  at this rate.        popcorn2 ,1
111,"seriously, who can compete with science bros?        grandhype ",1
112,"A friendhip was formed between this men, this men of SCIENCE!!",1
113,Truly a covalent bond,1
114,Sorcery bros ,1
115,Noone can.,2
116,Oh fuck.    He knows about the blue crystals!    HE  KNOWS  ABOUT THE BLUE CRYSTALS!,2
117,Isn't that like the plot of Breaking Bad,2
118,"To be fair,  ""Yeah, science!""   is  the entire premise of this story.",2
119,Excellent point,1
120,I got a lot of blue crystals from gacha games : ,2
121,"As an anime reader   yes i read anime deal with it  i'm pretty aware of it.    Hell the bs that ""Taiju was the MC on the first chapters"" its unbelievable taking into account THE DAMN NAME OF THE STORY.",2
122,   Anime reader       ???,2
123,"Well, there are subtitles unless you understand Japanese.    More likely they meant manga.",2
124,"I know, was just pointing it out",2
125,: ,2
126,The MC hair is also something you cannot miss.,1
127,"This is very unfortunate, but the guard who didn’t get the cool spear is gonna be a test subject.",0
128,My mind is taking me to really bad places.,0
129,Some of these reactions will always make me lose my shit.,0
130,"He's got Best Girl Yuzuriha with him, so I'm sure he's more than fine        smugkaguya ",1
131,Nerdy kids instantly bonding across a millenniums-wide generational divide over their shared love of gathering pretty rocks is extremely relatable.,1
132, Senku and Chrome ,2
133,"Chrome is great because at a base level he shares a lot of Taiju's ""simple but earnest"" character traits, but he also combines that with a genuine enthusiasm for science, which makes for a far more interesting foil for Senku than Taiju's ""dumb oaf"" shtick. It also actually allows Senku to show more of his positive qualities as well, and show that he isn't just a pretentious dick who thinks he's better or smarter than everyone else, he genuinely just loves science and is actually thrilled to have somebody he can share that with.",1
134,That's why this show feels so much more alive with him and chrome talking. They just work off great with each other and Chrome's arc in the manga is probably my favorite.,1
135,"Senku seems to genuinely admire Chrome for being able to figure out and build up what he did starting from literal zero. Sure, Chrome isn't anywhere near Senku's level as a scientist, but he didn't have the entire aggregate knowledge of humanity to stand on.",1
136,"Thats the vibe I got too. Senku's moment when he realises that even if he died, there was still other humans that would pick up the torch and restart scientific discovery from scratch was great.    I think that really humbled him, to think that sure, he has all this knowlege, but it was acquired at the peak of civilisation, yet Chrome had started from absolutely knothing and was already making great strides relatively speaking. as a scientist, you can't help but admire respect that.",1
137,"Senku was standing on the shoulders of giants.    Chrome would have been one of these giants even without him.     His discoveries would have been the groundwork for other ""sorcerers"" to work with",2
138,"That's the impression I got. Senku was thinking that he  himself  would have never done the ""idiot"" work necessary to get the science ball rolling if there wasn't ground work already in place for him. That he would probably be one of the ""extras"" in this world if he never knew about science",1
139,"He totally would join in as well, nothing can stop his love for science.      Instead of idiot work he dismissed it as elementary school science experiments, until it hit him that even our elementary or almost any minimum possible science knowledge in our world is still miles ahead of a primitive stone world.       Senku is probably exactly as inquisitive and curious as Chrome, the difference is that Senku had access to more stuff to experiment with.  he started out pretty basic in his flashback as well     Also I wouldn't be surprised if this guy is still leagues stronger then Senku just because of the world he grew up in",1
140,"Well, that's assuming he could successfully germinate his knowledge.    The amount of knowledge he acquired from literal 0 is  massive , especially for a teenager. And humanity doesn't tend to have the best reputation of accepting large scale change happening so fast.    The other people just think he's some weirdo who likes rocks, he'd have to invent something seriously impressive to start proving himself.     Senku was able to easily impress with feats of engineering, but chrome is more of an alchemist, so he'd be more likely to die from exploding himself in an experiment.",1
141,"Very good point  especially about him blowing himself up, lol .    In a small village like this people dont seem to mind what he does, but unless he discovered something imediately practical nearly all his knowledge would just be put aside and forgotten by the others.    Well unless he manages to find some other curious kid to mentor, which honestly sounds easier as a sorcerer alchemist then as a normal scientist in our times :p",1
142,assuming he doesn't get killed by religious extremists...,2
143,"Yep, after watching this episode one more time, Chrome is officially my pick for best boy",1
144,"Yep. I like him as well, certainly a big upgrade over Taiju who was basically an airhead.",1
145,Some still say Taiju is still collecting shells on the beach. Still collecting.,2
146,"He knew that science is what's gonna heal Ruri and every other human who suffers like her, and after hearing what Senku told him about how advanced the world used to be, and how many opportunities lost because the world is petrified, he felt sad and angry.",1
147,"i mean think about it. Chrome grew up probably watching countless people die around him from sickness or starvation and knowing that in the modern age, Ruri's illness wouldn't be deadly just an inconvenience. Of course he'd be angry.",1
148,"I didn't even think of it that way.     Shit, knowing that would make me livid",1
149,"Cause in the Stone World, no doctors, no medication and hearing about that age.    If Chrome had been born a modern day man, he would've probably gone on to become a doctor.",2
150,"no! his curiosity would make him a researched  no matter the field , doctors heal and he would not need to learn how to heal in our society right?",2
151,"Unless he wanted to. You can still choose to, if you wished. Or he could've gone on to become a pathologist or an engineer.    But that Chrome will never be born. We got the bright eyed, curious young scientist who's going to help change the world one step at a time with Senku now.",1
152,"Yeah, I mean, it's no wonder why the girl's sister was so worried about her. In a world without medication, even just a cut can be the death of you if you're unlucky.",2
153,"This comment has been removed.      Please keep all source-related comments, such as discussion of future events, comparisons with the source material, or talk about the source material in general, in the Source Material Corner.    ---    Have a question or think this removal was an error?     Message the mods.         Don't know the rules? Read them     here    r anime wiki rules  .",3
154,"Chrome was just great.    I mean, Senku's one thing, someone who already knows all this stuff and how to apply it, but it gives me goosebumps to see a person who didn't realize something was possible before suddenly learn that a good thing  just might  be within reach and then vow to pursue it. It's a kind of ""moonshot mentality"" that I wish I saw more of in media.",1
155,"No, I mean, more shows that cover this topic, not just Dr. Stone. A Place Further than the Universe and parts of Steins;Gate are the closest I can think of at the moment in anime. Anne McCaffrey did it periodically in her Dragonriders series of books. I can't think of many well-written examples outside of those.",2
156,"Ah, yeah obviously in other media.     I was talking specifically about more moments like this in this show, even better ones. Little misunderstanding on my part there.    If we wanna have a more mature discussion about storytelling, stories are always a reflection of the time they are written in, and imho, we're simply and sadly not living in a ""moonshot mentality"" time at the moment. There is no ""we'll set foot on the moon"" of our times, and I think stories being written currently reflect that. Current Zeitgeist is more a warning of Pandoras Box, reflected in things like Black Mirror and other stories.    The closest I can think of in the spirit of this positive mentality is honestly old Star Trek, at least when it comes to morals. Which is also why the Star Trek movie was so god damn disappointing.",1
157,As a manga-reader; Chrome is best boi.,1
158,his interactions with senku made the manga so much better and the comedy of those 2 is brilliant,1
159,A fellow man of culture I see,1
160,Is the manga still a long way to its end?,2
161,Yes,1
162,It’s not even half done. Not by a long shot.,2
163,"Chrome is possibly the most endearing character in the manga, and yeah he’s one of the main protagonists",1
164,"that's exactly why he's my 2nd favorite char, only 3 characters missing from my top 5.",2
165,Kaseki. Kaseki.,2
166,Chrome is easily my favorite character. He gets better and better,1
167,"I hope they explain to us why he doesn’t know anything about the “old world”.    It seems like Senkuu is implying that people most have un-petrified hundreds of years ago, and these are decadents of those people.    Still doesn’t explain why nothing was passed down at all?    I would also love to get a canon answer if Senkuu’s hypothesis is correct. Like technically, it is possible that maybe some people never got petrified to begin with.    Either way is fine, just please give us an exact explanation!",1
168,"Bits and pieces got passed down, but let's be honest, most people don't pay attention in science or history or remember these classes. Most people also aren't Senku or Homare from Sounan desu Ka, and would be pretty helpless without technology. When every day is a struggle to survive, your vague memories of the periodic table isn't worthwhile info to pass to your kids.    I had to inform one of my coworkers last month that Alaska was not an island, and Mt. Fuji is a real place in Japan.",2
169,Really? He thought ALASKA was an island? How?,2
170,"Because US mapmakers tend to throw it in a box along with Hawaii and sometimes Puerto Rico on the bittom left hand side of the map, and then some don't draw in Canada to help communicate that it's attached to a landmass. TL;DR, she had never taken time to really look at a full map of the world before, which is a surprisingly common issue in the US.",2
171,"That's so weird. Maybe i, as a non north-american, always saw the america map as a kid which clearly shows Canada and Alaska right there.",2
172,"True but what about buildings, plane, technology? They didn’t pass it down that humans used to be able to fly and travel insanely fast?    Chrome clearly knew nothing about the old civilization, so I’m confused what happened here.",2
