,Comment,Sentiment Rating
412,"You're missing my point though.     I'm not saying ""any highschool kid could do what senku is doing""    I'm saying that if we can teach this shit to unenthused highschool kids, then someone who is super passionate and hardworking like senku could learn all the  extra  stuff that he has even without being a genius.    And again, the fact that me saying ""I learnt highschool level chemistry in my highschool chemistry class"" comes across as boasting to you says a lot more about you than me.",0
413,"Again, the fact that you specifically mention things that everyone does as if they were special is an attempt to boast, albeit a poor one.    And again, genius is not what you think it is. If you work hard enough you'll realise it at some point. In real life, genius is a label people who don't work hard put on people who work hard in order to feel better about themselves. After all, if people would see and read about geniuses while knowing that the only thing that separates them from said geniuses is the fact that they were lazy, they'd feel pretty shitty. This way they can just say ""but that guy's a genius, I'm not so there's no reason for me to push myself that hard"" and excuse themselves.",0
414,"     ???    Do you not realize how the assertion that I am framing them as being special would completely go against the larger point I was using those examples to support? My entire point was that it  isn't  special, hence why senku doesn't  have  to be a genius.    Or the fact that if I were wanting to make myself seem special, I would have specifically avoided stating that they are things a regular highschool student can do?    This assertion of yours stands on an increasingly weak foundation, yet you seem willing to continue grasping.         Vaguely ""working hard"" makes you more qualified on defining the word ""genius"" huh? And you somehow know that you've done more of this vague ""hard work"" than me.    Interesting proposition.         Time for a lightning round of psycho-anlysis!    You think genius is just a term for people who work hard to defend the ego of lazy people, and you so strongly self identify as a ""hard worker"" that you would earlier in this reply assert yourself as more-so than myself with no evidence in support of this.    Your illogical assertion that my simple statement of things I did in highschool being boasting could seem to imply that your ego was threatened  probably subconsciously  by my statement of these things being normal. Then afterwards you switch the roles to try and instate yourself as the norm and thus I must be boasting, rather than myself being the norm and you being threatened.    These two observations in conjunction would seem to show an overall method you've developed to reframe the world in such a way that puts yourself up on high to feed a fragile ego.    A fear of not having this ""inherent talent"" led eventually to rejecting the possibility of its existence, leaving your worldview in a place that allows you to believe you have full agency in your life. As well as reframing the concept of genius that you feared was unobtainable to instead be something along the path that you are already following.    I wonder how I did. Since we seem to be having two separate conversations and you seem like you might just continue to repeat your unfounded assertions in a boring way, I thought I'd let myself have some fun.",0
415,"If you would truly believe they weren't special then you wouldn't have mentioned them. There's no sense in giving someone an information they already have.    I also did not state that I work hard, you made that supposition yourself. I said that people who work hard enough realise that fact. This could very well be something that someone else once said to me, not something I came up with myself. I find the way you jump to conclusions amusing.    Again, it is illogical to state something everyone did unless you think that you're somehow more special for having done that, which you prove by asserting that the fact that you mentioned normal things could somehow be ""threatening"".    Also, your psychoanalysis is somewhat off. Since I'm a bit bored, I'll give you some pieces of information to work with. It's not the fear of not having that almost negligible advantage ""inherent talent"" that led me to that view, but rather the reverse. Imagine working hard for years only for that work to go unacknowledged when people label you ""talented"" and think that all your achievements are because you were born under a lucky star or with the right genes.    But do continue, please. I find the fact that you're trying to sound smart by making vague and improbable deductions quite amusing. If you try enough, you might actually hit upon something else than some general identifier like hardworking. You might also try to prove your high intelligence  you must think yourself quite intelligent since you think you're in a high enough position to judge others  by ""deducing"" other general stuff, like gender, hair color, etc. I'm sure there's a quick statistic you can google to have a reasonable probability of being right.",0
416,"     No?    You seemed to be under the impression that they are special. So I presented that it is normal.    1. It's important to state information that is vital to a point you are making in order for clarity    2. It's not to state myself as above, but that you simply may not have thought back to your time at highschool and been like ""oh yeah, I did learn stuff similar to this"".    3. Furthermore, the ""it is normal"" was only the first half of the proposition, with the second half being ""so an extraordinary worker could be expected to know this + more"". You can't treat it as if I simply said the first half by itself and treated it as revolutionary information.         You say that people who work hard realize something, and then state that thing as if you know it.     So besides you claiming yourself to be a hard worker, you are someone who believes the words of others and states them as irrefutable fact with not even personal experience to back it up, huh?    I was giving you the benefit of the doubt by assuming you meant that you are a hard worker. Trying to claim that you are instead just a sheep who follows others completely blind is really more of an insult to yourself than what I had said.    This seems like a pretty weak attempt to fight fire with fire here. If you think I won't notice the reactionary mimicry you're showing in the structure of the argument now that I've started seriously threatening your ego, then you're mistaken.         Normal things could threaten you if you find yourself to be abnormal whilst wishing for normalcy. I could not have known whether you were normal, so it couldn't have been a purposeful attack on you without that knowledge.    Otherwise I've covered this above. You're acting as if I stated these things as some sort of revolutionary piece of information when I did no such thing. They were used as the beginning to a larger point which then benefitted my overall point.         As expected.         Nah, it's kind of a one time deal. It becomes boring with multiple tries, feel free to go hire a freudian psychologist though.         Haha, your self awareness is comically low. Or you're bad at signalling and can only speak in such a serious tone.    To say this while being the one consistently saying ""well when you work hard"" ""when you grow up"" etc. Is quite funny.    You'll notice before something like a ""psychoanlysis"" I can signal with a sarcastic comment like ""time for a lightning round"" to show some self awareness. Either you have none, or need to incorporate some signalling.     Or maybe you're just like a person in chess who can only think one move ahead. You see a chance for an attack without any thought to how it could be countered.         White, straight, brown hair, male,  nobody likes you when you're  23 years old, and a fetish women in peacoats    My replies grow lazy as its 2am",0
417,"Ok, the last part really made me laugh. You still have to work a little on it. Regarding the rest, Freud's theories were proven wrong, so I wouldn't pay to hear suppositions that carry no more value than the ones you made.    The usual approach for a piece of common sense information like the one you've given is to start with the assumption that everyone knows it  that's why it's considered common sense information , and only if someone proves they don't to explicitly state it. Otherwise, it's a weak attempt at a boast in my opinion. And children do often attempt to state normal things they did as being extraordinary when they try to boast, which is why I called you kid.    As for the hardworking part, I just pointed out that you're ignoring other possibilities when making those assumptions, falling for the same fallacy that I did when I called you kid.",1
418,"That was a fun read, thank you.",1
419,Lol Senkus eyes spewing fire!,1
420,thats what happens when you fap straight for 5 times,2
421,     Heh. Those are rookie numbers.,1
422,There was a dude who fapped until he died. If you are interested 43 is the death number.,2
423,"Okay, then...         CHALLENGE ACCEPTED     ",1
424,"Kohaku in swimwear and Suika appearance, I cannot ask for more. Suika too adorable        bacchiri ",1
425,Kohaku is all I ever wanted.,1
426,"At first, I was thinking that Senku was making beer, but I'm down with the premise that ramen is civilization. Man, Kohaku must've cut down a crap ton of millet.     But really, why does Ruri know about 20th century Japanese pop culture? My guess is the village's ancestors  or maybe just the chief?  are revived stone people who passed down TV shows as mythology. I'm sure that to a society without TV, comics, or the like, being able to describe ancient media would make you the most interesting person in town.",2
427,probably not a good idea to let Suika to drink beer haha. But it might work for the elders,1
428,"You'd think that, but in Medieval times because they didn't have proper water sanitation, they  unknowingly  used alchohol to disinfect their water supply. In fact, Alchohol was drunk more often than water was because it was safer. Because of how often you were drinking it for day-to-day, it was made really weak and severly watered down because people were only drinking to stay hydrated rather than to get drunk  of which the taverns had the actual good stuff     Simply put, even weak Alchohol was a better antiseptic than just drinking straight from the river, simply because of the process that goes into making it ensures it is safe to drink.      ",2
429,"That is a common bit of ""pop-history"" that frequently gets bandied about, but is largely untrue  did you notice that the very source you linked only has an anonymous ""history buff"" agreeing with what you said, while the lower-down answer from a named+published author refutes it? . Even r askhistorians has   two  for this in their ""very frequently asked questions"" section.",2
430,"I have always taken the instead of water with grain of salt. They drank Alcohol probably for same reasons we do, taste and getting drunk. You pretty much stoped being a child when you stoped with toys and even the ones using toys could be found in very dangerous work. Children fashion was simply smaller adult clothes. And Children drank alcohol for the most part the prohibition movements and the creation of a longer childhood along with modern medical knowledge is the reason for raising age of alcohol drinking.",2
431,Does anyone actually like the taste of beer the first time they drink it?,2
432,Even the mongols knew that Ramen is Good Civilization.,1
433,"     Senku being the only man in the area to get de-petrified is kinda believable but him being the first or only in the entire world doesn't really make sense considering he was petrified in a second story highschool hallway when others would have been in much more advantageous locations such as chemical plants, labs, or places where nitric acid or products containing it could be found and they could be exposed to.",1
434,"That’s fair, there certainly could be other people that already made it out, but those places wouldn’t have lasted long. The chance of multiple people being woken up in Japan from nitric acid, let alone one person, is incredibly small. Their statue bodies would have been moved away eventually, the buildings would collapse, and the containers of these products would be long gone. Someone would have either had to undergo the same thing as Senku  which took a long ass time  or happened to have a concentrated nitric acid product open with them at the time.    So I highly doubt these are descendants of statue people, and are actually the dwindling descendants of people who somehow didn’t get statued. Maybe people who were far underground at the time.",1
435,Sorry forgot I was posting in the r anime rather than the new released chapter in r manga. I don't want to spoil things so I'll stop now. Nothing I have said in the previous comment was about the series so no spoilers thankfully.,1
436,"from what we dont know even in the manga, there's nothing to say more people around the could've revived like that either. And Senku was probably the only one in Japan lucky enough.",1
437,Remember that senku didn't sit exposed to nitric acid for 3700 years. Most of the time was him being moved around so that he could eventually be in a position to be touched by it. The actual process might not take that long.    Someone else could have just got lucky and found themselves in that position sooner.    There's no way people would be speaking perfect japanese after 3700 years of living in primitive tribes.,2
438,"Could have, but again, multiple people would have had to gotten lucky at around the same time    And as for that, pretty sure the only reason they’re speaking perfect japanese is because it’s an anime. Some liberties have to be taken for the sake of the plot",1
439,"     It's not so unlikely that you can just rule it out though, it's perfectly possible. 3700 years is a long time for that to happen.         The exact same sentiment applies to people being unpetrified though.",1
440,"It is possible but still extremely unlikely, and still probably not the case.     And there’s a sizeable difference between everybody speaking the same language so that the intended audience can understand and plot devices. It is still far more likely its descendants of unpetrified people, not statue people",2
441,"     I really don't understand why you think this, it seems like you just want to, and thus do.    There's really no reason to believe that in 3700 years people couldn't have come unpetrified.    There's also the problem of literally everyone being petrified. Who are these magical ""unpetrified people"" that you're talking about when it's pretty well established that  everyone  was petrified.    You'd rather  go against  the established information rather than go with the theory that makes most sense given the information we have?",0
442,"Because, again, the likelihood of two people  at least , both male and female, becoming unpetrified in the same area of Japan, at the same general time period over 3700, is nonsensical. I don’t really know how else to explain how damn unlikely that is.     We’ve established that to wake up you other need a concoction of nitric acid, or  natural occurring nitric acid, which requires both being awake the entire time and getting extremely lucky in your placement as the environment shifts. This further adds to it being extremely unlikely that two other people went through the same thing",2
443,     You dont know how to explain it because you have no actual logic behind it.    Multiple people could be revived in the same area simply because being close to eachother means they can be exposed to the same acidic environment as eachother.         We've also established that literally every single person was petrified.    Your assertion that there could possibly be people who just  weren't  petrified for literally no reason seems more logical to you than the alternative which is unlikely but at least possible?,0
444,What if the village is just a bunch of aliens that look human? Like an alien colony.,2
445,I would have gone with there's a bunch of RNG in naturally reviving.    If anyone survived the event I would imagine they would have scavenged enough surviving tech to not have regressed to that point.,2
446,"Yeah, RNGsus isn’t a kind god. Not to mention at least two people in the same general area would have had to both woke up at the same time, because if one person knew how to wake up more statues, there would be a hell of a lot more people, and it takes two to make a village",2
447," ""You're not far off"" ",1
448,Someone passed down some modern nudity taboo's or the girls would be going topless when the boys did. And the Japanese thong bottoms actually used by swimmers who were working while most places nude swimming was there rule till mid 1800's. Topless women pearl divers in Japan lasted well into modern times.  It drives me somewhat nuts when shows about pre western nudity culture show women covering breasts when historically they did not. At least in 60's and 70's when I was they would censor the toplessness by showing back views and the likes but not the modern world of lies where people insist on pretending modern taboo standards always existed.,2
449,"Meh, just because Japan and various other societies did not develop nudity taboos does not mean that they are some impossible thing either. It basically depends on both the availability of clothing and the usefulness of it in protection, along with random societal factors. Would it be reasonable for a prehistoric culture to have no nudity taboos? Sure. Is it also reasonable that they might have developed some independently? Also quite possible. They could even be silly ones, like always wearing a mask, or always making sure to wear boots, if nothing else. It happens.",2
450,     Yeah. kind of like what Senku said in the episode. Kind of.,2
451,The village ancestors were IMO people who simply didn't turn to stone. Maybe they were underground or whatever.,2
452,So much time had passed that even stars moved and Earth's axis shifted. That's crazy. Senku must be thankful that the villagers aren't some crazy inquisitors who are burning scientific people for heresy.    Chrome is literally me playing alchemy game. Mixing all the stuff hoping that it'll turn into something useful and won't kill you.,2
453,      Axial Percession  is a thing.,2
454,"So they are actually so far in the future that not only is Polaris no longer the pole star, they have also skipped the pole star after it  Errai  and are currently in a period that has no pole star at all. The closest they have is ""somewhere about halfway between Beta and Iota Cephei and a little ways towards Errai.""     That compass of theirs is problematic as well: Magnetic North is some distance away from True North, making compasses less accurate at higher latitudes. Magnetic North also moves over time, but unlike the stars it drifts  randomly . It's even possible that Earth underwent a magnetic field reversal while they were statues so that compass might actually be pointing  South .  Although I suppose in a Stone World it doesn't really matter if the north pole of their lodestone is the same end that it would have been in our time. ",2
455,"I mean, what even is ""north?"" It's just a direction we have decided matters, because we can sort of tell where it is. If Chrome has a compass and it points ""north,"" then that's about as north as anything else.",2
456,"North is actually pretty important, when it comes to things like weather and climate which then effect culture.    Cultures tend to unify within areas of similar climate, and the climate changes most distinctly when changing latitude.    For general short distance navigation though, you just need to have a consistent way to get your bearings. Any consistently visible and stationary landmark, or device that constantly points in a single direction would be useful.    But the north star is also notable in that it  doesn't move  like the rest of the sky. If the earth's axis tilts, then the old north star will start rotating in the sky just like all the other stars, making it a less consistent landmark.",2
457,"Which is why this culture uses other navigational tools. There are better ways of telling latitude, such as sun angle. Unless you're making significant journeys, having a consistent direction tracker is much more important than knowing latitude.",2
458,Also worth noting: the magnetic north pole would have moved all over the place as well. It currently moves at a rate of 55km per year and is moving from canada towards siberia.,2
459,The Catholic Church did that to maintain power and control over the poor so without organized religion I think they are safe.,1
460, Is that you Gaston? And Lefou too!!     The Great Detective Suika just became the most useful member of the nation of science. Senku better not screw this up.,1
461,"No one hits like Magma, no one beats like Magma, no one chops you with his stone axe to bits like Magma...",2
462,"This show is so unrealistic, why arent their clothes exploding after eating the ramen and orgasm over it?",2
463,Aren't you confusing Dr. Stone with Shokugeki no Soma?,2
464, r woooosh,2
465,"... ...yup, nevermind.",2
466,"   Stitches Time!!!       Kohaku Pose        River Kohaku 1        River Kohaku 2        Campfire Kohaku        Senku 1        Senku 2        I'm so happy this was addressed.      Suika is adorable  and is a fine addition to the Kingdom of Science!      Is it just me or does that   middle girl really look like Nico from Love Live?  She even has the same red eyes!      Shokugeki no Senku!  Considering that this is another Shounen Jump show, I was genuinely hoping for them to sneak in a reference like Senku saying ""Owagari yo!"" when he served his ramen. I am excited to see how the village will react to this new food. :D",1
467,"The seasonal masses: beach episode with fanservice    Dr. Stone, the intellectual:  river episode         gintamathispleasesme ",1
468,"I mean, we did get an onsen scene as well",1
469,Isn't watermelon a fruit?,2
470, it is a much debated topic ,2
471,ive literally never met another gardener refer to watermelon as a fruit.,2
472,     AcKcHyUaLlY melons are fruits not vegetables.,2
473,Thankyou for that full body Kohaku stitch. I will try pumping some air in the forge to make iron,1
474,"     I noticed too, she even have very similar voice as Nico.",1
475,Nico Nico Nii,1
476,I love how hype ordinary things feel in this show,1
477,"This is the best episode so far, amazing how good this show got after senku upgraded his friend group.",1
478,"That's exactly why the episode a while back was called ""Stone world: the Beginning"". The prologue is done and the setup is complete, now on to the true fun.",1
479,"it's nice not hearing ""AAAAAAH! SENKU!"" every episode lol",1
480,"Chrome casually dropping how he basically re-invented compasses all by himself is lowkey the biggest feat yet. Senku is ""just"" finding creative ways of making stuff he already knows about, but for stone age standards, Chrome is a revolutionary innovator.",1
481,"     Uh, I call bullshit on at least half of this statement.",2
482,"Well even Senku recognises that all of his knowledge is built on the shoulder's of all the ones that have come before him. He doesn't treat his intelligence as genius, rather as the result of constant learning from failures. Which is also a really good message to convey to kids.",1
483,"There's just no way to know that much at that age lol. Science is a really really expansive field, and what he's doing is very far from what he was interested in before turning to stone, yet he knows exact recipes for everything and even their history...",1
484,"If you've obsessed over something for 10 years, I'm sure you could memorise most of it. Most of the grunt work and research has already been done.     Of course, it's anime, so some anime rules apply too. But my main point was that this is Senku's perception of himself and humanity in general. Monkeys scraping to go onwards  hence the whole monkeys mini arc ",1
485,"You really seriously underestimate how much ""science"" there is. And there are no ""general scientists"" even those who would specialize in this specific type, would still rely on notes, otherwise they would end up trying to remember irrelevant stuff their entire life instead of working and learn.     But this guy is waaay out of his field and has everything memorized to the detail, that means he must be on Neumann's level.",1
486,"Sometimes I get the impression that the way the word 'tensai' is used in Japanese has slightly different implications from 'genius', which is how it's usually translated. Maybe a cultural thing, but 'tensai' always struck me as having an implication of almost being blessed, having everything come easy by default. So what Senku is meaning here probably is ""we're neither gods nor blessed by them"", aka, we'll have to take the safe, hard road rather than rely on some improbable stroke of luck  for penicillin .",1
487,That makes much more sense.,1
488,Wow 24 minutes fly by so fast! But I can still hold off reading the manga! ,1
489,"as a manga reader the episodes are SO good still. there was no way i thought Suika would be this cute in the anime but she fucking is, i'm still super excited for each episode alongside the anime-onlys.",1
490,I was kind of disappointed with the voice they gave her for like two seconds until I realized how amazing it is,1
