,Comment,Sentiment Rating
358,"Jesus your eye thing sounds rough.      I cant handle touching my eyes or seeing people touch thiers, i have a very big phobia of things going in my head like eye drops or ear drops or nose spray or stuff.  I tried contacts once and it took me like an hour to get both in, i was like ""nope.""  haha.  And when i goto the doctor it takes people holding me down to do eyedrops or ear drops or stuff.  When my throat swelled shut 10 years ago, i was taken to the ER but i could still barely breath, and that was a whole other ordeal, but eventually the docs after trying everything else to fix it including like 10 shots they had to hold me down for they decided to shove a tube down my throat to force it open.  They had to get like 3 big nurses to hold me down when they did that because i wasnt letting them put that tube down my throat.  They eventually did it and in the process shredded my vocal chords so now i have trouble talking ever since and if hurts to talk after a little bit.  Ive just been traumatized by that sort of stuff i think that now i have a crazy phobia of them.  I dont even like being in hospitals after that.  Also when i gets shots or IVs now i freak out.  its rough haha.",0
359,yeah im not gonna argue with you. This is really deus ex machina. Not forced but necessary for the plot. Y'know if inagaki decides for the plot for them to realestically take months lmao we have a corpse ruri.,1
360,I've actually had lazy eye right eye since birth and nearsightedness on both for as long as I can remember but never got them corrected until I was 14. I only ever got them diagnosed at that age cause I brought it up with my mom how my eyesight feels like it's getting worse but apparently it was already really bad. Getting new glasses was like seeing a whole new world that I never knew could be that clear since the blurry one has been totally the norm for me. I've been stuck with really high prescription glasses since 8 years now and no particular changes. The optometrist said it could've been corrected if it had been treated way earlier. Kinda really shows how bad my communication was if it took that late to find out. Often times people would misunderstand that I was glaring at them back then too. Yeah. Random thing I feel I had to type out since this episode kinda speaks to me. Thanks for reading.,0
361,"Yeah, the show has an issue with experiencetime and irl phenomenons. But honestly, having a guy to break stones with a punch and a MC that was conscious for 3 thousand years, is it really worth to raise such obvious point? The guy is supposed to make a drug to cure somebody else illness and he's not even a doctor, I mean he doesn't know if it's a virus or a bacteria, the daily doses and all of that stuff, he knows science and how the technique work not the specialty, although of course the show will make he do things conveniently because nobody else would do it in the first place either the MC or a random support character.    The main premise is that one person would never ""accelerate an era"", we know that, and the anime makes it possible anyways, so deus ex machina is the only way to make the plot going otherwise the show needs to make a new cast for every generation and that's not viable at all.",1
362,"     This actually makes sense.    What Senku is doing as said on previous episodes is a sulfa drug, antibiotics.    The one Senku wants to do is a simple one, but it's an antibiotic nonetheless. While it's not guarantee to cure Ruri's illness, there is a high chance a super-potent medicine like that for stone world standards will help her in some way.",1
363,"I'm willing to let that slide. Senku knows everything he needs to know about glassblowing, he just doesn't have the dexterity he needs to do it. I just write it off as the old guy being a fast learner.",2
364,"Come on. We can't hand on the ""glass blowing takes years to master"" thing  now . The show has a guy who can keep count of every second for over 3000 years with perfect timing while keeping all of human scientific knowledge in his head, a guy who can one-punch lions to death, and another who has infinite stamina. Having another genius craftsman who can grasp the properties of a material and instantly perfect the manufacturing process is kind of along the theme of this show.",1
365,"Suika's situation was quite lovely to see. Reminds me of my older sister, for a long while my sister had trouble reading subtitles if she didn't stay near the TV when we watched anime together and actually thought she was dyslexic. Turns out she was just short sighted lol, I made fun of her so much for that. There's just something amazing about realizing ""oh, so that's the reason why stuff is like this for me all this time?"" Like when I found out I was lactose intolerant...",1
366,F,2
367,"I still drink the shit out of milk because I'm not about to stop now, but I always know in the back of my mind ""there will be consequences later""",1
368,I used to drink milk more than water but it started giving me problems so I stopped for like 3 yrs now,2
369,That's kind of amazing. I have no self control so 3 yes is quite something.,1
370,"Thanks, I think its mostly due to me being diagnosed with celiac around that time :",1
371,"Oof, that's quite the bothersome condition to have, good luck",1
372,"Same here, I started having issues with milk and coffee, went to the doc, confirmed that I was intolerant but continued to drink regardless, a few years later had to stay in the hospital for a few days and was diagnosed with crohn's. It get's pretty bad when I drink milk or coffee for some reason.    Now that I think of it it was super dumb to continue to drink since milk without lactose tastes pretty much the same. Ironically my neighbour had the exact same issue but for a different reason, the guy worked at burger king, so he ate hamburgers for a whole year, then he also was diagnosed with it.    If something you're eating is messing with your body just find a replacement, nowadays there's replacements for everything that taste the same.",1
373,I'll definitely keep that in mind,1
374,Have you ever tried lactose-free milk? It’s a little bit sweeter but it’s still milk,2
375,"Never tried it myself, but my sister took ice cream like that and got intense food poisoning later so I'm a bit wary",0
376,"  Strange, I drink it almost every day and never had any complications",0
377,"I'll keep it under consideration though, thanks!",1
378,"I remember my dad always getting annoyed with me because he had to always find my ball for me when we played golf. After i got glasses had this realization of ""Oh, i don't have to guess where it is going to land based on speed and angle, i can just follow it with my eyes.",0
379,JUST KISS ALREADY!,1
380,"I mean, their hands were closer here.    If you're already about to hold hands, at least kiss first.",1
381,"Hey, no. We don't want Kohaku to get pregnant so soon.",0
382,"Next episode, Senku invents Trojan-double strength.",1
383,Just use sheep intestine,2
384,Bipedal sheeps?,2
385,I 10 billion percent ship them ;,2
386,"Eh, Senku is 10 billion percent asexual.  Like Luffy.",1
387,siencexual  ,2
388,Senku could very well be asexual but when i was his age i showed about the same amount of interest as he does so i would not say that with 10 billion percent certainty.,1
389,16-17?,2
390,"3716-3717 years old    Honestly before you even hit 3500, it's normal for nothing but sulfa drugs to get you excited.",1
391,Alright i showed some interest at his age but the point still stands.,1
392,Until he needs sex for science purposes,2
393,Why would he make himself the subject when there are enough non-asexual young men who'd jump at the opportunity?,1
394,"So he can correctly measure everything, and have some data from a POV too.",2
395,"""hold right there for a minute Kohaku, I need to measure the depth and fluid levels"".  Yeah, I can see that.",1
396,"And i just realized, there is another reason why he would engage in these activites.  He needs more manpower, with scientific minds to the Science Kingdom. And his genes are really helpful for this purpose.",1
397,The best purpose would be to create the next generation of laborers.,1
398,Nah Senku's just waiting until he's raised the science kingdom's tech level enough for proper birth control   ,0
399,He's restarting civilization from zero and worried about birth control?,0
400,"Yeah, he's just a high schooler. Way too early in life to be starting a family. He's got his head on straight",1
401,I 10 billion percent ship them too ; The SS Senhaku is sailing.,2
402,"I don't care what other people have to say about Senku not interested in women, I think they have great chemistry from what I've seen so far, and would 10 billion percent want to see them together at the end hahahaha",1
403,Does she look like she could blow a tonne of air into a furnace?,1
404,And then give her a diamond ring. She will be pleased.,1
405,"I really liked how  she  used Senku's ""10 billion percent"" catchphrase",1
406,"It's really subtle how they are starting to act like a couple, it's weird how well they go together.",1
407,Senku: makes glasses      SOCIETY OF CULTURE ACQUIRED  ,2
408,Ive been working in front of the computer since ive graduated. Slowly my eyes deteriorated without me realizing until the day i had a free eye examination trial and eventually bought glasses. I never realized how bad my eyesight is when i went out of the shop i spent hours reading signages and looking at the surrounding everything looks HD its like comparing 2008 youtube to 2018 youtube quality. I felt regret for abusing my eyes when i was young.,1
409,"i remember a quote from Sunkenrock manga ""The only thing we truly own in this world is our body""",1
410,"My parents were always saying that my eyes would get bad because I spend 12+ hours a day in front of screens for more than 20 years and I barely rest I work in digital art, I just didn't care to be honest. Perfect eyesight. Not saying it's not harmful, but I have to agree that it's not the main issue.",1
411,"Genetics are not the reason people need glasses, its environmental circumstances. In the last 100 or so years cultures that spend the majority of their time indoors started developing eye problems, like China. This only applies to nearsightedness though which is by far the most common defect.",0
412,"Genetics plays a role, but environment absolutely plays a role, as well. Sure, some are predistined for nearsight or farsight, but the same goes for musculature: some dudes are just huge no matter, what, and some dudes are just scrawny no matter what.    But for most of us, our habits absolutely will influence our eyesight. A lot of close work will adjust our eyes to nearer sight. A lot of far work shooting or throwing balls or whatever will adjust them to farther sight. It's no different from any other part of the body: our body has the ability to adapt within certain constraints, so if you're sitting in front of the computer all day every day, your eyes will adapt to suit.    I'm nearsighted, but I used to wear glasses when doing close work that actually adjust it to make it like I'm working farther away. Years of doing this adjusted my sight to the point where I no longer needed glasses to pass the DMV eye exam. Then three years ago my niece scratched up my glasses, and I haven't had the money to buy new ones well, I guess I could find the money, but I just haven't done it. Now my vision is decaying, once again, to the point where I'm going to need glasses to pass that exam. But I'm pretty sure all I really need is those reading glasses, and my vision should recover.",1
413,I used to sit in front of the computer all the time. My parents just asking me to take a damm rest for some time but I just didn't used to care now I have got my glasses because I can't even clearly see from even 5 feet. I regret abusing my eyes too. It's so amazing putting on glasses for the first time and seeing the daily things look so much crisper and clearer. Truly mankind's greatest invention.,1
414,Well that certainly was a unique explanation for the melon.      Well I hope Kinro actually manages to come past his sight disability and actually whop Magma's ass.      And there goes Senku again with his inability to just let a touching moment lie with his assertion that Suika's labor output is increased now.      This old man Kaseki is like Master Roshi meets Hephestus. And yet another person who has truly impressed Senku in this stone world.      And here's Mecha Senku again with his powers of exposition.      Well if nothing else them having their gold and silver spears may give them a psychological edge.,1
415,That moment where Suika’s eyes got blurry for a different reason after getting glasses was so heartwarming. God this show is great.,1
416,"ooooh, that was pretty clever in the opening to show suika around the sunflowers with her new glasses shining from the light without spoiling this part.     kudos to the anime team",1
417,"Wow, I actually managed to miss the flare of her glasses in the opening. That is a nice touch.",1
418,"Yes, I noticed that as well after watching the episode!",1
419,"Damn, first Joshikousei no Mudazukai and now Dr. Stone with surprisingly wholesome moments.    Also subbed OP and ED!",0
420,"These two show are suppose to make me laugh, not cry. 100 billion percent loving it though",1
421,Why'd they take so long for them to sub the OpED,2
422,"I think it has to do with the rights for the music itself from the publisher, which are very different from the rights for the anime.    ",2
423,"and I was precisely thinking this week : ""they didn't speak about the bad eye-sight problem, looks like everyone is fine in this stone world, not so realistic in the end"" ... and here we go : this week they reveal someone whas bad eye sight and Senku re-creates glass and glasses. I love this.The gramp transformation was hilarious. Furthermore, you feel that Boichi behind Senku's voice is a real admirer of craftsmen.    Great episode.",1
424,"     The writer is Inagaki-sensei, same author as Eyeshield 21. Boichi only draws the art.",2
425,Boichi also conveys mad respect to Kaseki by making him fuckin  ripped. ,2
426,     I didn't know. Thank you.,0
427,This freaking got me.,0
428,"""Mandom""",2
429,"When I stub my pinky toe on the bed, but the feeling doesn't hit right away",1
430,I was looking for a gif of that. Thank you.,1
431,This show makes me feel bad for taking what we consider small common things for granted.,0
432,"They're going for thicker outlines now, mimicking the progression of the manga. Very nice. Also DAT SOUNDTRACK",1
433,I suspected Suika was a girl by the separation between the eyes of her melon.,0
434,underrated comment,2
435,Yep I had a lazy eye when I was super young and got an amazingly well done surgery at 6 yrs old. Im thankful for that.,1
436,Holy shit that sounds like one of my eyes I should go to the doctor,0
437,"I know that feel Suika. When I was young I though shit was blurry for everyone. I take my glasses for granted now but I was so excited to get them as a kid.    Senku be like,    ""Yeah you don't have to help us but look at all this cool shit we have that you've never seen before.""    Kaseki is here! Now things get real good.",1
438,"What really hit me hard, even more than making glasses for the girl, was when Senku straight up told her her eyesight wasn't even a problem, nor a defect.    It really put it into perspective how many disabilities we have as humans that we just handwave away, and that's just fucking amazing. But more important is how Senku doesn't look down on people for those issues, or see them as any less of a human being.",1
439,Even with the old man he didn't really get on his case. He knew he had the potential to be the craftsman they need but just wanted to goad him into action. All this guy needs is an anvil and he can make fine weapons that the stone world has yet to behold.,0
440,Finally! Ma boi Kaseki for the win!,1
441,Suika being cute in OP    Sunflowers in the opening song -- now you know!,1
442,The opening does this a lot.,2
443,OMG SUIKA IS SO FUCKIN    nevermind,2
444,SUIKAAAAAAAaaaaaa TT    I loved that the part with the sunflowers they don't say anything. They just... they just stand there looking.,1
445,"Did they change Director for the episode? This ep was way better than previous ones! Pacing, osts, visuals.. Good job!",1
446,I noticed it too. The animation quality and pacing is juust right.  The characters looked well adapted from the manga. And it covers 2 manga chapters only compared to the the other episodes,1
447,Noticed it as well. I felt it took the show from like an A- to an A+,1
448,"If we're talking about pacing, that Kingdom of Science was expanded from the manga tho, filling in the gaps so that we'll reach that cliffhanger with that actual use of silver.",1
449,Senku seeing the lab and remembering his own lab when he was a kid was emotional as hell for me,0
450,"It seems like he didn't want to show how goddamn happy he was, but it was easy to tell that this was probably the happiest he had been since he got busted out of the rock.",1
451,Suika seeing Chrome and Senku clearly then getting blurred again now because of tears building up on her eyes from the overflowing emotion of seeing clearly again hits the feels,1
452,"Man the craftsman bit is speaking to my heart. This fucking anime man, i love it",1
453,Besto boy,2
454,This show really puts into perspective just how amazing the things we take for granted really are.,1
455,"Great episode. Senku's genuine joy at giving Suika the glasses is so good. It's not his usual smug, triumphant happy. He's genuinely thrilled to have made her life better.",1
456,"""There's people like you in every era"", Senku was talking about his dad, right?    What a damn good episode.",1
457,"Not sure how it would relate to his dad, who AFAIK had no talent to speak of other than being a great dad.",1
458,Huh. Might be wrong then. Senku looked very proud and I just assumed he was seeing one his father's qualities in the old man.,1
459,I'm glad someone else noticed it. I think you should look at the lyrics of the ED,1
460,When did senku say that?,2
461,Didn't really say it.,2
462,It's not the  talent  that Senku was admiring. It's the dedication.,1
463,"He specifically referred to ""talented individuals"" who yes had dedication.",1
464,"Yes, but that skill isn’t inborn. It’s forged through hard work, repetition, and sheer passion.",1
465," ""Lol no XD. You'll see...""",1
466,"Weirdly enough I had the same thought as you watching the episode. I read the manga up to a point and don't think he ever meant anything about his dad by that at least reading the part on its own, but I guess we both thought it was his dad because the dad seemed awesome and dedicated.",1
467,There's always someone like you.,1
468,Nani? Not our gorilla?,2
469,She's someone way stronger than Gorilla.,1
470,Two blonde gorillas?  :o,0
471,Nope,2
472,"Each week we're getting a new best girl or best boy. I'm not complaining tho, keep them coming !",1
473,She indeed as the inherent characteristic of all best girls : she doesn’t exist.,1
474,"Man, that moment with Suika finally being able to see properly was really heartwarming. And I've been thinking this for a couple of weeks actually, that in a world without glass I'd be useless. Honestly having myopia and astigmatism sucks",1
475,Suika is freaking damn cute     uwaa,0
476,  Cuteness Overload,1
477,"Another enjoyable episode!    I actually love that Senkuu couldn't do the glass making. A very realistic storyline of him of course not being a master at everything.    OMG, total shipping Senkuu and Kohaku! When she said his ""ten billion percent"" while talking the same way as him, that was so cute.",1
478,"Right, having the knowledge of how things work and having the  skill  to pull it off are two very different things.",2
479,"First off, Suika is absolutely the cutest child in anime I've ever seen. I like that she doesn't have the typical superloli voice and actually seems like a child and well, not a Loli. When her newfound clear sight went blurry mine did too.     Senku's reaction faces are my favorite part of the show. Actually, he's just a beautiful dude in general. The character designs are great especially Tsukasa. Maybe JoJo does make you gay...hmmmm. Everyone has God tier reaction faces. Kohaku is peak blonde waifu god damn do I love her. I tend to end up liking the characters names Kohaku in shows.    This show feels like a but of a slow burn but it's good!",1
480,Finally I can praise the OP for teasing Suika's lenses with that little glint in the light,1
481,"I thought they were just gonna make glasses and ditch the watermelon head, but they just put the glass into the watermelon! WE GOT THE BEST POSSIBLE OUTCOME!",1
482,It was explained in the manga that melon helmet was just for prototype but Suika is so used to wearing that she’s fine as it is.,1
483,So what do you guys think the girl's disease is? Tuberculosis?,2
484,the dreaded japanese cold,0
485,"She's not 100% bedridden, so no.",0
486,"The one You can catch after standing for at least 1 second in the rain, right? Dang it, heard it's hella dangerous. Poor thing...",0
487,Lupus,2
488,It's never Lupus.,2
489,Except for that one time when it was Lupus.,2
490,"With lupus you would see a butterfly rash and an aversion to sunlight. As far as I am aware, coughing is a major symptom.",0
491,"It’s not a good idea to ask for people to throw around guesses, when many like myself red the manga. You should google what are the most common diseases people used to get before modern medicine, with what we know from Ruri’s condition, or a ask a friend in med school what he thinks.",1
492,"Measles, smallpox, polio? All diseases easily preventable by vaccinations. Remember kids, vaccinate.",1
493,We killed smallpox. Humanity defeated it just as we defeated the night.,0
494,"From previous episodes flashbacks of her and Chrome as kids it seems like she has had it for at least 6+ years. Chrome asked her ""the usual stuff?"" so maybe she has had it her whole life",1
495,"If it's TB she's a goner, sulfonamides won't help either.",0
496," ""this is Senku's greatest fear, and he addresses it later on.""",1
497,"Either the episode was really fun or my depression weakened. Either way, I laughed several times just before Senku laughed and it was kinda ""embarrassing""",1
498,"This episode  is well animated. The characters are nicely drawn. The Kingdom of Science attractions are well adapted from the manga, the extra highlight on on each attraction is so good",1
499,No one's going to mention Ginro's tongue was a mini Ginro when talking about silver and gold spears?,0
500,Scummy snake tongue,2
501,"Every single week, it gets more and more tempting to just dive into the manga.",2
502,"I always thought that was the point of most anime, to get people to read the source. Don't fight it if you don't have to.",1
503,Generally yes and certainly in the case of Dr. Stone. Since it's still airing I think it's important to point out Demon Slayer as an exception though.,1
504,Yep the Demon Slayer Manga has very average art compared to the anime,1
505,  PROTECC SUIKA  ,2
506,"this is a brilliant episode. one of the most magical moments yet with Suika seeing clearly,  AND  badass best boy Kaseki is finally introduced.     feelsgoodman",1
507,"Best girl with best scene for me has finally happened. Detective Suika is so precious, but I'm now excited for second best girl to enter the scene next episode.",1
508,"Are you talking  ""'the green fairy?'""",2
509,Yes I am.,1
510,LITTLE GIRL SEES SUNFLOWER FOR THE FIRST TIME EMOTIONAL,1
511,"When I was asked what I wanted to be as a child my answer was always the same, a scientist. As I grew older and realized how much hard work goes into it I changed my mind, but one thing stayed the same:     I still worship scientists and science itself.    Don't get me wrong, I'm not claiming to be really smart or anything. I just really like it and left unchecked, I can end up gushing about something I saw on youtube that I found really interesting for way longer than I should.    Which is why I love Dr. Stone so much. It's clear the author shares this worship of science to fill their story with so many genuinely informative segments. Senku himself is on his way to becoming one of my favourite anime characters ever.    It's so amazing to see how science can improve everyone's lives and maybe even better so to see how excited Chrome and especially Senku are to be doing so. I swear, I smile just as wide whenever Senku has that smug grin on his face.    I digress, I just love this pure and genuine appreciation of real science.",1
512,"           Exact same thing here. I absolutely adore everything about science, even though I could never work in that field. I can however bore my friends to death with an hour long monologue about some awesome scientific news or fact. Too bad 99% of them are not interested.. I need more ""scientist"" friends.",1
513,Aye same but I still want to be a scientist,1
514,ever since senku met chrome this show has been amazing,1
