,Comment,Sentiment Rating
584,"I don't want to be that guy but I do these things for a living so, yeah, I gotta do it.        That's not how cancer works.     Cancer isn't just determined by your genes but it's heavily influenced by your condition as a whole.    So yeah, she could totally have cancer because she was unlucky as fuck.          microbiologist mode: off  ",2
585,"Yes, he said outside of cancer of you read his comment.",2
586,"Damn, I am stupid.",0
587,Kohaku's personality is so damn fun to watch in this show. Holy shit.     Chrome's also entertaining since his introduction. I love how each of these characters all stand out in some way or another.,1
588,"Incidentally, fire gilding, the method Senku used to gold plate the spear tip, is actually extremely dangerous. He's correct about the smoke being poisonous but even a little over time will poison you.",1
589,"Senku's approach to health and safety rules is ""well, looks like all the inspectors are stone statues now sooo..."".",1
590,"""Gold smoke! Don't breathe this.""",2
591,It's actually the Mercury that you have to worry about.,2
592,"Ah yes, I've been looking forward to this part of the series so much, and its so satisfying to see it finally get animated.    My only complaint is that I'm really not feeling Ginro's voice. He just sounds young as opposed to the endearingly pathetic voice I had in mind for him.",1
593," ""Recent chapters do say he has a young girly voice so it does at least fit."" ",2
594,He sounds like a whiny brat,0
595,As it should be,1
596,Chrome is finally here.  Best boy incoming!,1
597,Senku found his science buddy!,2
598,Senku found his Jesse Pinkman,2
599,Damn this episode really spiked the quality of the show.    Can't believe i was so happy when Senku was happily mentioning rock names that are completely unknown to me.,1
600, minerals,2
601,"The power of bubbles!!!!    This episode was immensely fun just for the fact we got to meet two of my favorite characters from the manga, being Chrome and Kinro. Ginro is fun too, but he still has a way to go.     One of my favorite scenes of the manga was here too with Chrome finding about civilization! It's a powerful moments and whoever voiced him killed it.     I also have finally noticed Kohaku's weird space between her eyes. Now I can't unsee it! Yay...",1
602, At least Kohaku is pretty gorilla. ,1
603,Why Gorilla's always gotta be blonde?          yousaidsomethingdumb ,2
604,Maki from Fire Force isn't blonde.,2
605,Shes an ogre though.,2
606, WHAT DID YOU JUST SAY! ,0
607,Huh. I just realized Maki is just an older akko from little witch academia.,2
608,well.... she's a witch,2
609,Otae from Gintama isn’t blonde.,2
610,Kondo is,2
611,F for Chitoge,2
612,Grillilla,2
613,Dicks out,2
614,hello there  totally not Einstein ,2
615,Dr. Wily!,2
616,"Fuck, it got interesting. Honestly this show had not clicked for me, but this episode, this Chrome guy... fuck, I'm hooked",1
617,"Science fight! Science fight!    Damn, I just love how in this anime every character has  CHARACTER . Like Kinrou between the stiff type and Ginrou being the scared type. They aren't just all pushovers like in most anime where they see a guy falling from the sky and welcome him into the walled city or some shit.    Reminds me of the Slime anime.",1
618,"I'm at a loss. This episode did such an AMAZING JOB at hyping us up for the rest of the series. I feel that with minor tweeking it couuld serve to be the first episode honestly, because these characters are above and beyond more interesting. But at the same time, I am so hyped for everything that is developing in the background so far and I am just as invested in that. It's just a shame that the first couple of episodes weren't as much of a hook as this one because I found it hard to recommend this series previously. All in all, I'm glad it came around with this new cast because I am sooooo eager for more!",1
619,Senku and the Lioness are pretty cute together,1
620,"Ah, I love it. No ""beating around the bush"" crap. He straight up told the other person about the human past, meanwhile in any other shonen you would see how that guy would know it in the last episode with a cliffhanger.",1
621,"what chapter of the manga does it stop off here?, really cant wait anymore because i wanna find out EVERYTHING.",1
622,"It stops at the end of chapter 19, so you can start with chapter 20.",1
623,Thanks!,1
624,Read chapter 19 to see the math battle.,2
625,"Honestly, start from the beginning, the manga goes really fast and there's details that haven't been adapted fully or were differently presented. Still a fantastic series either way, but I guarantee you won't be disappointed.",1
626,"I feel you man, I'll probably end up doing the same!",1
627,Im at chapter 50 rn and will probaly finish the rest tomorrow! Defientaly worth it,1
628,It's doable. I got to chapter 50 a week ago and finished the rest last night.,1
629,"I'm not sure about this episode, but it was definitely a transitional ep between the end of the last arc and the beginning of a new one. So I'm hopeful, but remain unconvinced with regards to the new characters.    On an unrelated note, props to the unknown dude in the past who got themself un-petrified and decided ""Hey, everybody got turned into rocks, so we should name our kids after rocks. That sounds right."" What a lad.",1
630,"Yeah, science! I'm hyped to see them create antibiotics",1
631,Heck yeah...I love the new character. This anime is just getting better every week.,1
632,This just keeps getting better !,1
633,I was so looking forward to seeing the science sorcery battle animated and it did not disappoint.,1
634,The battle between Senkuu and Chrome was very entertaining especially since Senkuu was able to figure out all his tricks. Kohaku reaction to being called a lioness was pretty funny.,1
635,Every episode I'm amazed at how great this anime is. I think it might be one of the best things to happen to anime in a long while.,1
636,"now Dr. Stone has entered or surpassed the part where i become hooked to the Manga, and now also hooked with the Anime. until now i am satisfied with the Voice actors, if i close my eyes and wanted to give the Manga figures a voice, then the Anime reach them just fine    good work ""Team""",1
637," Damn nature, you scary!     made my day",1
638,"An amazing episode I'm liking Senku being in the Sensei roll. Random, but I wonder if Tsukasa will teach Taiju how to fight since he's ""ok his side"" now.    Im interested in the potential outcast society. If the main village only has 40 people. How small in number are the banished people? How many generations have they been doing that for. So many questions!!    This is getting exhilarating.",1
639,Good episode. Chrome is a pretty cool dude.,1
640,"""There will always be that one idiot who will try everything!"" - Senkuu    I loved this quote way too much.",1
641,"I think they really nailed Chrome in this episode, the voice acting was on point and really captured the character. However, I'm a bit disappointed with how Crunchyroll translated his catchphrase. If you're listening to the voice acting, you'll notice that Chrome says ""yabee"" a lot. This is a Japanese slang word with a lot of different meanings. In the manga, this is translated as ""bad""  meaning either ""not good"" or ""bad ass"" , but Crunchyroll has given it a different translation based on the context  ""oh crap,"" ""awesome,"" etc . This solution works, but the catchphrase gets lost in translation as a result. Like, what would Crunchyroll do if another character points out his catchphrase? Well, I suppose there isn't always a perfect solution when translating such a different language, and I appreciate the quality on the translation in general.",1
642,"One weird thing about this episode is that Kohaku says forty in english  about the number of villagers , but Senku repeats yonjuuni and the subtitles say 40 so some weird dissonance happening here. I believe the manga says 42 so Senku's intelligence transcends reality.",1
643,"Senku doesn’t actually say anything in the manga, it just cuts to the double spread page with the names and faces of all of the villagers. I think they added the line to emphasize that Kohaku counts in English and also because many Japanese kids watching won’t understand the English numbers.",0
644,     That's because Senku says 'yonjuu-nin'  四十人  not 'yonjuuni'  四十二 .,1
645,"Well that would make sense, I just probably can't hear the ん because of my lack of experience in japanese.",2
646,"Like you said, it has a lot of meanings which means one translation cannot be a catch-all. Other characters use it too  I'm pretty sure our carbonation boy will use it a lot  so it wont be unique to Chrome.",1
647,"Up until this episode I was majorly on the fence about this anime. It felt real fast. Nothing was really happening per say. They just kept introducing characters with what felt like no plot, HOWEVER now I'm 10 billion percent on this anime. I cannot wait for the rest of the season and hopefully more.",1
648,1st Arc is considered slow and the weakest. It only gets better from this point. The anime had conveyed well the emotion of Chrome learning about humanity,1
649,Kohaku blocking Ginro Kinro while Kohaku's lovely butt being covered by that small piece of  leather,2
650,Wowow. When I heard new characters were gonna be switching places with Taiju and Yuzuriha I thought I wouldn't like it. But!! This is awesome. I love Chrome he's funny but a man of SCIENCE. Awesome!! I hope him and Senku work together a lot more in the future this duo is dope.,1
651,IT IS THE VILLAGE ARK,2
652,Kohaku looks like rika from digimon. The one with the yellow fox that everyone lewds,1
653,"I see now why people where hyping up Chrome  and am also glad I'm not the only one who thought he was Taiju with a headband from the OP lol . I almost teared up a bit myself at the part where he cried after learning the fate of technological civilization.    Things are a bit too dragged out sometimes and I can't quite get over the female faces, but overall I'm really loving Dr. Stone and looking forward to Senku's nation of science.",1
654,Senku and Chrome are just the best duo,1
655,"Dr. Stone, meet Google Chrome. Best buds from now on.",1
656,"I love how Senku initially teases Chrome about how primitive his little science tricks are, but he truly does admire how damn impressive his accomplishments are given their level of technology. He's such a good boy.    I also got goosebumps when he explained the world before the petrification. You can almost imagine watching a show from Chrome's perspective, where he survives in a stone age civilization. This would be like the Season 3 finale where he finally learns the truth of the world and it changes everything. Essentially Attack on Titan.",1
657,Chrome is so awesome,1
658,This science bro-down is fantastic. Chrome  1,1
659,This episode had so much love for science. A reminder to never stop trying. It also helped that I was at the gym while watching the episode. Can't wait to read the manga after the season is over,1
660,"Ah this is what made me love the manga. Senku and Chrome’s relationship, together bonding through science!",1
661,"I always feel so bad whenever I see the poor dog on a walk from the disaster day... He was probably stuck on that leash til he dehydrated or starved to death, assuming he wasn't eaten by a lion T T it's like futurama and Fry's dog all over again...",0
662,I read here that was the feral dog with the wolf pack in the next aftermath scene.,2
663,"Holy hell that last minute really got me excited, this is the best new anime of the season, it’s a delight",1
664,Anyone else get really sad when they saw the puppy stuck on it's leash?  I'm pretty sure it starved their confused and alone.  Rest in peace puppers.,0
665,"Senku meeting Chrome only solidifies that the world Tsukasa wanted to create is futile. No matter, how he clip the wings of science and kill the precursors. No matter how slow, there will always be someone who will try things out. You can't stop imagination and can't kill progress.    While Taiju is spying to Tsukasa and only semi-acquired yuzuhira. Our boy Senku, just acquired a lab, tools, materials, an assistant, and harem  kohaku and ruri .",0
666,"""Wait, that guy from the OP wasn't Taiju?!""    Also, nice DQ reference.",2
667,"Im allergic to penicillin which is found in most if not all antibiotics, and it sucks! Hope Ruri won't have an allergic reaction to that stuff when Senki Chrome create the antibiotic. I nearly died as a baby due to a heavy reaction from penicillin.     But good episode overall! Loved the new cast and those damn faces they all pulled xD!",1
668,"My mother is as well, as far as I know it didnt get passed to me, thank god.",1
669,Funny thing is that penicillin was discovered when sick people needed to eat something and their closest option was moldy fruit.,2
670," This new smart Monkey is gonna be fun.            glasses-push       I cant wait to see more of Jane, she seems fun.      Jane wants to fight Tarzan, that will be helpful.      IT TIME TO GET SOME ALLIES BABY!  AW YEAH!      Senku your scrawny ass cant carry that... good try but nope.      HE MADE A BUGGY!? HAHAHHH!      Wow a lot of people, 40 of them.  I wonder how long they have been up and going.      They dont know what bubbles are hahahahhaha.      Chrome, a smarty?  Hm ok lets see what he can do.      These guys aint gonna be able to handle Senku lol.      Senku already planning to use that ball to make electricity hahaha.      HOLY SHIT THAT STATIC HAHAHAHAHAHAHAH      So Chrome made all this without knowing anything, not bad monkey.      Battle of numbers... Monkey... you barked up the wrong tree.      Man Senku got a lot of handy stuff.  This is gonna be a major power boost.      Monkey gots a girl he wants to help?  Jane's sister?  She looks like like Jane wow.  Twins?      Preistess?  Of what?  Hmm...  damn shes not well, Time for Senku to save a girl!      Senku telling the monkey everything huh?  He could be a great ally if he knows more.      Oh shit, Antibiotics.  Thats major.  Lets see if they can pull it off.",1
671,"First off, nothing he’s made so far isn’t too far outside the realm of a normal person.  Well... he did make rockets pre-stone world  hmmmm...let me rephrase. On top of being an space engineer, he’s also a biochemical engineer as well?",2
672,Well we saw him messin in the chemistry lab before the stoning.,2
673,"Can anyone tell me if that village are descendant of unpetrified people, or new evolution taking the exact same path.    I mean their knowledge seems to have literally plummeted back to zero. Can't be 0 knowledge being pass down unless the ""first"" ancestor started out with 0 knowledge too eg parents died after having children but not before teaching, or unpetrified children that hasn't receive education .",2
674,"To be fair, if you'd be the only human left on the planet, how much scientific knowledge could you remember? How to build a house? Agriculture? Electricity? Medicine? Tools weapons?    I'm guessing 99,9% of humankind would be down to actual stone-age level.",2
675,Remember? Most people never even knew.    The average person's knowledge of modern society is how to use devices other people made or take care of medical issues by just taking something prescribed. Take that away the people with specialised knowledge and they'd be in a worse state than a primitive society.,2
676,"I'd be able to reinvent binary and logic gates.    So, um, I'll be one of the first to starve to death.",2
677,"Oh I am not taking about them bringing back all the tech and stuff. It is just that going by chrome action, it is obvious he is ""rediscovering"" the periodic table. Another example is that in our modern age, we understand microbe and its importance to survivability yet the village seems clueless doesn't necessary means they need to have the ability to treat it, but just knowing about it .",2
678,"At this point, we only know as much as Senku.",1
679,"It didn't plummet to zero. They speak perfect Japanese, with a lot of English loan words and have  real life modern day mannerisms. Evolution doesn't quite work that conveniently. Or fast for that matter, it's only been 3700 years.     Your money should be either on ""descendants of people that were unpetrified generations ago"" or ""descendants of people that were never petrified in the first place"". Those are the most logical possibilities.",2
680,     Wouldn't thousands of years result in language drift if that was the case?,2
681,What changes would happen to a civilization that would never have any outside influence?,2
682,we wouldn't even understand people from 500 years ago ...,2
683,That's probably because how much cultures mixed. But here there are no different cultures.,2
684,"If you wanna be spoiled, go read the manga.",2
685,"I can tell you right now: 3700 years is not enough for a new human-like species to evolve.    As for their actual origin, that would be spoiler territory so that is more appropriate in the source material corner.",2
686,Ah ok good enough for me. So there is an explanation for their lack of understanding.,1
687,"but the language would be vastly different. try to read something from 300-500 years ago, you almost can't understand it because it's a different kind of English.",2
688,"But is that as a function of time or as a function of cultural shift and societal change? This village doesn't seem to have progressed much beyond hunter gatherer stage, so if it is that shift or change mentioned it might just not have occurred no matter how long this village has been around. It is just one of those things we can't really test to know its origin for sure.    But ultimately it is probably just a convenience to not have to go through the process of learning to communicate.    How was your comment relevant to what I said to begin with btw? My comment was just about the possibility of evolution of a new species even before the matter of language.",2
689,"     There is no way that:     ;    A  Something evolved into a spcies  exactly  like humans.    B  They  just  happen to speak japanese.    C  Something evolved into a new species in just 3 thousand years.     ;    So no, definitely not a ""new evolution"".",2
690,"Fair enough. But I was making the comment under the assumption of ""fantasy"" since the footnote at the end only mentioned whatever senku science offer are actual science. The story plot need not be.    After all global petrifaction and only on human and swallow? Plus undoing that actually heals a human enough that senku having his nerve snap can come back to life. So these are indeed fantasy settings. Oh and also tsukasa will never beat a pride of lion bare handed in real life anyway no matter how much a human train.",1
691,"Even if it's not completely realistic it doesn't mean the story will completely divorce itself from reality.     ;         Actually, there is a theory that explains this and is  more or less  real life complying. Of course not 100% realistic but fiction never is.     ;         Well, yes. This is one of those  relatively  small breaks from reality.",1
692,It's a Planet of the Apes thing.,2
693,Tsukasa is quaking,1
694,"There was so much meme material in this episode LMAO    Hopefully Ruri gets healed next episode, she looks like a really nice sister.",1
695,Next episode.. pfffff   ,1
696,Yeah got tired of waiting so I'm reading the manga lol,1
697,Read it and you'll notice you've made a miscalculation...,2
698,Best ep yet,1
699,Damn do I really have to wait another week now?,2
700,"Go read the manga, it starts at chapter 20",2
701,That puppy in the flashback though! That was dark as  fuck !,0
702,Aww. Senku made a friend. That's nice.,1
703,They are gonna make antibiotics?      Alexander Fleming would be proud. Though this time it won't be accidental I guess.,1
704,Me seeing the village with 40 people.    Cotton matte,2
705,"I just hope that if this series expands beyond 1 season that they release quicker then most mainstream animes.    I really am loving it right now, quite unique in most aspects. I personally find it refreshing and new.",1
706,"So now we are gonna say a big ""fuck you"" to pure chemistry and we start to do some good ol' microbiology?         Damn boy, society is going on quite fast indeed.",1
707,Kohaku = Tsundere,2
708,She is neither Tsun nor dere. She is gorilla.,2
709,Wait I'm confused. Where did this village come from? Does first generation just mean they were the first to wake up from the stone? And if that were the case how did they know nothing about the stone people or technology? Something like that would have had to been passed down through generations.,2
710,"dont worry, itll get all explained later.",2
711,Okay but Senku is saying first-generation like I should know what that means,2
712,"First-generation would be people who were alive before the petrification and were later revived.        Second-generation would be people born in the stone world, descendants of the first generation.",2
713,Thank you,1
714,"This show is all i watch nowadays, it’s sooo good!!",1
715,I feel like the arc is going to be very intresting and different from four character just having conflict,1
716,"Shit, Chrome might actually surpass Taiju as best bro, and he managed to do that in a single episode! Now we've got the science bros!",1
717,Shout out to Dr Stone for helping me understand the science behind one of the characters from Land of the Lustrous.,1
718,I binged 7 episodes today. And now I started the manga. I need more of this series.,1
719,"Anyone else feel like so much happened in this episode and yet so little? Anyway, Chrome is probably my favorite character from the Stone World so far.",1
720,Bruuuh Senkus face has me dying,1
721,"Alright guys, I'm reading the manga, can't wait to see the medicine.",1
722,"Antibiotics in a world where the resistant germs are probably gone.    Ah... the days of drastically improving the life expectancy of people will return.    Chrome being a man of science, who knew nothing of the old world, is a great character.    Senku is right. Even if he falls, people will find a way.",1
723,"Kohaku lied that her extra trip time was because she decided to dick around. But as soon as the inner guards talk to the outer guards, she’ll be busted about the stray she took home. Wonder why she took that tact.",2
724,She probably just didn't want to worry her sister.,2
725,She'd probably get in shit if she was honest about getting stuck under that tree.,2
726,"Also this has been the best episode so far , hope they stick with the village arc for a bit and not make a whole episode about Tsukasa , Taiju and Yuzuriha meeting again because the last couple episodes were meh",1
727,"Easily my favorite episode so far. This series has never been among my favorites, I mean, the previous episodes were entertaining and I liked them but I definitely hadn't enjoyed them as much as this one. Kohaku is great!",1
728,"Is it just me or does chrome look like Taiju , my guess one of the first people to build the village might have been relative of Taiju.",1
729,"Finally, now this anime is starting to get REALLY good! Also, fuck yeah, we finally saw a glimpse of the loli  Suika!  I look forward to seeing more of her!",1
730,This show just got so much more interesting,1
731,"Her mouth says no, but her uncanny eyes says she's ready to repopulate the world with Senku's science children.",1
732,"Yah, Chrome!    How does Senku know that Ruri is suffering from a bacterial infection? Antibiotics would be useless against anything else.",2
733,"Yah, but what else should it be? If its a Virus, there is not ""much"" he can do, or it could be a parasyte, but i assume that wouldve killed her already. Creating Penicillin  i assume  doesnt take too long and covers a shit load of illnesses.",2
734,It' time for an episode of Dr. Senku's amazing medical know how!,1
735,"Yes, creating penicillin is a good move, but he seems way too certain that it will work.  Could be parasytes - not sure why you think those are always quickly fatal, could be a congenital condition, could be some trauma that caused long lasting damage, could be tons of other things my non-medical mind can't think of.",1
736,i honestly am really curious what the Bacteria to Virus ect. infection ratio was back in a time like theirs.,1
737,Back in a time 3700 years in the future? :P    There are no vaccines so that's one thing that's bad.,2
738,AntiVaxxers are the responsible behind the petrification?,2
739,Could be. But if you can't fix it why worry about it? Bacterial infection seems like a good guess and the easier one to treat.,1
740,"And even useless against many bacteria, not all antibiotics have a wide area of effect!     Still, it's a good idea.     I mean, deal with viral infection is complex in general so you should start checking for common bacteria or simply some other kind of secondary damage derived from a previous infection.    Given this fact, there is also the detail that viruses are... strange things.    Some evolves a lot  Flu  some doesn't evolve at all  Measles  so dealing with them would imply some tests, while bacteria would probably be a far less problematic thing to deal with.",1
741,"I mean even if he doesn't know what it is, creating antibiotics is probably the best option because there is a decent chance that it is a bacterial virus.",1
742,     A what now?,2
