,Comment,Sentiment Rating
0,Definitely. He appears in the following chapter which they are adapting the next episode.,1
1,Best boy coming through. I swear it’s like a boxing match between him and Chrome on who’s the best boy!,1
2,Until Ryusui shows up.,2
3," ""So next ep we'll get that awesome electricity shot. 25 chapters in 9 episodes  including the extra length first chapter . Turn up the pacing a bit and we could finish the war in 2 cours."" ",1
4," ""Since they're moving at around  3 chapters per episode, I hope that the narrative climax of the entire season will be in Episode 25, when Senku wins the war by using the glyerine in the bar of soap as the final ingredient to synthesize nitroglycerine  chapter 77 , and episode 26 will be the aftermath"" ",2
5,"Oof, they would need to cram 55 chapters into about 15 episodes. That's gonna be rough in some places.",0
6,3.6 chapters per ep. Not bad.,1
7,I wonder if anime watchers noticed that village people’s names are all based on mineral elements.,2
8,I found Suika's VA choice really weird.,0
9,"Yeah I was surprised it did not meant my expectation, which I thought will be more playful, gaki like.    But I’m sure it’ll grow on me",1
10,"I was expecting more little kid-like but she's alright. I think the only VA that's really throwing me off is Ginro, he sounds  too  high-pitched. I was expecting something more like a, I don't know, dumbass teenager voice.",0
11,Best place to read the manga? Its on shonen jump?,2
12,"Yes it's shonen jump series. You can read the latest chapters on mangaplus legally for free. Also, Viz released first 6 volumes. For alternatives, go to r manga.",1
13,"  Original comment by  u hintofinsanity |  Parent comment   r anime comments cuerhp dr stone episode 8 discussion exttjj0      ---    Don't worry, Suika is going to be...completely fine....    ---     This message was posted by a bot because originally submitted  outside of the Source Material Corner. ",1
14,  Original comment by  u MjolnirDK |  Parent comment   r anime comments cuerhp dr stone episode 8 discussion exxpixz      ---    That will come up in the episode that is probably the highlight of the first half.    ---     This message was posted by a bot because originally submitted  outside of the Source Material Corner. ,2
15,"  Original comment by  u Spaceguy5 |  Parent comment   r anime comments cuerhp dr stone episode 8 discussion extqb71      ---    The village's founders' story is revealed around chap 42 of the manga    so we'd see it if there's a season 2, unless they rush stuff   actually nevermind, I forgot it's 2 cour. It'll be in this season , although  ""there's a very subtle hint about where they came from in the ED""     As someone else mentioned,  ""You're close, about half right""     ---     This message was posted by a bot because originally submitted  outside of the Source Material Corner. ",1
16,The pulley became the ramen cart wheel,2
17,It's going places,2
18,literally.,2
19,You could say it's  rollin' rollin' rollin ',2
20,What kind of scientist wouldn't repurpose perfectly good intact materials?,2
21,"At this rate, the show is rapidly becoming ""Dr. Wheel""",2
22,"The soapstone, the so-called ""Dr. Stone"", washed their hands once. This pulley has saved lives and made transport a piece of cake.",2
23,"So they need ramen to win over the gluttons to have enough manpower to make iron to make antibiotics to save the girl.        This is totally a quest line, isn't it?",2
24,  Fetch quest  get iron sands     Craft quest  cook ramen     shop management minigame  ramen stand     definitely quest line lol,1
25,"I am surprised they did not have to slay random bandits that scream ""I will drink from your skull"" in the middle of that questline",1
26,Never should’ve come here!,2
27,"""Huh. Must have just been the wind...""      Proceeds to eat lunch with arrow sticking out of head. ",2
28,"40 bandits with horses, and you have 6 footmen and a poor crossbowman.",2
29,"Time to ride in circles for 30 minutes, slowly chipping away at their horses and shields",2
30,This comment got too real.,1
31,lol is this mount and blade?,1
32,The one and only.,1
33,That's a nice head you have on your shoulders,2
34,Literally started playing warband yesterday to hype myself for bannerlord,2
35,It's almost harvesting season!,1
36,BannerlordThen!,2
37,Recette would be proud.,1
38,"You made me want to pick up Recettear, I hope  you're  proud.",1
39,"so...as a dm gm keeper gamespecific running person, not a game designer, how can you communicate such a chain of events being better than the stabby stabby or shooty shooty option?  just set the thresholds for that so low that when someone entertains the idea of not murderhoboing they win? cause so many players want to be tsukasa with senku energy",2
40,"As a disclaimer I'm neither a DM nor a game designer  though I watch a lot of game design youtube videos , but maybe you could make the opposing forces physically powerful to disincentivize straightforward battles? Or something else in the game lore makes that not an option, unique culture with its unique taboos and stigmas, for example. Or a third-party arbiter that'd whoop your ass.     Then again, refer to the disclaimer, I'm talking without much experience XD",2
41,"For murderhoboin, make it so they actions have consequences. Your adventurers aren't the only tough guys around, and the world is filled with big wigs.    If they burn down a church killing all the worshippers in progress, have them regret it it  but in a fun way  have the Kingdom send its finest Paladins, lvl 20 tough guys who have the full resources of the Kingdom under their command. That church didn't exist in a vacuum, have the God of the church be angry at such crimes that befell his loyal worshippers came to seek his help, but not in a direct way, have him give the Paladins extra blessings to hunt the fiends.    If they assassinate the king, have the Kingdom commit everything it has to their pursuit, have all the Royal guards after their tail, checking every town and tavern, creating checkpoints in every road. Alternatively this the opportunity for an unexpected plotline, maybe have the assassination if the king the catalyst for a succession crisis, with a faction loyal to king's rightful heir and a faction loyal to an usurper, with the Usurper faction willing to cooperate with the murders, but still way of them, they aren't too be trusted of course. Of course the heir's faction is still after their heads.    Instead of having them fighting the big bads to save the world, have them aim for survival. If they do extra crazy stuff, have them become infamous everywhere, wanted in every Kingdom.    It's worth noting they I have never DMd, not have I ever played D&D, I only have a desire to play, but alas, no one in my friends even cares, and the closets adventurer's league is countries away.",2
42,Oh wait til you see the boss they have to face.,1
43,"It absolutely is and I love it. This show isn't super overt about the influence games have on it but there's certain bits like the ""Start quest!"" on his road map, the little 8 bit sounds Suika made as she rolled over the bridge, the multiple mentions of Dragon Quest, and the little ""xxx acquired!"" text boxes that pop up that really indicate the influence video games have on it. That and the fact that the entire plot structure is, as you said, very video game-esque.",1
44,"I also love how in those parts they mention some video games like Monster Hunter. They totally give a fun vibe, the show is partially a comedy after all so it fits in perfectly",1
45,"Also,  ""when Mario eats mushrooms, he's totally hallucinating, man..."" ",1
46,And people say it's not an Isekai.,2
47,"I mean, it's not in any meaningful capacity. Just because it's inspired by video games and is effectively ""another world""  which it still technically isn't  doesn't make it an isekai, especially since it doesn't adhere to any of the other tropes that are building blocks of the subgenre. It doesn't fit in the isekai box any more than say Saga of Tanya the Evil, which is even more literally an isekai while also not conforming to genre tropes in any meaningful capacity.",2
48,"I know, I know, it's just fun to draw the connection when the show does more Isekai-like stuff",1
49,"It's a craft tree, this is where you really start realising Dr. Stone is basically the anime version of those survival crafting games like Don't Starve.",2
50,Holy shit senku is basically anime wilson,1
51,"I mean... Those games are just based on real life crafting anyways.    To make a thing, you need things, and to make those things you need other things, so on and so fourth.",2
52,"True, but IRL, it's a bit unfeasible for a single person to go from sticks and stones to complex machinery built with iron smelted from minerals with a furnace made with clay bricks and powered by coal... all mined by them. Instead that's exactly what happens in those games, and Dr. Stone is close to that too, though it does put more of a focus on teamwork.",2
53,"The most unfeasible thing is really just your environment. In Dr Stone they have and I expect them to continue to just conveniently have the materials they need in easy reach and being easy to find.    And how they seem to be able to do sometimes way too much work conveniently offscreen.    The ""tech-tree"" thing makes sense. It's just they magically only have to deal with bad luck if it's plot relevant and can work super-humanly fast when the camera isn't looking at them lol.",1
54,"     Yeah, that was my point. They both work amazingly fast and have almost everything work perfectly at their first attempt, even if it's just rudimentary rigged-up contraptions based on crude designs. The further you go into the manga, the more noticeable that gets, culminating in stuff like  ""the mice-shaped RC cars used to carry messages across distances and terrains that would give even modern ones a hard time"" .",1
55,"They do at least mention things like having say three options in how to go about something and two being unfeasible due to lack of tech resources, like when he tries to make antibiotics and can't just rely on random chance to make penicillin, so he needs the iron.",2
56,"Sure, the show is handling it fairly well and isn't being egregious with the plot armour. But it's still making things a lot easier for the characters than in real life.",1
57,"Of course, thats probably just for plot convenience since the show isn't super bleak. I just enjoy that they think about alternate routes and what works better rather than asspulling the one solution every time.",1
58,Anime Factorio.,2
59,"Senku got interest in her, not because of her beauty  He did not saw her until now , he is interest in her Wisdom. She is right now some kind of High-Priest in the Ancient past. Guardians of knowledge  but also exploit of it     Just check up our own History about church teaching the ""poor"" in the middle age times. I bet all around the world was nearly the same",2
60,Yeah guessing she found some kind of working cache of knowledge from back then and is using it to educate  but also power .,2
61,"Yeah, he just needs to do  One Small Favour  to get their help.",2
62,"And getting the iron is just part 1 of making the antibiotics, this is gonna be one of those side quests that the devs made ridiculously long and tedious for shits and giggles.",1
63,"I feel like that's the ""point"" of the Dragon-Quest styled status updates on what Senku has acquired or progressed towards.",2
64,This whole arc is a series of questlines and I love it lol,1
65,Great now I want both a Made in Abyss video game and a Dr Stone video game.,1
66,Pretty sure ive seen 90% of this episode on Primitive Technology. Thats neat.,1
67,"Even ramen? Damn, i want the sauce.",1
68,Your flair seems a bit fishy,2
69,He likes them young.  Just like tsukasa,2
70,What do you mean?,2
71, Nothing special..   hellopolice ,2
72,oh no,2
73,Hmm?  Reads his flair  Oh......,2
74,"its double entrende. Could mean something that results in FBI OPEN UP! or a predator from ALIEN, but loli-version.",2
75," He made pancakes.  I seem to remember him making noodles, but I might be mistaken.",2
76,"Like he said, the pancakes have the texture of rice noodles. All that needs to change is the shape.",2
77,not just the pancakes but he has many videos making iron pellets from iron bacteria.,2
78,"Yeah, there are some interesting ways of getting iron, like bog iron.",2
79,That works too,1
80,I hate to say it but my enjoyment of the show went up 10 billion percent after it started focusing on Senku's solo shenanigans. Feels like an entirely different season somehow,1
81,Isn't it just huts and clay pots now?,2
82,"He's tried to make iron from iron producing bacteria and gotten a little bit, but nothing he could really work with",2
83,I thought they had a heavy water nuclear reactor now?,2
84,And sandals he never wore again,2
85,Lowkey disappointed Senku didn't try burning twigs into charcoal.,0
86,Charcoal is just really dried out wood. It still wouldn’t get to the heat necessary for smelting iron like they need without some way to stoke the fire harder than what they’ve currently got.,2
87,"That combined  with a forge and leave blower per person, though... ",2
88,"Nah. That setup was only good enough to get tiny, unusable metal pellets of junk-iron. They’re going to need to manufacture much larger quantities of much higher quality stuff. Scaling the entire operation up several magnitudes to accommodate that means they’d need a lot more manpower, even with fancy blowing gadgets to stoke the flames.",2
89,Fair enough. I don't know a whole lot about this anyway.,1
90,"     Not exactly.  Charcoal is almost completely composed of pure carbon, whereas very dry wood, let's say 0% humidity still contains organic compounds and a trace amount of a bunch of other stuff.  You'll notice that a charcoal fire is relatively smoke-less compared to a wood-fire.  This is indicative of a more complete combustion reaction occurring, meaning more atoms are forming new bonds and thus releasing more energy.",2
91,Oh! He's going to make BREAD.          What.    Edit: I love that Senku learned the reason his navigation thing wasn't working a few episodes ago is because the north star moved. Everything that doesn't make work in this anime has a reason for it and that's awesome.,1
92,"Don't most breads require yeast and a clean oven? Well maybe tortilla or naan types, but you just have to boil noodles.",2
93,"Yes, but wild yeast is pretty much everywhere. You can make a batch with some flour and water. Here, you can try it yourself:    1. Mix equal parts flour and water.  1. Pour it into something very clean and cover it with a cloth.  1. Leave it somewhere shady and cool.  1. Every day, pour in some more flour and water.  1. Keep doing this for like 2 weeks. If it's bubbly, you're doing good.    You now have wild yeast starter. It's not gonna be the world's best sourdough, but it'll make surprisingly good bread.",1
94,I mean you would expect someone living in Japan to be more confident in making ramen than bread .,2
95,bread is super popular in japan. Bread in one form or another is a human cultural constant for the last several millennia,1
96,"Yeah but you can make an entire feast with ramen, bread is nice and all but i'd kill for some noodles right now",2
97,"No, not really. Bread is worldwide, and just because ramen is popular doesn't mean people know how to make it. If senku knows penicillin surely he would know bread...",2
98,"     Most, not all. In fact, ""yeastless"" bread was all mankind had for thousands of years.",2
99,"Nah, you don't need yeast, though that does make it pleasantly fluffy.    In australia we have  damper , and even the indigenous people had their own yeast-less bread.    Senku could probably get salt, and we all know that carbs + salt is a simple recipe for deliciousness.",1
100,Can't wait for them to explain Tsukasa...,2
101,"I think petrification is easier to explain, tho.",2
102,"I legit thought he was making pizza.    ""I'm going to make everyone's favorite food!""     Goes to wheatfield ",2
103,People thought the same in the manga too man.,2
104,That ironmaking scene was absolutely wild.        And Melon Cutie is here! She seems like fun.,1
105,Senku's soul is about to leave his body,2
106,Every week I fall more in love with this show. Facial expressions displayed by the science-squad were all beautiful,1
107,Senku will become a dictator of the village,2
108,Republic of   the people   science.,2
109,USSR    Union of Survival Scientist Republics,2
110,"To be fair, the USSR went from rubble to space in 15 years through hard labor. Reasonably accurate comparison?",2
111,"Yeah, they also fucking murdered genetics as a science so… yah",2
112,Guess people downvote you because they don't know about the story of Lysenko and how the USSR tried to run an agricultural program on neo-Lamarckian principles because some higher ups thought it was more politically palatable than genetic inheritance.,1
113,Yup,1
114,Wasn't his plan from the beginning to make a nation of science? Probably with him as the ruler.    All hail Kaiser Senku von Lohengramm.,2
115,You fool! Modern science is the best in the warudo!,1
116,Let not... he doesn't have a sister and doesn;t have shitty dad and no neighborhood redhead.,2
117,I can't think of any other protagonist dictators.  Besides Ainz. ,2
118,"He’ll be the best case version of Stalin, since he actually gives his people food!",1
119,Inagaki Riichiro  manga author   tried the ramen recipe the gang used this episode.  seems like it was as good as Senku made it out to be!        sagiri ,1
120,"     Holy Shit! What is this magic?            ITS FUCKING BLAND! IS THIS YOUR FIRST TIME COOKING? THE NOODLES ARE UNEVEN AND THE MEAT'S NOT CARVED AT ALL? IS THIS...DID YOU PUT RAW LEAKS IN HERE! HOW COULD YOU PUT RAW LEAKS IN A STEW, THEY NEED TO BOIL WITH THE BOTH! FUCKING HELL...  ",0
121,  YOU FUCKING DONKEY  ,0
122,     FTFY,0
123,Shiny monkeys rule the world. It's the hairy ones that are behind on the times.,1
124,I’m an idiot sandwich!,2
125,Senku would prolly  bribe him  with some ceramic knives and stoneline cookware        kukuku ,1
126,Which he would make scrambled eggs in. For real this guy love his eggs. Too bad he would need senku to him some butter.,1
127,"Well, no cows or really any domestication , but they  do  have breast milk, and you can totally make that into a butter, so...",2
128,You can't bribe Gordon Motherfucking Ramsey. Well at least not with material goods. Only with new exiting recipies.,1
129,You fat useless sack of fucking yankee dankee doodle shite.,0
130,Too bad their all in Japan or that would be the first person Tsukasa would revive.,0
131,I thought Tsukasa hated adults,2
132,But who hates good cooking? He would be an exception.,1
133,There are no exceptions.,2
134,Rules are rules,2
135,Maybe an useful adult could make a fine slave... but I kinda doubt he would consider that.,2
136,nah ramsey's too mean for tsukasa he'd be a pile of rocks,0
137,Too old. : ,2
138,"Nah, he is nice to kids.",1
139,Pretty sure he destroyed an entire family with 2 kids in an earlier episode,2
140,"Even though that comment is a joke...In a strange way I think Ramsey would appreciate it, given the ingredients they started with.",2
141,Even senku didn't appreciate it.,2
142,WHAT THE FUCK ARE YOU??,0
143,Senku has Max Brain    Chrome has Max Curiosity    Kohaku has Max Agility    Suika has Max Stealth,2
144,Combine them together and you got a Isekai Protagonist!,2
145, ,2
146,"Hai hai, joke desu",2
147,     jooku  desu,2
148, joudan desu yo Jotaro-kun ,2
149,Yes. Yes he is.,2
150,I   died   got petrified and   reincarnated   awoke in   another   this stone world.,2
151,Now to find a Truck-kun.       Or perhaps...make one.,2
152,We'll great science's greatest plot device! TRUCK-KUN!!!,2
153,"You could actually classify Dr. Stone as Isekai, just like Futurama could be.",1
154,It depends on how you personally define isekai for me it’s in the gray area between isekai and non-isekai,2
155,"Personally i define it as an entirely new world.  Dr Stone is the same world just thousands of years ahead in the future.    It's why Anime like SaO are the grey line for me, Their in another world technically but their physical bodies are still in the real world.",2
156,Does innuyasha count? Its the same world but different time?,2
157,"I mean, I consider Fushigi Yuugi to be Isekai. I think it's technically the same world, just feudal China.",2
158,"First one is Mark Twain's A Connecticut Yankee in King Arthur's court. At base a time travel story but as the fact that King Arthur might be just fiction was known in Mark Twain's time as well Twain is sort of sending someone into a fantasy world.  Want something original you live to late in the time line you need to be in 1800's. Edger Allen Poe inventing the Detective Story, with a hero who is basically Sherlock.",2
159,"Isekai is a name we started to use because of all the new animes where Japanese MMO fans can imagine they get to live in the game. While it means ""other world,"" this MMO basis is what isekai is. So this is not an isekai.    It's just like how not all cartoons are anime, short for animation. While they are all animated, we use ""anime"" for a particular type of animated cartoons.",2
160,Its sort of isekai but with actually smart writing and challenges to overcome rather than just an excuse to set it in a fantasy world but have the MC be generic and relatable.,2
161,LMAO,1
162,Need Max Harem.,2
163,"What fucking Isekai besides Overlord have you been watching? I've found that Isekai protagonists are some of the dumbest, laziest, most annoying sacks of shit I've ever seen.",0
164,"I was being sarcastic, but ok.",1
165,Senku is practically in an isekai.,2
166,Tsukasa had Max Strength    Taiju had Max Endurance    Yuzuhira probably had Max Dexterity  in terms of making stuff     Every character has some sort of 'ultimate' ability,2
167,     So that's why these characters look like they came straight out of Danganronpa.,1
168,Super High School Level Primate.,2
169,"They totally do. You could write a Dr. Stone AU where they're in one of Monokuma's sick games. Chrome probably would be the protagonist, he seems suited to playing detective.",1
170,You say that in the episode that the Great Detective Suika is introduced?        angrypout ,0
171,"She would be the heroine of course... Or rather 3rd member of ""circle""",2
172,Tsukasa looks just like  Sakura ,2
173,"Chrome, the Ultimate Sorcerer    Senku, the Ultimate Scientist    Kohaku, the Ultimate Lioness",2
174,     I think you meant the Ultimate Gorilla.,2
175,Danganronpa trilogy is coming out on switch. I never finished 2 so now I'll have the chance  I played them on vita so am fond of hand-held danganronpa .,2
176,Danganronpa 2  ,2
177,I liked the ending somewhat but it felt like too much. I get they probably wanted to up the ridiculousness but they killed the series for me and the actual series Danganronpa is done now.,1
178,"I could treat it like that but then the whole thing loses the impact. It doesn't mean anything to me if it's a  ""Seperate Universe and if it it isn't one it makes everything feel obsolete""  I like V3 but I was hoping it would be more or a reboot than it actually was.",1
179,Level 99 Crafting.,2
180,"I have Max social anxiety, can I also be a cast member?",2
181,"Moe-chan is prob max charisma or something.  Her smile could stop wars, or start them...          feelsgoodman ",1
182,"Tsukasa has ultimate endurance as well, he is also very intelligent.",1
183,"Yes thats called ""talent""",2
184,best boi coming,1
185,Praise be.,1
186,Kohaku has Max Vision,2
187,Taiju: Max Stamina    Yuzuriha: Max Dexterity    Tsukasa: Max Strength    Can't wait for the other characters to appear.,1
188,i love the other max curiosity guy that comes from the village,1
189,Kazuma desu,2
190,Seto Kaiba has Blue-Eyes Chaos MAX Dragon,2
191,We Shokugeki no Senku now bois !,1
192,"Sadly, no foodgasms to speak of... yet.",1
193,If  this is the wrong kind of foodgasm  then I don't want to be right,0
194,I like that the ramen in his mouth made an exclamation and question marks.,1
195,"OMG I didn't notice, that's amazing lol",1
196,time to cook some instant ramen for myself,1
197,Turns out you don't need Compound V to give people Eye Beams.,1
198,You don’t want to be right.,1
199,A rock based antibiotic... ANOTHER Dr. Stone?!    List of Dr. Stones so far.    1. Soap  2. Petrification healing  3. Sulfate Antibiotic,2
200,4. The friends we made along the way,1
201,I thought that was the One Piece?,2
202,"I mean... they DO come from stone, mostly.",2
203,"This episode we are introduced to one of the most fundamental laws of the universe:       SUIKA=CUTE       Also  ROADMAPS.  The roadmap spreads in the manga are the hypest shit ever, it's like a proper RPG questline.",1
204,"     And it really feels like one playing out, each step leads to another, occasionally requiring a pit stop to do something else to achieve another necessary step. It's just so satisfying to watch play out.",1
205,Blushing from under the melon was super cute.,1
206, Y'all need to remember the original Suika and what he stands for! ,1
207,Jonny walked so Suika could run,2
208,     Clearly this season's best melon!,1
209,Now we know what to do if we ever get sick while stranded on inhospitable lands with no access to healthcare        happyclap ,1
210,Ooof.,0
211,SUIKA = CUTE is a new law of physics.,1
212,Suika must be protected at all cost.,1
213,"     Ah, we're going to ""meet"" the ""character"" who won like, 19th on the Character Popularity Poll pretty soon, aren't we?",1
214,"Wait, was SHE really on the popularity poll?    Like, ""SHE"" . The BIG SMELLY one?",2
