,Comment,Sentiment Rating
173,"What would they pass down? Just the simple fact that humans used to be able to fly and travel insanely fast? What can they even do with that information?    ""We used to be able to do all these amazing things.""    ""How?""    ""IDK LOL""    It's not unreasonable that, somewhere along the line, people started thinking these ""knowledge"" are useless and abandoned them and started focusing on not starving or freezing to death.",2
174,"     Inspire, of course. Much as birds first inspired us, one could use the tales of the old world to give everyone goals to achieve.",2
175,"Suppose Atlantis existed and was a completely lost technological civilisation from 10,000 years ago, and suppose the myth of Icarus was really what remained of the memory of them using gliders to fly. Would we  ever  think of it in that way, or just think it was a random fantasy story?",2
176,"I mean you say that but that is more or less how the people of old used to do things. Hear stories or observe things and become inspired, then inventing.    Flight is the most obvious example here. It's easy to see what inspired humans to try flying, and we have a decent length history of people attempting and failing to do it before the Wright Brothers.    That said, a story such as Senku's is much better the more of the information you can preserve. In your scenario, the main issue is that a lot of information is lost completely and so the story completely changes form.    In Senku's case, he has the means to record it all, and with his genius he could probably find a way to mass-produce that information once survival isn't a priority. The depth of knowledge he can preserve not only inspires but informs, and stands as a good reminder of ""This is what we can achieve if we put our minds to it. Use that brain, knuckle-head.""",1
177,"Well, my point is more, without specific instructions, those stories  based on reality  will do no more good than inspiring as much as a myth could. And their reality will also be lost to time, so that destroys the element of certainty that comes with knowing that at least it  can  be done.",1
178,Maybe for some reason they decided not to tell their kids and pass it down? Either they gave up such things as being lost forever or someone like Tsukasa won?,2
179,"Reminds me of Yugas in Indian mythology. Humanity goes through a cycle of 4 periods. In the first and best period humans are much taller, live much longer, there is no crime, no agriculture or mining has to be done because the earth yields the wealth automatically, etc. After a few centuries such stories of technology would sound like mythology that doesn’t literally exist or is seen as religion, such as Astra superweapons described in ancient Indian battles.",2
180,"Maybe someone like Tsukasa was around in that earlier awakening and higher knowledge was suppressed.     You'd think writing would have survived unless there was a major population decline like a famine or plague and the survivors didn't pass on their skills, focusing instead on practical skills.",2
181,How is Alaska not an island?,2
182,It's connected to Canada on the eastern land border. An island by definition is surrounded by water on all sides,2
183,Holy shit it's connected to Canada?!,1
184,Yes    ,1
185,Woah,1
186,I mean... what's even their explanation for all of the petrified humans laying around? Statues?,2
187,"""There once lived an ancient race of man who was REALLY into masonry.  I mean, look at that detail!  It's almost as if the statues were once real people.""",2
188,"So true. Obviously the story is just starting, but man do I hope they explain a lot of these things happening.",1
189,All your questions will still be answered in the anime I think.,1
190,"Everything gets explained, don't worry about it. Dr.Stone is one of the few manga that follows up with satisfying answers to most of its plot threads.",1
191,There is an explanation pretty much later in the manga.,1
192,Just wait for it : ,1
193,"That honestly seems realistic to me.  We don't know how old these people are, but let's assume we're dealing with at least two generations if not more.    Any normal person who got revived in the world of Doctor Stone would be lucky if they could make everything that we see in the village.  They'd barely be able to get subsistence farming going at best if they're a modern person.  So after that original person or people die, they take a lot of knowledge about how things were and at most leave stories about it.  Give it a few more generations and that would be forgotten, leaving a pretty primitive society.    The unrealistic stuff is Senku being a walking, actually useful Wikipedia and thus able to rebuild everything.",1
194,"They do know  something ...  ""The 100 tales XD."" ",1
195,"Senku said what I was thinking exactly when you meet Chrome. He perfectly embodies how humanity has continued to grow over all these years; with, as you say, a complete curious nature. It shows that even if Senku hadn't woken up or any other man of science really, that curiosity would have driven things forward no matter what",1
196,"Maybe a bit of a spoiler but to me Chrome ends up being as good a scientist if not better than Senku. Senku is clearly smarter but Chrome's curiosity and willingness to learn and innovate are what really drives the science world, not just brains.",1
197,"Problem Senku has, are the tools to create the Technology we have today. or would you build an Mobile with just an Stoneaxe or something right now from the Anime?",2
198,I completely agree.,1
199,"For me, Chrome embodies a RAM-eating piece of software! Hopefully Senku meets Firefox soon!",1
200,If I were in Chrome's position I'd be royally pissed too.,1
201,"All the first scientists were considered sorcerers and alchemists, so Chrome is a very fitting character for someone to be exploring all these things.",1
202,someone aced english,1
203,I think this episode just set in.... stone that I fucking love this series. Chrome is just great!  A primitive man who's made scientific progress on his own. It really brought back memories when I used to be very studious and curious about a lot of science in general.,1
204,"For anyone wondering why the robot had a straw hat, the when this chapter was being released in the manga, it was around the same time as One Piece's 20th anniversary so they had all of the ongoing series have someone wearing a straw hat in the chapter as a tribute.",1
205,"Oh man, even as a manga-reader I forgot about that lol.    It's pretty funny that they left that in, I wonder if the animators were confused.",1
206,"Weird decision from the animators to change the ribbon's color from red to white, probably made the reference go over most people's heads.",2
207,Which robot ?  Could you give me the time code of it appearing ?   Or just more infos ,2
208,It was at around 20:30 When Senku was explaining what civilization before Stone World was like,2
209,"Hurray, science buddy! In a lot of ways Chrome has given Senku exactly what he needed, which was a stockpile of potentially more difficult to find minerals and plants it seems. This should accelerate things quite a bit I'd imagine.",1
210,Considering that Senku is planning on making an antibiotic. Thats a pretty big step.,1
211,"It’s not a huge step, given that he has all of the materials he needs. My bet is he’s going to make a primitive form of penicillin.    I’m also taking a bet that Ruri has some kind of lung or throat infection, probably bronchitis or pneumonia, given the coughing",2
212,"Making penicillin is pretty easy. But making enough of it, and purifying it to actually be useful is no mean feat!     Here's the patent of the first process that worked.     You need a decently stocked chemical lab to produce useful quantities of the stuff. You could go the lowtech route and just use the acid step at room temperature, but you'd have to commandeer and rot a large part of the village's food supply to get enough of the damn antibiotic!",2
213,"     how?    it always boggles me how scientist able to find something new on unexpected place like that. like, what goes through their head that made them goes ""i think i'll check that rotten melon""    same like the new water bear species found on a moss patch in a parking lot",2
214,"They had some hints. First of all, the penicillin that makes your bread moldy only grows on surfaces. So it is really hard to produce it in large quantities as you'd need loads of surface area.    Ideally you want a mold that acts like yeast: Doesn't need a surface, just dump it in a big barrel with foodstuffs and let it do its thing. So they knew they had to look for molds that grew in fruits and other roundish things.    Secondly you want a mold that grows fast. If it grows too slow, all the foodstuffs gets eaten by other crap and there's nothing left for the mold.    So they set up a worldwide search where scientists would take soil samples, rotten food, garbage dump samples and so on, and see if anything grew at an appreciable rate. If it did, they'd send the sample to the lab, which checked if the mold actually produced a good quantity of penicillin. It was during WW2 so they were kinda desperate to find something ASAP to keep the soldiers from dying, so funding wasn't an issue.    Took 4 years, but eventually they found a suitable strain in that moldy Melon. Then they blasted it with X rays to force it to mutate into an even higher yield strain. And THEN they could finally mass produce the stuff.",1
215,     YEAH SCIENCE,1
216,Yeah that mind numbing hard work is a staple of science.,1
217,interesting...    thanks for the info :D,1
218,TIL,1
219,"I was about to look all this up, thanks for the info.",1
220,"Thanks for the lesson on Sorcery, Senku     ;     -Chrome",1
221,Also fun to mention that they injected it into clothing to keep it hidden from the Nazis.,1
222,Man it's cool and inspiring to see how much determination and work it takes for scientific breakthroughs.,1
223,"     And when I thought this story couldn't get even more awesome, suddenly the freakin'  mold  gets a superhero origin story.",1
224,Digging in garbage to find something that will cure them from all the disease from digging in garbage,2
225,"Louis Pasteur was looking for a way to cultivate bacteria and hadn't been successful until one day one of his lab assistants forgot a baked potato in the lab and the next day it had all this weird spots, they saw them in a microscope and realized each spot had one specific kind of bacteria in it.    This eventually led to petri dishes",2
226,Its always a mixture of Vague idea's and luck when it comes to scientific discoveries.     Very seldom are they found on purpose. The general idea is known but the thing discovered usually isn't,1
227,"Yeah, but that was what, in the 1930-40s? It’s not like Senku is going to be figuring this shit out for the first time. He grew up in an era that has streamlined processes. He’s not reinventing penicillin, he’s taking his knowledge of modern medicine, taking what he has on hand, and with a little bit of shounen protag luck, making science happen. It won’t be that difficult, relative to his previous goal of making guns while being chased across stone age Japan by a JoJo caricature",2
228,"Modern day streamlined processes generally focus on increasing the production yield. Which requires waaaaay more advanced crap. The Minimum Viable Strategy is what I mentioned in the second paragraph. Which is: rot half the foodstuffs of a minor village, separate out the penicillin with some kind of acid. And then hope that nothing toxic got into the resulting mixture that you feed to the patient.",2
229,Dr. stone tends to streamline or simplify things simply so they don't spend 80 years actually trying to do shit. Such as the cart Senku made in the beginning of the episode. Something like that would probably have needed to take a day or more to build  at least to a point where it doesn't fall apart on a bump  but senku was able to build it no problems in around give or take 20 minutes.    The process and method will probably be boiled down to a very basic level with the yield he gains being drastically increased for times sake.,2
230,"With the power of manga, all you need is:    1  The required components     2  Possibly some tools     3  The infinite implied time between two panels to finish any manual labor",2
231,That’s his power as a Shonen protag,1
232,"If you've read the manga  Jin  he makes a warehouse with idiotic amounts of mold cultures in an attempt to breed the right one. It's a slow process, but it could work here too.",1
233,"The process doesn't seem ""soo"" bad...    First you make the fermentation broth of penicillin, which isn't described in the patent, but presumably you put the mold into a vat, feed it, and let it grow.    Next, you chill the broth to just above 0 C. You don't want to freeze it, but penicillin decays above 0 C, so you want to keep it pretty close to freezing.    Next, you filter it of any solid material. Strain it, centrifuge it, whatever.    Next, you add some acid to bring the pH down to anywhere from 2.0, and 3.5, although some care in selecting the acid is needed, otherwise you destroy the penicillin.    Next, you use a solvent to separate the penicillin from other acids. If I'm understanding this correctly, this is basically like adding oil  except with something like amyl acetate  to a water-mixture containing the penicillin. The penicillin prefers to hang out in the ""oil"", while this won't be true of all the other impurities. As part of this step, you're supposed to add water so as to attract anything that loves water and get rid of that too.    Next, you concentrate the penicillin with a base dissolved in water. Basically, you've got weak acids and strong acids and penicillin, so this step has your base react with all your weak acids so they drop out of the solution.    Next, you separate the various strains of penicillin by adding a slightly stronger acid. The stronger acid kicks the penicillin out of solution, and it precipitates out.    By now, the only acids in the solution are either stronger than penicillin or they are the ones you intentionally added... so, you just add another solvent, this time something like Chloroform, that attracts your penicillin and all the stronger acids hopefully stick to the rest of your solution, and you can extract it.    Next, you can remove a few more impurities by adding charcoal etc.    Next, you precipitate out the penicillin by adding an alkaline base. I think this should retain any acids that liked chlorofoam or whatever for some reason, but were stronger than penicillin.    Finally, you evaporate away as much of the liquid as possible by exposing the solution to a vacuum at low temperature... remember, this whole thing needs to take place as close to 0 C as possible without freezing.    That's it, right?    tldr: Filter, use a number of solvents and acids to precipitate or separate out any acid that isn't penicillin, precipitate out the penicillin, and finally, dehydrate for use.",1
234,"Yea it is pretty doable if you've got the materials and equipment. A dedicated hobbyist could whip up a batch in their garage if they wanted.    But Senko has to do this not in the modern age where all the solvents, refrigeration and pumps are readily available. He'll have to repeat the process in the stone age. Which means all of the required materials need their own production chain set up from scratch. The acid is pretty easy, but the rest requires some serious fucking chemistry setups.    The chloroform needs to be made by mixing methane and chlorine at 500 degrees, cooling the batch to liquid and then distilling it. The cooling down requires them to either wait until winter so they have access to ice, or to build a refrigerator  good luck building a fridge out of sticks and stones... . And don't even get me started on  the Amyl Acetate , whose precursors have another pretty convoluted production chain that can't easily be replicated with stone age tech.",1
235,"Except you don't ""specifically"" need chloroform... or any of the other chemicals listed explicitly. Don't forget, this whole process is designed to distill high purity, high yield penicillin. That solved a very specific problem... we had a massive quantity need of high quality, low mass, penicillin. And a need to separate the various strains of penicillin so we could figure out which one was best and prioritize making that one.    I'm no biologist, but you could probably get away with filtering out the solids and ingesting the resulting low-yield mixture at a higher dosage. If you couldn't do that, my instinct would be to precipitate out the lower strength acids, clean out the precipitate, and then precipitate out the penicillin and call it a day.    ""High Purity"" is more of a transportation, packaging, and optimization thing. It's not like your body will die if you ingest a little bit of water. Or acid. Your stomach is filled with acid. It's all about the dosage, and you only need to get the dosage to safe levels before you're good to go. It's only when you're mass producing the stuff because millions of people desperately need the shit that maximizing yield becomes critical.",2
236,"Yea, hence why they are probably going with the low tech method I described in my post:      ",2
237,"I mean. You need to rot the same amount of food stuffs regardless, no? You don't make more penicillin appear by concentrating it. You just get rid of impurities... which means the penicillin was there to begin with, regardless of how pure you make it.    The real concern is how good of a strain of penicillin you start with. Really good bacteria = great. Really shitty bacteria = terrible. BUT, knowing this anime, excessive hard labor is apparently instantaneously accomplished.",2
238,The problem is getting a good enough strain. They could use the strain that grows on bread but it would make the project take years to grow enough food to ferment as that strain is incredibly low yield.,2
239,"Honestly, I wouldn't be surprised if that was just a common cold. People used to die a lot from that before medicine was invented",1
240,"I don’t think a cold would ever last as long as they’re implying. I’m thinking a lung airway infection because of that, the coughing, and the fact Senku jumped right to antibiotics, so it’s gotta be serious. Antibiotics can’t help a cold or the flu",2
241,Could be TB?,2
242,"It very well could, I know both pneumonia and TB can be slowed with heat treatments so that makes sense",2
243,"Common cold is not cured by antibiotics. If someone were to die from common cold, it would probably be due to an opportunistic pathogen like TB sneaking its way in.    But viruses are never affected by antibiotics. Because they utilize host cellular machinery, any antibiotics would be Pyrrhic victories at best.",2
244,"I know that. It would be quite a funny twist honestly, if the antibiotic wouldn’t work because it’s something as trivial as common cold is, at least for our standards.",1
245,"Yea I was just pushing back on people dying from common cold. Stuff like flu was deadly, but it’s deadly today. With the exception of some very specific anti-virals being introduced, The mortality rate from virus have been fairly constant except for attendant co-infection , but rhino and enterovirus just lack the punch to kill people.    EDIT: and obviously a big help for flu and diahrettic viruses are treatment of symptoms, but again this does not really come into play with common colds where symptoms are minor.",2
246,"That's the wrong spoiler syntax.      This is the correct way.   ""Spoiler goes here"" ",2
247,Oh trust me he takes much bigger steps,1
248,"I fucking lost it when he said antibiotic. That was such a game changer for humanity.     Sure it's easier when you know where to look, but it's not an easy process.",1
249,"He also gave him another curious person to share his thoughts with. With Kohaku, I imagine her to be a lot of good muscle to have around too.",1
250, jesus christ kohaku! they're minerals! ,1
251,Rocks? Yo Angelo,2
252, TFW Angelo got his own anime  while  Stone Ocean  has not been annnounced yet.        TOMODA ,2
253,Dr. Angelo.,2
254,Breaking   Bad   Petrification,0
255,S C I E N C E B I T CH,2
256,Best. Crossover. Ever.,1
257,I mean it even features blue crystals,2
258,Making meth in a stone world,2
259,I just got done rewatching yesterday so during that whole segment all I could hear was hank yelling that they minerals,2
260,Any geologist watching this almost had a mental breakdown there.,2
261,It's like explaining tech stuff or internet memes to a boomer        elves ,2
262,Glad I'm not the only one who thought of Uncle Hank,1
263,"Yay, she's not the smartest when it come to minerals, but at least we got another Boichi face animated . At least we got that.",1
264,"oddly enough, Kohaku  Amber  is the only one in this village not technically named after a mineral.",2
265,As a geology that truely offended me,0
266,We require more minerals.,2
267,"I've been describing this anime to my friends as ""Breaking Bad"" meets ""Minecraft"". I'm so glad we got this scene.",1
268,Rock hard... boner : ,2
269, I'm a master of this technique as well ,2
270,NIGERUNDAYO  ,2
271,SMOKEY!!!,2
272,JOJO,2
273,"In this alternate timeline, ultimate Kars turned everyone into pillarmen 3700 years ago.",2
274,"Senku be like: AWAKEN, MY PEOPLE!",2
275,did you just say the n word,2
276,Never heard of spelling or foriegn words?,2
277,never heard of a joke? weaboos have no social skills smh,2
278,I prefer comedic punchlines in my jokes.,2
279,Is it possible to learn this power?,2
280,"Not from me, I'll let someone else teach you",2
281,This guy fucks.,2
282,Actually... he lets others handle that too,2
283,This guy cucks.,2
284,Blessed comment chain.,2
285,Not from a Jedi,2
286,Didn't know he was secretly a Joestar.,2
287,They must've run away,2
288,It's actually Bruno who reincarnated as a pillar man.,2
289,It's really useful when you get down to it.,2
290,    justright         A perfect technique.,2
291,The Joester family technique lives on even after thousands of years have passed.,2
292,"or TEAM    in German:    Toll  Ein  Anderer  Macht's    aka Translatet:  In English:  Great  Someone  other  Do the Work!!!    Meaning, we working as a team where others  beside you  do all the work. meaning you slack off!    : ",2
293,I have perfected that technique since I was born,2
294," Of the 36 stratagems, fleeting is the best ! ",1
295,"Ok they absolutely nailed Chrome’s voice, I was really curious to know how he’s going to sound and his voice actor nailed it.",1
296,"Yeah, and it's the voice actors first big role which is why I was wary at first, but now, after this episode, I'm 10 billion percent sold on his voice.",1
297,Damn i love new VA's. They always bring something new to the table.    Don't get me wrong i like hearing two or three characters on every single anime being voiced by Genichiro Ashina but it gets tiring sometimes.,1
298,"Completely agree, I'm particularly enjoying Ai Fairouz performance this season as well.",1
299,¿?,2
300,"Actually I’m pretty sure he played Ceaser in Jojo part 2, who played a pretty big role in that part.    Correct me if I’m wrong",1
301,No? Chrome is played by  Gen Sato ,2
302,"Got it, Crunchyroll must have mixed it up in their article announcing the VA’s",1
303,"Nvm, it’s actually my bad the VA for Chrome doesn’t have a Wikipedia page so when I googled it it pulled up the wrong one",1
304,I think your mixing up  Gen Sato ,2
305, This   r 13or30,2
306,Its a stone world      13 might already being like 30,2
307,"It's not like people aged faster in the past, they just died earlier because of external factors.",2
308,Yes and no. External factors put more wear and tear on your body which will make it look and act older. Somebody who is in the sun all day at age 40 will have leather face skin and look 30 years older than someone who wore sunscreen all the time. Or someone who abused their joints with intense manual labor will have body pains and arthritis like a senior citizen the way someone else wouldn’t.,2
309,True and that was what I was trying to imply,2
310,I've waited so long for the anime to reach this point and I'm not disappointed. The first time I actually had to laugh a lot during the anime. Now I can finally look forward to my weekly dosage of laughing each Friday.,1
311,     10 Billion percent true Senku-san,1
312,"As a matter of fact, barely 1 day has bassed and they're already having  couple-like  when it matters.        ilovethiskindofshit ",1
313,Friends do that too you know,1
314,"What? No.    I found out that, on the internet, if two characters are close, share emotions, and provide sacrifice, it means they're going to be a couple, irrespective of sex. It just has to be. There's no place for platonic relationships on the internet.",1
315,So.....they fuckin’?,1
316, Oh they FUCKIN'! ,1
317,"Shhh, let people enjoy their ships",1
318,"Okay, now I'm understand why the manga is so popular.",1
319,Yeah shit only gets better from here on.,1
320,anime-only here. Hearing this makes me happy.,1
321,Also anime-only here. Every week these people keep saying the show is only going to get better and every damn week they're right.,1
322,"This is only the tip of the iceberg, believe me.",1
323,And it's like this all the time. The mad man Senku announces that he will create something that we take for granted and blows everyone's minds while also teaching people a lot of cool stuff.,1
