,Comment,Sentiment Rating
0, “Seeing Kohaku and Ginro after reading the latest chapter gives me the feels”,2
1,How dare you,2
2,What's wrong with the latest chapter?,0
3,You don’t want to know.,1
4,"I mean, unless I'm behind by 1, I've read it",2
5,:,2
6,But this is the source material corner,2
7,"I'm an idiot, sorry. Reapproved.",0
8,Np,1
9,"This is the second time this happened, this IS the source material corner lol",1
10,"The problem is actually that you messed up the tag so it just shows up as a broken link, try using these """" instead of “”",0
11,"Oh I guess it’s because I typed it on mobile, it’s fine, you can remove it, I’m too lazy to change it lol",1
12,"I guess you’re removing comments based on reports, people are trolling you mods",2
13,  Original comment by u-Quatsch- | Parent commentranimecommentsd3q43ydrstoneepisode11discussionf04dil6    ---     “Seeing Kohaku and Ginro after reading the latest chapter gives me the feels”    ---     This message was posted by a bot because originally submitted  outside of the Source Material Corner. ,1
14,"Finally, ACTUAL best boy enters the scene",1
15,"Old Kaseki, A man ready to craft some good shit",1
16,This man literally only exists just to craft some high quality shit. God I fucking love Kaseki so much.,1
17,And to pose.,2
18,Nice to see that the years haven't been too rough on Machio,1
19,Yea after Machio's body building stint in the IFBB he was the first human to flex out of his stone and live humbly as a craftsmen.,2
20, He did some other side gigs I heard...      slowgrin,2
21,How to guarantee you're the first one to escape global-scale petrification don't think that's a word:   eat clean tren hard  .,1
22,  4SCOOPS  ,2
23,Rich? Is that you?,1
24,"God, I miss Rich",1
25,"I don't miss that ""one day you may"" tat. Did he ever explain that tat? ""One day you may"" what, Rich? One day we may suck on your muscly tan teet? Well not anymore, since he's...you know...dead. BUT ""one day you may"" WHAT??",1
26,"That's legitimately disgusting. He's recommending 1200 calories of shake, 2-3 times a day. Either you are well exceeding 4000 calories a day or you are going to have the worst diarhea.",0
27,Just BULK OUT of the stone.,2
28,TEST YOURSELF,2
29,and to be one of the few that doesn't get confused by Senku and is actually interested in the new stuff,1
30,"With those slightly pointed ears, Kaseki is basically just a dwarf and I love it. Would Kohaku be the elf?",1
31,"A short, sturdy creature fond of industry. Went from Minecraft to Dwarf Fortress real quick. Can't wait until they make the magma cannon.",1
32,"To be fair, if they introduce him to that wine they made in the early episodes then they might just awaken something inside him.",1
33, ,2
34,Magma cannon? That's beginner shit. If you're a real dwarf you'd go for the fully automated mermaid farm.,0
35,Just send him to fight Magma. Why train KinraJinra?,0
36,"Hell, just send him to fight Tsukasa!",0
37,"Be like ""hey, Magma. There's this guy named Tsukasa who thinks that you look like a nerd.""",1
38,I meant sending Kaseki to fight Tsukasa.    We don't want Magma near Tsukasa as then Tsukasa would quickly learn Senku's alive.,0
39,Unless Tsukasa dies first! Which is why sending Magma is a great idea,1
40,Magma stands negative chance against Tsukasa.  Remember that Tsukasa dominated Kohaku who's already beaten Magma before.,0
41,Ten billion percent chance he loses.,0
42,"Also, you know, he beat several lions...",2
43,Oh right.,2
44,"Furthermore he would quickly become the village elder and thus enforce his bizarre ideology on them since he would eat Magma for breakfast if he fought them in the ""Grand Bout"".",0
45,"Like Sanji from One Piece, his hands aren't made to use weapons, but to craft.",0
46,"The one that wins marries her, he's like 60?",1
47, SAIDO CHESTO! ,2
48, SAIDO SHIELDO! ,2
49,ONEGAI MUSCLE!,2
50,MECCHA MOTETAI,2
51,MECCHA YASETAI!,2
52,Yamete Kudasai,2
53,master roshi has entered the chat,2
54,Look at that art! wow Boichi would be proud.,1
55,Gotta give the man respect.,1
56,Mah boi Kaseki gonna build a whole goddamn empire.,0
57,Best waifu,1
58,      ,2
59,HEAR HEAR!     i was waiting for him so bad. i love the science enthusiast crew coming together.,1
60,At long last,2
61,"He’s never seen what they were doing before, and could already figure out how they were f cking up.",2
62,And getting all sorts of pissed off at them for it.    A true craftsman,0
63,"Damn right, the old dude is the boss, ready to show everyone how things are done.",0
64,BEST FRIEND,1
65,I like Senku’s capacity to bait people. It’s even more amusing to watch given he loves it.,1
66,And then he makes a scary face about how much use he's gonna get out of the people he's baited.,0
67,"Ginro: Ha-ha! In your face Kinro, I'm getting a silver spear!      Senku: So you've already accepted your payment for this mission. It will be awarded to you or your remains after it's done.    Ginro: Come again?",1
68,"     Oof, but also accurate lmao.",1
69,Conditions might apply. The condition is that your remains must be recoverable.,2
70,"I wonder what the element they are looking for, Mercury maybe?",2
71,It should be something which has wide range of applications and without it we can't progress ahead.,0
72,"If there was a series from Tsukasa's eyes, Senku would easily be bad guy material",0
73, Tsukasa is a serial killer.,0
74,"What Tsukasa is doing isn't serial killing, it's genocide, literally.    And yet, if Senku refused to even hear me out on some modifications to the new old world, I'd side with him.",1
75,"True, they would also have to make Tsukasa look MUCH better.",1
76,"Hey if it works.    Goddamn do they get the grouchy craftsman's mindset down perfectly.   That was like watching myself watching my husband in the kitchen I'm normally the cook and I cook as a hobby.  ""No no, you're doing it wrong.   No, that goes there.  Don't use metal in my nonstick pans!  Dude, it'll go a lot faster and you'll get more even pieces if you...  you know what, move, I'll do it, just stir that pot please.""",0
77,"It's also good writing because his manipulation comes from understanding what being passionate about a craft is like. Just need to look at how moved and proud he looks when he sees Kaseki working; he has that ""Mama Bucciarati looking at his Children"" look",1
78,     And you didn't immediately stab him? You have the patience of a saint.,1
79,He's just completing all the loyalty missions.,1
80,Senku making glasses made me tear up. Suika being able to see is just so heartwarming. One of my favorite moments from the manga.,1
81,"As someone who is growing more and more dependant on glasses as the ages go by, that scene hit really hard. I couldn't imagine how hard would it be to live your entire life with shitty, blurry vision. We really take a lot of stuff for granted these days.    Things like this is why I love Dr. Stone. It's an insanely entertaining show that also makes you actually appreciate more things about life that you wouldn't even think about.",1
82,"     This is my favorite thing about the show. Senku keeps making things that none of the viewers would be amazed by but seeing the reactions of the villagers really puts things into perspective. I've had to wear glasses since I was a kid and every time I put them away whenever I go swimming, I realize how fucked I'd be if they were never invented. I'm pretty thankful I was born in this age.",0
83,"The commentary and reactions in this show are some of the best things about it, especially as it depicts things much more differently than we normally would     just like the monkey commentary from before ",1
84,Speak for yourself im as excited as Chrome to see whatever Senku comes up with.,1
85,Not just the science but the craftsman is also something to be respected,1
86,I loved how no one said a word after she put on     womanlytears,1
87,"It was really amazing in the manga already. It's a great example of panelling: you get all these small panels with close-ups before Suika puts the glasses on - then when she does, a close-up of a sunflower drawn in  incredible  detail, and that amazing two-page spread of the sunflower field in wide angle. It was a really powerful moment, and entirely delivered with visual storytelling. Boichi knows his shit.",1
88,High detail close-ups and landscapes are two of the things Boichi absolutely  kills  pretty much every time. It's wonderful seeing them in color with music.,1
89,"I had to look it up, that's gorgeous",1
90,The close up of the one flower is good too,1
91,what chapter is it? I want to see the general panel-work,1
92,28,2
93,It could be nice gag if instead of sumflowers she would see close up of far red house or red ballon,1
94,I hope that i'm not the only grown man that cried like a little bitch,0
95,I'd expect any properly grown-ass man to cry at that shit. That scene was  beautiful ,0
96,"Wow, did not expect to see that here. Why did you have to bring that back up ;.;",1
97,You should probably spoiler tag that.,2
98,"This comment has been removed.    -  This comment was removed due to untagged or improperly tagged spoilers.      Text and link posts should be properly spoiler-tagged and should include the names of the shows referenced in the title. Text posts may opt to tag spoilers in the Text post instead. Using the same format as comment spoilers below      Comments should use ` ""Spoiler content here""` to protect spoilers, where the spoiler source is where the spoiler comes from e.g. One Piece episode 200, or if it's from a different medium, LNMangaVN. Spoiler source is only required in the first of any set of spoilers for the same source.        It should be noted that unadapted material can still be considered a spoiler.        Obviously intentional or excessively repeated violations of this rule will result in a ban.        Images can be tagged with spoiler with a simple ""Spoiler Warning!"" before the link or in the link itself.      Reply to this message once you have tagged the appropriate parts to have your comment reapproved.       For more info about what is a spoiler, please check out our full rule page section..          ---  Have a question or think this removal was an error?   Message the mods.      Don't know the rules? Read them   hereranimewikirules  .",0
99,"Everyone gets into anime at different times. If someone started watching One Piece today that would spoil them hard. That's why we have no statute of limitations on spoilers; no matter how old the series is no spoilers past episode 1, that's the rule.    Also your spoiler tags are broken so I can't reapprove the original comment.",0
100,"Crunchyroll's youtube channel put out a video yesterday about the production of Dr. Stone. It's a full explanation of the animation process and the people involved. They also go into a bit of depth about the mindset of this particular scene when adapting it to animation. Sadly I watched it before the episode so the glasses thing was a bit of a spoiler, but I still ended up tearing up a bit during that scene. It was just so well handled.",1
101,It just made me think of the first time I got glasses. All I remember is I couldn't stop smiling for quite a while. It's sad to think how many people could never see properly.,0
102,"As a kid I remember having 2020 vision and not really realizing it was degrading over time. By the time I was 16 we realized I needed glasses.        It's funny, when they tested me for the glasses I was in this sterile room and I thought nothing of it because I was just looking at the letters and shapes to confirm what prescription was needed.  A couple of days later I'm given my first set of glasses and try them on. I remember a sudden and uncontrollable urge to cry just by suddenly being bombarded by the details of everything around me, and that was just in the store. I walked outside and saw the grass, the trees. I don't think I'll ever forget that moment, seeing individuals leaves just being moved gently by the wind. I still tear up remembering about it.    Seeing her tear up, reminded me of that moment, it really hit home.",0
103,"I feel ya. Went through the same thing, only I spent a year bot realising I needed glasses. At some point I just started to take the fuzzy illness for granted.     I still remember putting on glasses and being amazed seeing the leaves on trees.     As I said then, it was like watching all your life in 240p and suddenly switching to HD.",1
104,Nothing quite like seeing a tree for the first time after getting glasses.,0
105,"I got glasses when I was Suika's age and it was really just a marvel. I couldn't stop staring at everything and seeing all the incredible detail. From my fingerprints, to the veins in a leaf... even the individual hairs on my parents' heads.    Especially seeing my dog with clear vision. That hit home so hard, cause I had a puppy at that age too. She was my constant playmate.",1
106,"I remember, I was in an asian buffet restaurant with some friends. As a joke I put on one of my friend's glasses and realised that you could see the leaves on the trees outside. I spent literally the next 45 minutes during dinner just staring at the leaves outside baffled by the details.",1
107,Did you get your own pair of glasses after that?,2
108,Took a bit but ya. I've had mine since middle school now and I'm 100% dependant on them.,2
109,I literally thought as a child that people drew trees' leaves as a green cloud-blob because it was impossible to see individual leaves from afar. Now I have LASIK operated eyes and it's definitely easy to lose perspective that it's magic how thanks to science I never even have to worry about not distuinguish objects again in my life.,1
110,same,2
111,"Dr Stone made me realize I've taken glasses for granted. Hell, I've taken everything for granted. This episode really almost made me just go ahead and binge the manga but the anime is too much fun.",1
112,"I can see  10 centimetres in front of me before everything becomes a blurry mess significantly more blurry than what suika saw in the show to the point I can't make out anything except colors    I've had this since the day I was born but I only got my glasses when I turned 16 because I was afraid of being made fun of at school and it was absolute hell I can tell you, science is truly a blessing on this world.",1
113,"I can totally relate to that scene when she clearly saw the sunflower field for the first time. I couldn't stop smiling when I put contacts on for the first time and started seeing the world around me in HD.    As a side effect, women got uglier.",0
114,It made me tear up how well done the scene was. They perfectly showed how it feels to not be able to see and suddenly the clarity of the world around you. I didn’t have glasses until I was almost 18 because I had no idea I needed them and the moment I got them made me cry.,1
115,Same here man. I'm 23 and I've had glasses since I was 4. I can't function without these damn things my vision is so bad now -12 prescription with a side helping of astigmatism.,1
116,"It's arguable that if you grew up without tech you probably wouldn't need glasses. An increase in short sightedness has been a biproduct of a literate society. More reading, more shortsightedness.",1
117,"It was a really great moment.    To gift someone one of their senses, even if it is correcting it, makes a huge impact on one's life.    It's nice to see that that was the first thing Senku did with it.    It's also amazing how he realized why she was wearing that thing in the first place.",1
118,"Yea I kinda teared up at that scene cuz it reminded me of when I first got glasses in like 3rd grade, I was just so blown away seeing the world clearly for the first time and seeing Suika experience it too was so adorable",1
119,"     This was such great writing! It just seems like a shonen quirk at first, or at most like it's going to be an arc about her being shy. But no, it's because little holes help with vision, Senku deduces this and tells her she isn't ""sick"".     Then you think she's going to ditch the helmet, but Senku instead makes her one with glasses because he knows she likes it. Great stuff.",1
120,"As someone who gave people the chance to see better Optometrist, this warms my heart. I love when my patients are very happy when they see things better from a worse eyesight.     Glasses are the foundation of eyeglasses but we have moved to a plastic material a long time ago to reduce the risk for the eyes in case of breakage. Grinding the glass to the right curvature giving the prescription grade is already hard enough. I'll just assume that Suika, and hopefully Kinro, are just a case of simple nearsightedness and not astigmatism as that will complicate the making of the lenses.",1
121,I can only shudder at the thought of the scratches her lenses will receive when she starts rolling off to places,2
122,It's anime glasses she'll be fine,1
123,When I found out that was why I saw lights at night as 'blurry' I was shocked to learn it wasn't the normal way of seeing it.,0
124,"Tbh, I kinda prefer it, it's aesthetic.",2
125,I loved the stone age eye exam with shapes instead of letters.,1
126,"it's not stone age, eye exams often use shapes for kids that can't read yet. although, I'm not sure what's the stance on reading in Dr. Stone.",0
127,"I think you can guess already but  ""they can't read or write, there's no written language that was passed on from the past. In a much later chapter it becomes a plot point that Kohaku needs to communicate a message in writing and she uses scribbles and ideograms to convey her meaning.""",0
128,"I'm glad that they kept the melon head for her,    even though she's cute without it.",1
129,"I'm excited for Kinro to get some ""angry teacher"" glasses so he can push them up in an annoyed manner",0
130,Same as much as I love our community I'd hate to see what some people would draw,1
131,Pft it’s like you don’t even know them. A melon helmet can’t defend you.,1
132,"This comment has been removed.    -  This comment was removed because it contains spoilers or hints about the source material, a spin off or unadapted content.     Asking or attempting to discuss the source material is also not allowed. Please use our source corner, where you can discuss upcoming events or adaptation differences, keeping in mind you are still required to use spoiler tags.      For more info about what is a spoiler, please check out our full rule page section..        ---  Have a question or think this removal was an error?   Message the mods.      Don't know the rules? Read them   hereranimewikirules  .",0
133,Oh wow this is a spoiler? I am not sure but hey Sorrry my bad,0
134,Suika is just too damn cute!!!,1
135,"Spent a whole 4 episodes waiting for that reveal. Then, when that face went from Moe Heaven to Crabapple, a little part of me died inside. ",0
136,"I remember having a similar awe-struck feeling when I first got glasses back in middle school. I had just been so used to seeing blurry that it was normal for me.    Then I put on my first pair of glasses and I lit up like a kid in a candy store.    This scene reminded me of that and yeah, it got to me too.    I think anyone who, like me, was born or at least developed nearsightedness very early in life can just super relate to this scene. It's crazy how much just  seeing  things for basically the first time ever is such an emotional moment, and you realize that you've just had a whole ass part of you restored.",1
137,I cry once an episode at this point.,0
138,"I love that there was no dialogue there. There really aren't words for your first sight with glasses, especially if you've had bad eyes from birth. There are few experiences like it - in an instant,  everything  changes, but at the same time, you know that nothing changed but you. This is how the world has always been and you just never knew until that moment how much you were missing out on.",0
139,They really handled the scene perfectly!,1
140,"Oh, so that's why Suika was wearing that thing on her head? I wonder at what point will Senku become aware that Kinro also needs a pair of glasses.     It comes to no surprise that the highly skill crafter literally looks like a dwarf.",1
141,I'm suspicious that's how they'll win the grand bout.  Either that or Senku will build Chrome a flamethrower.,1
142,"Yes, Suika  ""the stone world`s first meganeko""!",1
143,"AWW    Glasses are such an achievement in science. Throughtout 8th grade my vision started going bad, and I ended up having to stand close to the board to see what was written on it, always squinting like Suika. Putting on my glasses for the first time was amazing because I hadn't been able to see clearly for months. That's what Suika felt when she put her glasses on. The world suddenly becomes clear and beautiful and you're actually able to appreciate the details.    So while Suika is nearsighted, Kinro's farsighted    These are the faces of failure    Little Kohaku!    Kaseki's freaking ripped!",1
144,Great screenshots.    Glasses are seriously amazing.    We use them for so many different things.,1
145,One of the main reasons I come to discussion threads sometimes are just to see stitches and gifs of some scenes,2
146,Have      mugistronk,2
147,     ripping his shirt purely through mussels flexing was bad ass as fuck,1
148,If you're not watching Dumbbells already you're going to enjoy Machio.,1
149,"     I don't think Kinro is farsighted. Any thing within arms reach is considered near distance. His problem is perceiving the incoming attack when he have the reach advantage of a spear. Another sign is him squinting making his eyes looking like mad. Squinting is a natural reaction for our eyes to see better. Remember the pinhole effect that Senku said, squinting can make your field of vision as small as possible thus seeing a bit better.",1
150,"Actually, I think all of that may be a sign of him being farsighted. Being farsighted means it takes a lot more effort to see close objects, so a fast incoming object might be hard to see clearly the eyes haven't had time to adjust. Squinting is then just a reaction to straining your eyes.",2
151,"     The first part of your statement is true but a fast  incoming  object is still from a far distance. In Kinro's case he is having the hard time determining the proper distance from the incoming attack. Depth perception is also the problem here. Depth perception is the visual ability that enables you to make spatial judgments, including how far away an object or person is from you.         It is the opposite. As I said it makes your vision a bit better and the straining your eyes is the secondary effect so you really don't want to do that all the time when you have nearsightedness just to see clearly. Let the lenses do clarification for you.",1
152,"I'm actually farsighted myself not very much either, and I can tell you it made it quite a bit harder to gauge distance when playing badminton for example. Having to adjust your eyes to track the incoming object is very tiring.    Anyway, Ginro mentioned that Kinro, like Suika, has ""blurry-eyes disease"", so it's clearly not just a problem with depth perception. It's probably far-sightedness, near-sightedness but I guess not as bad as Suika, or maybe strabismus though I don't know much about that.",1
153,"     No, Yes not as bad as or near as Suika's, and Strabismus is commonly known as cross-eyed or one or both the eyes are misalignednot centered so definitely not that.    EDIT:          I would like to emphasize on this. Having blurry eye as a disease is a very common misconception and I'm glad Senku clarified it too. Refractive Error is not a disease and not a defect. The closest term I can personally give is it is a  structural error  that the eye can't manage to focus the light exactly on to the retina",1
154,So then what's the solution to that?,1
155,I'd assume glasses as well? If he's shortsighted that is.    IIRC It's a lot more complex to make farsighted glasses,1
156,He needs glasses like Suika. But he doesn't know about them and he's too proud to speak up about the issue.  Hopefully he finds out about them from Suika.,1
157,"I might have worded that poorly. He has nearsightedness and still the same solution, glasses.     The kind of glasslenses will be different in correcting nearsighted and farsightedness though. To correct a nearsightedness you will a need a concave lenses while on the other hand you will need a convex lenses to correct farsightedness.",1
158,Glasses with reversed curvature if he's farsighted. Low key isn't this farisghted stuff a spoiler though I'm anime only,0
159,"I think people are assuming, and I think they're assuming wrongly.     Idk I'm anime only",0
160,It'd really freaking suck if he needed eye surgery or something. I don't think Senku can take THAT risk.,0
161,"I got really emotional watching that scene. I didn't get my glasses until I was about 16 years old. I always had to sit near the front and it sucked when teachers wanted assigned seats because I just couldn't take notes. Finally, I went to an eye doctor and got some glasses and walking outside and seeing that the world actually had detail and you could make out what was 10 feet ahead of you was amazing. Trees had shapes. Clouds weren't just blobs in the sky. Signs were actually readable.     This one sequence has really made me appreciate both this series and the fact that someone discovered how to fix vision way back when.",1
162,"I've heard teachers tell stories about the kid who they thought came up and stood close to the board because they wanted attention, but then they got glasses and stopped.",0
163,"It's kinda weird, since we've always taken glasses for granted, but only now we can see how it is for people who discover it for the first time",1
