,Comment,Sentiment Rating
349,"     Probably someone tasted the salt of a dried river.     Salt was so valuable people used it as currency in the past.     Salary comes from salt, and makes sense: In a world where all your meals were bland, working in exchange of a magical powder that made them more flavorful would be a great deal.     People even traded gold for salt. ",2
350,"Plus you could dry meat with it, and make brines and broths.    Hell if my ass had to walk everywhere or ride an animal to get to all of my destinations, I'd want some fucking jerky with me for a snack so you best bet I'm trade gold for salt.",2
351,If I was used to starving nearly to death every winter I'd sure as hell want a fuck ton of jerky.,1
352,That's probably more useful than the flavor. Salt was very important for preserving food back then in addition to being a nutrient we need to live.,1
353,"Capsaicin was also used for preservation though, hence why people can enjoy spicy food, and it being more common in warmer climates where preservation is more important.",1
354,"Salt's just a lot more universal than spices though, especially in Europe where peppers aren't native. I don't recall japan having native peppers either.",2
355,"In a landlocked country like mine when a neighbour country starts trade, you will notice the effect of salt shortage. People were hoarding salt like crazy and it even went for upto 1dollar per kg.",2
356,"       ""He traded salt for skins, skins for gold, gold for life. In the end, he traded life for salt.""",2
357,  Squandered Resources  ,2
358,     Squandered Resources          cardname      or      cardname|SET      to    call    -    Summoned    remotely!,2
359,     a magical powder with the side benefit of keeping you alive.,2
360,"Probably touched a source of salt ocean or salt rock  and ate with their hands, which ends up unsuspectingly seasoning the meal.",2
361,"""Ah geez, I dropped my chicken on the ground.""  washes it off in the sea ",2
362,Wasn't artificial sweetener discovered like that?,2
363,"     Probably saw a deer or other wild animal do it first. Given how critical salt is for basic bodily processes  this is why salt tastes good to just about every mammal - we need at least a bit of it to survive , there's no way we outgrew that animal habit when we finally evolved consciousness. At some point, we just started asking ""hmm, what else could we do with this stuff?"" and ""how do we get more faster?""    Once we figured out we could preserve food with salt to get a supply of meat through the winter when hunting  and later farming  was more difficult, salt got even more valuable.",1
364,"I remember that when I was a kid, the first time I ate pork, it was an unsalted one, I didn't actually know that that was the case, but after that, I avoided eating it pork for years. Salt is God.",1
365,"Probably saw animals licking some rocks and wondered what was so good about that. From there it's not a far jump to breaking the rocks down to powder and putting said powder on their food. A lot of the food we eat was discovered by accident cheese, alcohol, vinnegar  or by watching animals.",2
366,"     Someone probably dropped some food on a salt rock, 5 second ruled, then found out it tasted pretty good.",1
367,I'm more curious how man discovered cooking with fire.  Tasted some game that was killed by lightning or died in a forest fire?,2
368,I'm sure you're familiar with the fine smell when you throw a piece of meat in a hot pan.  Accidents happen all the times and when a piece of meat fell into the fire it smelled delicious. The same reason how coffee was discovered  At least how the myth says it . Humans are curious creatures by default and if you have something valuable as meat you even eat it if it was burned,2
369,"they probably saw goats or some other animal licking the salt. similar to how people found out which berries, fruits etc. were okay to eat",2
370,     You'd be dead.  Fish are not nutritionally complete.,2
371,Isn't that why sailors died of scurvy,2
372,"Well kinda, not from eating fish but from a lack of vitamin C that would usually come from fresh fruit, most sailors diets consisted of dried bread, aka hardtack, where the idea is if you sap every last tiny bit of moisture out of the bread then it can last years.",2
373,"Nah, if they did actually eat fish they'd be fine. Fish are pretty nutritionally complete all things considered, sure you'll be deficient in one thing or another but that's life, no-one back then had all their nutritional needs met.    Vitamin C is actually the biggest problem if you have fish only based diet, but if you're eating like that the amount of vitamin C you need actually lowers and there are small enough amounts of Vitamin C, you'd just have to eat everything. There's a reason the eskimos are totally fine  or were, until very recently when they started eating our food.. and their heart-related issues skyrocketed ",2
374,I literally just finished watching Shokugeki no Soma two days ago so when they started talking about the umami in the fish I felt like a veteran cook who already knows all this.,1
375,But they had plenty of fruit and veggies too...,2
376,"Wild fruit and vegetables don't taste as great as our modern bred ones though. But yeah, they wont be eating  just  fish.",2
377,They were probably the wild versions of our modern domesticated ones. Like legit if your ever look up what wild corn and bananas for example looks like you'll be baffled by the difference. Like wild corn itself is maybe 1 8 the size of the domesticated ones and can be kind of gross hard to eat. Goes to show how human artificial selection has played a part.,2
378,"He has a lot to learn, cause no clothes were blown off, no orgasms were given.",2
379,"   Dr.Stone went full Shokugeki no Soma.      I don't know, there's clearly not enough tentacles and spontaneous clothes being ripped off.",1
380,"They have fruits and vegetables which bring variety and texture to the table, although certainly not the flavor-laden variety we have today. And they live in a fishing village. The ocean is salty and you can extract some salt simply by boiling it over a fire. Hell, even monkeys have been  using saltwater as a seasoning , so it's not inconceivable that someone in that village decided saltwater tastes good.        Yes it's still an incredibly boring and bland palate, but they're not eating  literally fish and nothing else .",2
381,Are they at the ocean though?    Did they ever mention it was salt water and not a freshwater lake river?,2
382,"It's possible, but it's Japan, so it's not like salt isn't within a moderate walking distance. And given salt's high desireability for its flavor and as a preservative in other civilizations  to the point of wars over control of salt lakes , it's not impossible to see that they would want to regularly make trips to boil saltwater and bring it back. Especially Kohaku, who's already making daily trips carrying 10 gallons of hot water anyway.",2
383,"This show is so much fun. Seeing Senku flex with his knowledge of the world and blowing people's minds just doesn't get old and I can't wait to see how the rest of the villagers are gonna react.    Also, Melon-chan is fucking adorable.        squee ",1
384, I'm 10 billion percent Senku does qualify as a genius .,1
385,"In Japan, the word that is translated to ""genius"" basically means ""super talented from birth"".  Think back to Naruto - you have all those people with genetic powers, and then you have Rock Lee who only got the ""genius at hard work"" platitude from his sensei.  So unless Senku was pretty much born with a tremendous IQ, he's not a ""genius"" as Japanese would see it.",2
386,What you are referring to is call a prodigy. Even then i would still consider senku as a prodigy.,1
387,"Eh, not necessarily, just a fuckin neeeerd.    This is all stuff that we could have learned and memorised by that age if we had studied instead of playing videogames lol.",1
388,"He most definitely is, and no you most definitely wouldn't have known all that, he knows everything and I DOUBT he studied science history and science needed for survival. He's a prodigy student and was interested in aerospace, hence a branch of science which is completely useless here he was also probably interested in computer sciences and physics and all that as they're quite related. Yet without any preparation he remembers the exact ingredients and their proportions to create all the things he needs... Which on the other hand, he'd never need to make or care about back in the day. Which means he has photographic memory or close to it. He's probably something of a  John Neumann ",2
389,"Genius, untranslated has the same meaning in my language as well = talented from birth. Odd, I thought since it's the same word in English it'd bare the same meaning...",2
390,"Genius doesn't always mean IQ, though. Even more so if we go by your translation. You can have geniuses in pretty much everything from athletics to art to science. And he's at the very least a genius of memory.",2
391,Only if he was born with genius level memory instead of training it through hard work.,2
392,"I would expect Senku, of all people, to know born talent is a quite small factor in what people usually call genius. But it does make sense given the Japanese interpretation.",2
393,"Sure, but surely he meant he has to work hard towards the goal instead of it going right almost instantly every time.",2
394,"In that context, he was just pointing out that he's not smart enough to change the luck needed for the biological route. However, I find the fact that he doesn't consider himself a genius quite endearing.",2
395,"It worth noting that Senku  never  created something new, all the stuff he made so far were things he already knew, and probably so is everything he's gonna make for a long time.    He knows a lot of things, and is very knowledgeable, smart, but to himself, he's only applying what he learned. He never created something new like the true geniuses he knows.",2
396,"Yes, but it's also worth noting that he's the incarnation of the omnidisciplinary scientist trope at highschool age.",2
397,"That's the thing: he only remembers all those stuff. He knows how to make the stuff, but didn't discover it on his own, He learned it from a teacher or a book. He merely walking a road laid down before him by countless great minds, each paying a great toll to lay down one cobblestone.",2
398,"You're taking scientists a little too lightly. Just think of the time it would take for one human to reach that level of knowledge, and think of the effort necessary to reach it in highschool. It's harder to discover new things when you have to catch up with at least thousands of years of scientific advance first.    Building the road is hard indeed, but so is walking down the entire road when it has become hundreds of kilometers long.",2
399,I was talking about what Senku probably thinks of himself. I know as everyone here how much of genius Senku is.,1
400,"     Not much, we literally teach this stuff in highschool classes.     Senku hasn't even made a battery yet, and I made them in highschool chemistry. They were so easy to make with the right materials that we stayed back after class to fuck around and electroplate random objects. But senku has a magnet now, so as soon as he can forge metal, he'll be able to induce current with that.    If we can teach it to bratty ass kids, then senku who is  super  passionate could easily surpass them.",2
401,"Oh, you teach the process of making antibiotics and all processes needed to obtain the auxiliary materials and tools with stone age tools in highschool? Tell me more about.    Instead of boasting about your battery  which he hasn't made because at the moment it's useless  you should pay attention to what the dude makes, in how much time and with which technology level.",0
402,"     The fact that you think I was boasting says more about you than me.    It wasn't just me that made a battery, literally everyone in the class did, it was a standard and easy activity.     This is my point. You can teach this shit to any teenager, you don't need to be a genius.    Senku doesn't need to be super smart to know this stuff, he is just super passionate and put in the hard work to study this stuff. Whereas most teenagers just play videogames and shit  I did too .",0
403,"The fact that you specifically mentioned that you did a battery even if everyone does that is boasting, kid.        And when you'll grow up a little, you'll realise that intelligence is a combination of memory and the ability to piece things together. In other words, that hard work anyone can do. The more knowledge you memorise and understand, the easier it is to piece together any new thing you try to learn.     I'm sure you're still hung up on the fairytales from highschool, like Newton's who discovered gravity after getting hit by an apple, but those are just fairytales.",0
404,"     How?    Simply stating that I did something classifies as boasting? In what way?    The whole point of what I was saying was to try and point out that I'm   NOT   special for doing that. Trying to boast that what I did was impressive would completely defeat the point I was trying to make.    Again, this says a lot more about you than me that you think I was boasting for simply stating something that I did in highschool as an example.         I see, so your ego has been hurt and you're trying to recover by acting unreasonably dominant based on our completely unestablished ages.         It's funny that you think this is something you realize ""as you get older"" as if it is somehow linked to life experience? The semantics of the word ""intelligence"" are in no way linked to your age.     Common usage varies, but I prefer the use of ""intelligence"" to mean ""fluid intelligence"" as opposed to ""crystal intelligence""         Oh you're 'sure' are you? Despite absolutely no evidence to support such an assertion? Seems like just another way to heal a damaged ego.    I like how I never  directly  attacked your ego, but your ego seems damaged, and now you feel the need to recover by inventing unfounded narratives.    What does this say about you I wonder.",0
405,"I'll leave the psychoanalysis up to you, kid. Stating you did something everyone did is meaningless. After all, why would you give someone a piece of information they already have? Unless you actually think that not everyone has that information and revealing it gives your arguments more authority, a.k.a. boasting. If you were older, you'd talk about things you've done in undergrad, since they're usually much more impressive than anything in highschool, and not everyone majors in the same thing, so it wouldn't have been boasting. But I don't mind you blaming it on my ego. The fact that you had no counter-arguments to offer and tried to steer the discussion towards other stuff is a signal that this discussion is over.    And the way people perceive intelligence is different from person to person. The dictionary definition is too vague, and people have argued over a more concrete definition for centuries.",0
406,"     No it's not. I was stating that it is normal, and not a genius thing to know.         To make sure it is established so I can then build my point off of it and have it make sense.         That's not what boasting is my dude. To try and state that boasting is simply any time you give someone information is a pretty big stretch.         I gave up on going to university for maths or physics as I had planned because I fucking hated the school system and how it constantly held me back.     Since highschool I've gone into the arts and so far stayed since I enjoy it, I can teach myself and I can get a job without the need for an expensive piece of paper.    I'm also way smarter than I was in highschool since I've put a massive emphasis on patching up some of the major character flaws I had back then. Not showing up to class and never studying might work for acing the top classes in highschool, but it's not a great way to reach my full potential.    I have a friend who got a massive scholarship to study mathematics and he's bugged me some to go study with him again like highschool days.     Is that enough boasting for you? Since you seem so keen on trying to assert your dominance here as well as call me a boaster, I thought I'd actually give it a shot lmao.         What are you talking about? You're the one who started trying to call me out for boasting instead of discussing the point, and now you're once again trying to reframe this to blame me and save your ego. I presented my points, you keep repeating the same inane bullshit.    You think you're witty, and ""catching me out"" but I'm legitimately enjoying this. Because I don't have an ego so easy to break.         Oh really? Because I seem to remember  you  being the one to state that ""when I grow up a little"" I'd understand the  true  definition of intelligence. Whilst I was the one stating the common definition varies and then presenting my personal preference.    Funny how that works, huh?    This reframing you're doing is so transparent that I'm not even sure  you're  conscious of it.",0
407,"Stating a piece of information that's common knowledge is boasting, not stating any piece of information.    If you enjoy what you're doing then I'm genuinely glad for you. Staying in the school system is not compulsory to reach your true potential, that's true. And since you were kind enough to share that, then I'll tell you where I stand: I was the guy who always went to classes and studied until he made sure he understood what he was doing, which made me valedictorian in both highschool and engineering undergrad. And now I'm in postgrad in a university that's in the world's top 20, while working for the best company in Europe in my field. There, some boasting on my side too. I suppose that does explain why we don't see eye to eye, though.    I do apologise for calling you kid, though, that was indeed a mistake on my part. I'm also enjoying this. The people who know me and what I do appreciate my skills, so I'm not hurting over some anonymous person saying things.    Regarding the intelligence part, let me quote what you said: "" It's funny that you think this is something you realize ""as you get older"" as if it is somehow linked to life experience? The semantics of the word ""intelligence"" are in no way linked to your age. "" - I must apologise if I misunderstood, as english isn't my first language, but it seems to me like you state here that the definition of intelligence is fixed, rather than varying as you now claim.    And concerning the deflecting part, I did state that Senku's way beyond the things you mentioned about highschool, and that recreating modern things like antibiotics using stone-age tools along with his encyclopedic knowledge makes him pretty much a genius, which you tried to write off by claiming that those things don't make him smart because anyone can learn them, which I found to be a dubious claim. Afterwards, I got condescending and you got all psychoanalytical, while still not stating what you think makes someone smart and using vague terms like fluid or crystal intelligence.    So, if we're finished with the personal jabs, I think it would be your turn to say what do you think makes a person a genius and why Senku doesn't qualify.",1
408,"     You're really just going to keep repeating yourself instead of engaging with my increasingly detailed counterpoints huh. I guess you're clinging onto this piece of bullshit forever.         Oh lol, idk how experienced you are, but I've been using some very precisely crafted phrasing here.         Part of what makes him able to do it though is just plot armour. The characters seem to always magically be able to find the required resources in their immediate vicinity and only get ""bad luck"" when it's plot relevant.    And penicillin is at least kind of the starting point where I think he will be going in to genius territory as he will undoubtedly be doing even more impressive things into the future.    But for now I still believe he could be a studious teenager who happened to study the right things.          It was more that any highschooler can learn these things, therefore someone as studious as him could learn them  as well as  memorise them and learn some information about how to acquire the ingredients.    These days you can find youtube videos on ""how to make sulfuric acid out of these weird ingredients"" or ""today we refine bog iron""    If after a couple more episodes he was like ""shit, penicillin and gunpowder are the best things I could think of, I don't remember anything else, whoops"" then he'd be a more normal kid. But he'll eventually show himself to be undoubtedly a genius.         The fun part          Wikipedia page     Tbh I haven't read heavily into the terminology, but my simplification of it is basically:    Fluid intelligence: logical reasoning, lateral thinking, creativity, etc.    Crystal intelligence: the raw information you can hold.    Or crystal = knowledge, fluid = how fast you can gain new knowledge.    I generally see intelligence as not being what you know, but how well you can process, organise and synthesise information.    So someone can be a genius, but super lazy and thus not know anything, while a non-genius could have a lot of knowledge that they had to work super hard for.    As far as I'm aware in neuroscience, fluid intelligence is something that can be linked to genetics and deteriorates basically from the age of 20.     But I personally feel that fluid intelligence can be increased by studying the functionality of your brain by doing black box experiments on yourself, recognising inefficiencies and retraining your subconscious processes to work more efficiently.     Which is what I've basically dedicated my life to lol.    I'm likely to have a genetic advantage in the department of fluid intelligence. But I also credit a lot of my intelligence to my focus on learning how to learn, and I think anyone could be taught this from a young age and gain a distinct advantage if schools weren't terrible and underfunded.",0
409,"Let me rephrase that first thing: I believe that a piece of information labeled as common sense information is labeled as such because people start off with the assumption that other people know it. Otherwise, I don't see how it's different from any other piece of information. Thus stating it is superfluous. I understand that you see things otherwise, and I just wanted to make my stance clear, not to argue anymore on this topic, as we've reached a point where it's just a matter of subjective preference.    I think the anime skips quite a lot of the resource-searching parts. There was a significant effort involved in that iron-sand gathering, even if it seemed quite short. Same with the nitric acid gathered for revivals. And for the time being, they didn't look for many materials that would be hard to find in the wild  don't forget that to get the sulfur needed for gunpowder they traveled to the nearest volcano .    Ok, I understand your definition of intelligence, even if I don't agree with it. As far as I can see, a lazy genius would be hard to distinguish from a hardworking normal person, which kind of contradicts the way that label is generally applied. Besides, my reasoning is that the more information you know and understand, the easier it is to process, organise and synthesise new information, so fluid and crystal intelligence can't be effectively separated. I do agree that you can train intelligence.     ;               This part I don't agree at all with. First, penicillin making with stone-age tools isn't in the compulsory high-school curriculum. Second, I actually wonder if you can find such a process anywhere, given the late discovery of penicillin. If not, then Senku probably developed that roadmap himself, piecing together everything needed with the constraints of the environment and technology level. While there are many videos and books that can teach you how to DIY complex stuff, they're usually starting with stuff you have around the house or can readily buy in the 20th 21st century. To summarise, I think Senku's encyclopedic knowledge combined with the ability to effectively use that information given the tech level he's at is enough to make him a genius.",2
410,"He's not really though. None of the knowledge he has shown so far is super advanced, with penicillin being the most impressive so far.    A lot of this knowledge isn't hard to learn at all, it's just that whether or not you remember it makes a BIG difference in that primitive world.    Like making black powder, you could literally google it right now and be like ""ah, I get it"". It's just a matter of committing it to memory before google stops existing.    I was learning stuff like this in my highschool chemistry and physics classes. You don't need to be a genius, just super passionate like senku, spending all your time studying these scientific fields and you could have been the same.",2
411,"Mate, this isn't a boasting thread. The dude built his first working rocket in middle school. Your highschool classes do cover stoichiometry and chemical reactions, as well as basic physics, but not the processes of refining compounds from natural materials without any modern tools or the many engineering considerations to make when applying the laws of physics in the real world.",1
