,Comment,Sentiment Rating
1040,"I don't know about you, but when that person is 1/3 of all living humans and is able to pull their weight it may be worthwhile until the situation is more stable.",1
1041,We clearly haven't watched the same episode. Dude is raising all the red flags.,1
1042,The guy just tries to commit a genocide based on age. If thats not antagonist-y then idk what is,2
1043,Sure...,2
1044,"Tarzan is crazily OP and I'm a bit worried since he was portrayed as a bad guy in the OP. He has already developed different ideas from our protags. Being against him is pretty scary, considering he could probably easily kill both of them. Luckily they really need anybody they can find now but later on in the story he might become a problem. I like how this is developing! The 10 billion % was a bit annoying at first but after getting used to it it's totally fine. Yuzuriha rescue scene was kinda funny.",1
1045,AWAKEN MY MASTERS!,2
1046,"What is the fourth use of calcium carbonate?    I mean in the way is was put with Senku ""corecting"" himself in front of Tsukasa, i think it could be used to something that can kill a person",2
1047,Gunpowder,2
1048,  AWAKEN MY MASTERS,2
1049,I like how Tsukasa’s entire character motivation can be summarized as “Shut the fuck up boomer”,2
1050,Thank goodness the high-school kid that can punch lions to death isn't dangerous to us.,1
1051,Kars the ultimate lifeform is released from his stone inprisonment !!!!,2
1052,"As someone who has been reading this since it was first being published, it's extremely exciting seeing them start at zero all over again. It's exhilarating and what kept me reading.",1
1053,Young Kars vs Senku Joestar. This is great.,2
1054,"Tsukasa said ""workers' rights""!",2
1055,Workers of the stone world unite! You have nothing to lose but your stone cladding!,2
1056,"Anime watcher only I though this show was pretty dope last week, with the whole “science the shit outta the apocalypse” vibe going on, and while I realize this show is only based in reality and not entirely realistic, I feel like this week got reaaally bologna-bullshit. Dude wakes up and  punches a lion to death in one shot?  Anime or not, that felt super left field to me.    So when’s the next episode? :",1
1057,"  Dude wakes up and punches a lion to death in one shot?     A very very slight spoiler, but Tsukasa used to be a professional boxer, the best one in the below 18 category actually. With a bit of animu exaggaration, it's not really surprising he knows how to 1hitKO a lion.",1
1058,"One thing that really bothers me about this show is the whole lack of psychological effect of being stuck in a rock for 2000 odd years.  Then all of the sudden wake up and is able to move again.    Like this last episode the dude wakes up and is like ""hey whats the situation, yah totally ill punch some lions....""    I think it would be great if they added at least some sort of side effect.  The whole 2000 years passing doesn't carry any weight when the symptoms can't be seen.",0
1059,"It's 3700 years, and already established that stoner are like uncicous",2
1060,Then how did Senku count the entire time to know the years.   I thought they said the were concious,2
1061,"In the first episode, direct flashback to him counting and and nearly losing consciousness.  He even made comment of how often he felt that coming on.  So I think it's assumed that, for most people, they don't manage to fight that off.",2
1062,It will be an inconsistency if they do so according to the explanation Senku made on the 'stone',0
1063,"So, this is Cringily-Overhyped Highschool-Level Chemistry: The Anime?",0
1064,"Feels like we're back at a rare case where the ED is better than the OP! The OP is pretty good, but that catchy groove from the ED has a great rhythm to it and imo outclasses it pretty easily. Gotta update my playlist!",1
1065,Looks like they saved their own Dio. I assumed their enemy would be another genius.,2
1066,He really does remind me of Dio,2
1067,"Going to be honest, I don't really like the characters so far. Taiju's yelling is just too much for me. Senku seems kind of like a jerk, albeit not a total one. I don't like the way he constantly puts Taiju down.     Yuzuriha seemed like a plausibly decent character, but I have a feeling she's just going to stay as stone for a good long while.    Tsukasa is an anarchist revolutionary haha. He's okay, but  probably  an antagonist given the whole murder thing. . .     I'll give it another episode for sure because it looks good, but I'm leaning towards it just not being for me.",0
1068,"Oh, boy just what I was predicting about anime watchers...    Ironically, the characters are a huge asset of the series... But it will start shaping up after several episodes, can't say more because spoilers.",1
1069,"Stay for the political conflict, that ought to be interesting.      Also people who are annoyed by Taiju’s yelling, unite!",1
1070, Yuzuriha seemed like a plausibly decent character    From all of her 40 seconds of screen time?,1
1071,"I can't aptly explain why you  should  stick with this show without general spoilers of how the plot will progress, but I strongly suggest giving a few more episodes a chance. As the opening theme shows, more characters do come into the spotlight, and they receive a lot of attention. Taiju improves significantly, too.",1
1072,Fair enough! Taiju having some mercy on my ears would probably be enough for me to stick around haha.,1
1073,"  I'll give it another episode for sure because it looks good, but I'm leaning towards it just not being for me.    Hah, just posted the same thing in another comment.    I think this show could've been 10/10 if they had just changed a few things;    1 Made it more serious/realistic despite the premise, no more superhero shit    2 Less meme catchphrases; 10 billion percent wasn't funny to me the first time, and even less the 10th time.    3 Less forced situations They have spears, presumably made for an animal attack.. But when animal attacks, they revive some guy instead of using spears? How did Senku even survive for months by himself?    I don't like the way they force these things to showcase the characters as badass. You want to revive Tsukasa fine, but have him fight the lions with the spears.     You're still a badass if you kill a lion with a spear... but you're also not an overpowered superhero, which is a GOOD thing if you're going for a serious setting.    If they're going to the ""everyone is super OP"" setting instead, I think I'm gonna pass.",0
1074,"  1 Made it more serious/realistic despite the premise, no more superhero shit    I hadn't really noticed this, partly because I don't watch superhero stuff since I don't like it. But I think I see where you are coming from.      2 Less meme catchphrases; 10 billion percent wasn't funny to me the first time, and even less the 10th time.    I hadn't noticed it, just sounded like awkward dialogue lol      3 Less forced situations They have spears, presumably made for an animal attack.. But when animal attacks, they revive some guy instead of using spears? How did Senku even survive for months by himself?    Yeah, I'm with you on this one. A high schooler defeating a lion pack with his bare hands is ridiculous and kind of cringey. Just have him wield a spear and it starts making at least a tiny bit of sense. Also, I don't think lions hunt during the day if I remember correctly.",0
1075,"This comment has been removed.      Please keep all source-related comments, such as discussion of future events, comparisons with the source material, or talk about the source material in general, in the Source Material Corner.    ---  Have a question or think this removal was an error? Message the mods.     Don't know the rules? Read them here/r/anime/wiki/rules.",0
1076,it's like naruto but better,1
1077," Tarzan is revived, he runs faster than giant wild boars and can one shot lions lol this is a series that requires a larger than a normal suspension of disbelief, even for a shounen sci-fi - still will give the show time to answer a lot of glaring questions but I do feel most won't. But still, it is fun, goofy, and the ideas it is presenting are intriguing.",2
1078,BUCCARATI!!!,2
1079,"According to some quick Google searches, some studies say humans could run up to 40 MPH while boars run at 30. One-shotting a lion technically is possible as well as it doesn't take much to collapse a windpipe. As for the boulder, yeah...not likely.    But at the end of the day, this is a cartoon for entertainment. Part of the advantages of cartoons are that you are able to side-step reality pretty much as much as your mind can make up. So take it easy and enjoy this Japanese cartoon.",1
1080,"LMAO WUT? Are you serious dude? Did you even read the study? Its just a theory dude and it really puts an emphasis on ""could"". Are we all Usain Bolt now? Don't get me started on the Lion stuff lol Its hilarious to me everytime I see responses like this. ""It's just a cartoon and entertainment,"" - 'don't-take-it-seriously' and proceeds to give 'real-life studies' as 'evidence' to 'dismantle' an opinion they disagree with. Yikes!    I am not going to take your advice, which is basically telling me to turn my brain off and consume media. The advantage you speak of can all be undone if there is no longer suspension of disbelief - which takes you out of the immersive world of fiction. Did you completely ignore the last sentence of my post? I enjoyed it. So take it easy.",1
1081,I agree when he could instead been really strong for a human. Maybe stun the lion by punching in the face and then they all climb a tree keeping the lions down with poking with sticks. And then him being great at hunting with a spear not by being super human.   In legend Hercules does kill a lion with a choke hold. And a man recently killed a juvenile cougar with a choke hold while being not fatally cut up him self.,1
1082,Hercules is a legend about a demigod and killing a   Juvenile   cougar with a choke hold is slightly different then killing a fully grown lion with one punch,2
1083,dude... the ED is a literal banger!,1
1084,You simply cannot convince me that guy isn’t a Pillar Man or the descendant of one. He 10 billion percent HAS to be,1
1085,He literally looks like one,1
1086,title name drop Kreygasm,1
1087,Well we know who the primary antagonist is going to be.  I mean the dude is wearing lion fur and always has dramatic wind blowing around him.,1
1088,I'm really liking this new anime. It has a very unique story that makes it very interesting to watch.     I just hope that this anime has more than 12 episodes since that would be way too short.,1
1089,Don't worry it's already confirmed for 24.,1
1090,Oh that's good news then !     Thanks :,1
1091,"I was really hoping that this anime was going to stay relatively grounded aside from the premise of the show, ofc.  Cue outrunning lions. Tsukasa comes along and one punches a lion, outruns a pack of wild pigs using martial arts to kill them, and grabs ducks out of the air. since when did ""primitive highschoolers"" become a category, much less ranked by their strength?    Oh well, still getting pretty accurate primitive technology tidbits. The calcium carbonate usage was cool though the fourth usage isn't apparent to me... maybe poison?.     Interested to see where this thing goes.",1
1092,"I swear to god, if Tarzan does anything to Yuzuriha.",1
1093,The brilliance of this premise is that you can go so many different ways with it. The fact that it's an anime just means everyone is turned up to 11.,1
1094, I HAVE ABANDONED MY HUMANITY SENKU ,2
1095,Why the fuck is a highschooler as strong as a superhero,2
1096,Because he is Kars..,2
1097,Why the fuck is Kars some highschooler now,2
1098,"Alternative universe where he reverse ages, lands back on earth, turns everyone to stone and then develops amnesia.",2
1099,The rock part is ridiculous but the one punch lion kill isn't.    There was a guy IRL who killed BULLS with a single punch. ,2
1100,"Holy shit, this anime is so good. I already gave it a 10/10 on MAL, hopefully it keeps being this good.",1
1101,Why the fuck is no one talking about  the fact that Tsukasa's way of thinking highly resembles Death Note's ideology?,0
1102,People are more focused on debating if he's communist or anarcho-primitivist.,2
1103,Me last week: I have never heard of this before.    Me today: I have finished the manga even before the new chapter is released.    I never read like this before since Attack on Titan episode 3. This series has potential.,1
1104,"I like this anime but i just absolutely cant stand Ooki, he's the embodiment of annoying and cringy. Characters like him are why people make fun of anime as childish",0
1105,You are one trillion percent right. Not even one billion. One trillion.,2
1106,Who’s Ooki?,2
1107,"For a show that's all about cool science, that world has some wack concept of physics where humans can karate chop a stone boulder into dust.",0
1108,The characters themselves are the only things that break the rules of physics. You also can't count for 3700 years without going insane.,2
1109,Ah yes just your average Japanese high schooler. Can kill lions with one punch.,2
1110,"I really did not like this episode as the previous one.    Everything felt a bit rushed... they already introduce the villain and already told he's the villain with a different world view of our MCs.    And what bullshit was that they run faster than lions WHILE holding a human sized statue?    Plus, the other dude screaming all the time is getting annoying as fuck.    I would probably being downvoted to oblivion, but the first episode was way better",0
1111,"They funny thing is, they probably  should  have outrun those lions.     Lions can run up to 50mph in short bursts, but they eluded them by jumping down that cliff, forcing them to go around. Like most big cats, lions are built for power, not stamina. and would get tired  much  more quickly than humans.     On of my favorite evolutionary biology jokes is that humans evolved to be the slasher villains of the animal world, you can outrun them, but then they just keep coming, and you outrun them again, but they keep coming, and eventually you're completely exhausted and they just walk right up and slit your throat.",1
1112,"They explained the lion thing with the lions being curious/cautious because they had never seen humans before. I assume that the lions could have caught up at anytime, but were keeping their distance to observe first.",1
1113,"UGH @ people saying Tsukasa is a communist.    It's fascism that wants to purify society via a exterritorializing what you assess as ""impure"".Communism instead it sees ""impurity"" greed, egoism, posessiveness etc. as the very logic of capitalist production. These necessities which these attributes ARE under the current mode of production are then just adapted psychologically because hey - we live in a society and how we live our lives shapes how we think.",1
1114,Omg uR So sMaRt!!,2
1115,"Well at least he is not evil, he is just an anarchist.    Yeah who am i kidding he is 10 billion percent evil too.",0
1116,He's not evil at all. He understands the flaws of the world he grew up in and he realises this is the chance to create a better world.,2
1117,He literally killed a guy and was about to kill another one if Senku hadnt stopped him.,2
1118,"He cares about Senku and Taiju and he cares about nature. His behaviour isn't that of an evil man. He didn't kill the guy because he thought it would be fun or because he thought he'd gain something from it. He killed him because of his justified hatred towards old people. Besides, they shouldn't revive the geezer anyway, so there's no difference if he stays trapped in the stone for the rest of eternity or if he dies.",2
1119,"They literally revived him and a bird. Senku literally revived chunks of corpses too, that means that the stone people arent all dead.    He literally killed one kinda justified? I mean the sole reason he did it now and not before was because he would get in jail but since society has gone to shit he wont face consequences for his vengeance and was about to kill another one because he was friggin old.    Just because some dude beated the crap out of me when i was a toddler doesnt give me the right to kill all old people wtf.",2
1120,"Well, I agree with Tsukasa wholeheartedly and I don't see him as an evil person.",2
1121,"Man, I hope you never become an old person, or your philosophy on how to treat old people might actually cause some kind of dissonance.",1
1122,"Don't worry, I won't, I'll kill myself before I become a smelly old parasite on society that blocks its progress out of spite.",1
1123,"Isn't that just because you lack any confidence in yourself? ""I could never be of any use at that age."" There are plenty of older people doing valuable work. I've met old biologists and physicists, economics and computer scientists whose eyes shine with childish glee as they describe their field of expertise. You really don't think you could be one of them someday?    Back when Stephen Hawking was still alive, would you have seen him in his later years and thought to yourself, ""Yeah, this guy needs to be   culled  ""?",2
1124,you are not even one millimeter wrong.,1
1125,Yep anarchists the first modern terorist movement made up mostly of athiests. Not all anarchists of course just the ones willing to use violence to achieve their goals.,2
1126,How the frick can a guy that respects nature so much be evil,2
1127, laughs in snapping      chuckles in every pokemon villain ever created     Hell a ton of villains are pushed by the hope of getting Earth free from humanity.,2
1128,"Great episode! Love the look of Tsukasa and  that long-ass hair. I love that ending scene with him and maybe I'm wrong but was that the guy that beat up young Taukasa? I couldn't tell.    If I have any complaints, it's the sound effect that don't sound compressed. Like, I swear in that montage where Tsukasa was gathering food, I heard a sound effect from OPM S2. It wasn't as bad as OPM2 because it sounded a little more compressed, but it was still noticeable.    Honestly, after that girl was under the rock, I feel bad for the people that were petrified while getting hit by a truck or something or hell, while being stuck on a plane. Fun stuff.    Though I was 10 billion percent certain that Taukasa had an ulterior motive.",1
1129,  Tarzan   Tsukasa has arrived and it looks like things are about to get really spicy,1
1130,"The last thing Senku didn't tell to Tsukasa is obviously some kind of weapon. He was smelling something was wrong, and didn't wanna tell him you can make weapons as well with lime.",2
1131,So the name of this show is the soap made from crushed shells which is basically their only way to clean themselves and stop germs and infections. Coming from this show it makes so much sense now. A small yet needed item made from something you wouldn't think of.,2
1132,Soap can also be made from animals but the form he's going for is superior in many ways.,2
1133,"Calcium carbonate is widely used medicinally as an inexpensive dietary calcium supplement gastric antacid.  However, excess calcium from supplements can be fatal. That's it boys. The fourth use is poison. Maybe that's why he was reluctant to say it in front of Tsukasa.",2
1134,"The problem I have with Tsukasa's thinking is that unless he plans to only revive teens and kids, then how is he supposed to know which adults are tainted by evil? Does he seriously think 100% of every adult on the planet is a child-beater? Until they're revived, they're just stone statues; you can't tell a person's character based off just that.",0
1135,"I mean, that's precisely why Tsukasa's the bad guy here. He wants to damn countless people because of what they MIGHT do; he wouldn't be the antagonist if he was perfectly reasonable.",2
1136,"I've looked for it a bit online but can't find the answer to this general question: why do they need acid to revive people? It seems like there are only a few millimetres of stone, so can't they just like chisel people off? If not, then how come when you behead people you don't actually see their head in there? If they're just covered in millimetres of stone then also when people lost a hand or something their skin would show. If there's a reason for why they have to use the acid that is revealed later and a spoiler, please don't tell me that haha, thanks.",2
1137,"It is explained quite soon, I'd recommend not trying to look for it online as you'll likely run into a lot of spoiler.s",1
1138,"Okay, thank you for answering.",1
1139,"I have to say, as someone who saw when the manga first came out and ignored it thinking it would be yet another post-apocalyptic battle shonen I couldn't be happier I was dead wrong.    I love the tone of this show, and how it's one of those series that would never be serialized let alone be animated ten years ago. I'm liking it way more than I thought and I'm happy I have something new to watch this season.",1
1140,Anyone have any guesses as to what the fourth use is?,2
1141,"Weapons or explosives as a way to defeat Tsukasa if he proves to be dangerous to them latter, so he doesn't want him to know about it.    I'm just guessing though but that feels the only logical thing of him changing his mind and not telling them.",2
1142,Considering how crazy OP every human character appears to be... are we sure they are humans? Is this set in an alternate reality where the world is populated by the Pillarmen?,2
1143,You haven't watched Danganronpa huh? Highschoolers are OP.,1
1144,Damn that was seriously intense.,1
1145,"Going by the end of the ED, the gang are doing the Tarry Town sidequest.",2
1146,Senku could be written like Doc from Back to the Future.,1
1147,"hmm..i never read the manga but i knew about this character from some certain videos talking about the show....and i always thought its a bit too forced and convenient to release a guy who just happenes to be their BIGGEST obstacle to revive modern society .    but now after watching it....i can see how it happened more naturally, seeing how they were forced to bring him back due to the situation...and him having a bit of justified point of view to hate modern society  and live like a caveman for the rest of his life...",1
1148,Gez what kind of person kills a lion in one punch or grabs a bird out of midair. Senkuu had every right not to trust Tsukasa and lucky he did not tell him what the fourth use was.,2
1149,So Tarzan is Light Yagami.,2
1150,"What kind of title is « The Strongest Primate High-schooler » ? It’s so weird.     And Tsukasa is famous for it too. Like people notice him and go «This guy ? Stronger than a gorilla, I’ll tell you» ?",2
1151,Light spoiler: MMA,2
1152,the bad guy is an anarcho primitivist lol,1
1153,Pave the rich!,2
1154,"It's hard for me to disagree with either person. On the one hand only reviving younger people with less of a set in ""stone"" perception of reality can be good for forgetting a lot of old and backwards thinking that harms progress. Which also makes it extremely easy to create any kind of society the person with power or leadership wants. However, excusing the wisdom of more experienced older people can be a recipe for repeating the same mistakes of the past.    Tsukasa reminds me of the romantic ideal of communism or socialism where people can rally together and live in a utopia. Set out with pure intentions of making a better world but at the same time it's also ripe for corruption and can lead to something like Mao's china or the Soviet Union. His world views are born in hate and disdain for a group of people that mistreated him from a single encounter. Generalizing an entire group of people does not lead to good judgement.     Senku want's to revive everyone even if they're detrimental to an otherwise functioning group. He is either hiding his own idealistic beliefs underneath a colder more calculating exterior or simply wants to achieve as much by his own hands, science, and works regardless of outcome. By reviving everyone hes kind of taking a capitalistic stance of let everyone decide their own fate after they're revived. There is more to it than that, but that's the first thing that comes to mind. Also I'm drunk and just blabbering.    Interesting to see how this develops. Is it a communism capitalism analogy or maybe just a conjecture on what if humanity was given a clean slate to start again? I'm excited to see what happens either way.",1
1155,I think you're forgetting the aspect where tsukasa's idea means that they're gonna commit a genocide on basically over half the world's population.,2
1156,true. I got caught up in the ideologies.,1
1157,I hope this show doesn't do a recap at the start of every episode...,1
1158,that i'm aware of Japanese tv does that because they dont do reruns. it's buy the dvd or miss out if you missed the episodes.,2
1159,This anime isn't nearly living up to the hype. A human being punches a charging lion and sends it flying?  All this complex chemistry works but Newton's laws? Fuck them right.,0
1160,Science-FICTION,2
1161,A bit late but not sure how much I like OP Tarzan. Kind of still wanted it to stay somewhat realistic inside this universe you know,1
1162,The comedy part of these 2 episodes is silly and very cringeworthy in my honest opinion.    Though the setting and the world is interesting and I'm looking forward to what's coming next.,0
1163, The comedy part of these 2 episodes is silly and very cringeworthy in my honest opinion.    Elaborate,0
