,Comment,Sentiment Rating
0,I'm sad they skipped Tsukasa's face during the guesses. he looks like a cute confused puppy.     sadholo,0
1,That scene in the ending with chrome      A BIT CLOSER TO HEAVEN,1
2,Excuse me but you misspelled Gen,2
3,Chrome       ,2
4,Tsukasa's voice is better than I thought it would be. Though they did change what they thought Tsukasa could turn out to be. I made a comparison..     ;    This episode gives a better feel for a building a world starting from scratch. I can't wait to see what's next.,1
5,"Can we talk about the changes to Tsukasa monologue.Because it seems they changed it from ""I don't want the Seniors to bring back the old ways."" to a ""The seniors are tainted and will rob the youth's future by owning the land.""     And the anime monologue almost completely misses the ""I want us to live in harmony with nature and stay at this tech level and not move forward"" part. Manga""which is gonna be kinda awkward with Gens motives of switching sides ""     Although I do love the change from having a stare down to Senku grabbing his shoulder.",1
6,I like how they actually showed Senku building the crossbow.,1
7,"Two more episodes until we're done with the whole Taiju and Yuzuhira part, right? That seems about as much as I think.",2
8,"manga""probably more like 3, it happens towards the end of volume 2 and we're just over halfway through volume 1""",2
9,"it's not a link, it's a spoiler tag. might not show up on redesign or some mobile apps but if you hover over it it might show",2
10,Oh.,1
11,Best gorilla in the OP my eyes can't believe what they're seeing,1
12,"I wonder how they'll animate the girls, because the manga has some quite strange poses and angles...",2
13,Probably just recapture the general idea of those sequences,2
14,"Am I the only one that loves Dr Stone  and  BURNOUT SYNDROMES, but for some reason can’t fight the feeling that they don’t fit very well together?    The OP doesn’t really give me the same vibes I get from the manga.    If they wanted a ‘shōnen band’ to play the OP, I think BUMP OF CHICKEN or maybe even SPYAIR would have worked better.",0
15,Can I get a confirmation on my guess that the 4th thing is that it can be used to purify minerals and hence iron,2
16,That's not it.,2
17,Nope. Good guess but not it.,0
18,DAYUM rifles before crossbows shitttt,1
19,If that’s actually the answer shouldn’t you put that in spoiler tags.,2
20,This is the manga corner.,2
21,"it says ""You are still required to tag all spoilers."" tho",2
22,"Dude, spoilers! Don’t spoil it for him!",0
23,“Man it would suck to revive a murderer first thing”     The Gang Awakens a Murderer ,2
24,"You can pre-order your ""Tsukasa did   NOTHING   wrong"" T-shirt NOW!",2
25,I'll take the Stone World hoodie please.     shutupandtakemymoney,1
26,Just kill a lion with a punch.,2
27,Can I get mine in a Tarzan size?,2
28,New Mountain Dew flavor when?,2
29,Join griffith and thanos club,2
30,Oh that reminds me that r/fuckslaine is still a thing.,2
31,That sounds like a Kamen Rider reference. ONORE DIKEIDO,2
32,Tsukasa: EAT THE RICH,2
33,Real Anprim gang hours.,2
34,"I'm a strong supporter of ""Break the system running on the blood of the proletariat"" policy but not big on his ""Primitivist lifestyle with a life expectancy of 30"" programme.",1
35,"primitive peoples didn't live short lives, you're thinking of feudal serfs",2
36,"man felt so weird agreeing with a lot of what he said, while at the same time knowing hes supposed to be antagonistic here.     ;    I really hope he sticks around though, mixing his ideals with senkus rationality could produce a paradise.",1
37,Tsukasa really steals?     No dignity!,2
38,Wait a second...this is like a Batman vs. Superman anime.,1
39, M-martha-chan..     NANI?? KONO NAMAE WO...,2
40,"thanks, now i'm wondering how that scene sounds in japanese dub...",1
41,"""Clark-san...""    ""iya, Bruce-Kun, dame, kono wa....""",2
42,Chotto matte.,2
43,Kono- adjective this chair is..     Kore- noun this is...,2
44,wait shit you right. This is why i failed Japanese 4 :',1
45,"I never thought about it, but in English they do sound the same! I learnt Japanese from Spanish so it was a very direct 1- 1 translation same with kono, sono, ano. No idea if English is your first language, though. Just something I noticed while writing the example.",1
46,KONO DIO DA!,2
47,Too bad they can't make jolly ranchers... yet.,2
48,Why the fuck would you use those two words together on Reddit. You tryin to fuckin kill someone?,0
49,they just want to watch the world gag....,2
50,"""Murderers do not abide by the laws of nature...you don't know shit about Murderers.""",2
51,He can just saying the man he decapitated was an artistic statement and it's just out of fake stone. Works for most artists!,1
52,The Chad Communist vs. the Virgin Scientist,2
53,Tsukasa's more of a Primitivist than a communist,2
54,"second this. he's a kind of anarcho/libertarian-primitivist with a fascist touch. you can see the libertarian when he mentions taxes on the same level as private property :    also: the fascist vibe comes from wanting to purify the society via exterritorializing what you assess as ""impure""  - instead of realizing that ""impurity"" greed, egoism, posessiveness is just the logic of capitalist relations of production, which depend on exactly those attributes.",1
55,what's this? serious left analysis? in MY r/anime??,1
56,"""yeah, i read theory""",2
57,"""It's more likely than you think.""",2
58,"Yup, it was a real reverse “you had me in the first half not gonna lie” situation for me when he started talking about a social cleansing.",2
59,"Fascism has to do with extreme nationalism. While it can take some ideas from eugenics, it is not the source of the ideology. He's not a fascist, it's literally impossible to be both an anarchist and a fascist.",2
60,"Fascism really doesn't have more to do with nationalism than anything else. Fascists try to have total control over others, like the character in the show MIGHT do. He seems to 'know' what's best for the world, and if he goes through with it and want everyone to follow his will, then he is a fascist.    Edit: I was wrong, mixed it up with authoritarianism it seems. MB",2
61,"That's called authoritarianism, it's not exclusive to fascism. Fascism 100% has to do with nationalism, it's one of its key defining traits. You cannot be a fascist without being an ultranationalist.",2
62,"My bad, I remembered it wrong. Looked it up on a site.    It seems that because facism and authoritarianism often go hand in hand at least in the examples I know; Germany and Italy doing WW2, I mixed them up. Then Antifa we hear so much from in the US, must be solely authoritarian, since they go against nationalism, but still want to force beliefs unto other people by violence.    You are right, fascism is defined to be nationalsocialism on some websites at least.    But can you explain for me, if it's not too much to ask, why Antifa is often labeled as a fascist group, if they are not nationalistic? It seems to be many places on the web where people call them fascist because they are fine with using violence against non-violent people to force their views. But it seems to me now that they are 'only' authoritarian, which is of course not better at all, but totally different.",2
63,"People call antifa fascists because, they have fascism confused with violent authoritarianism. It is a useful comparison, though, as it shows the hypocrisy. Antifa don’t think what the fascists did in the mid 20th century was wrong, just that it was done for the wrong reasons and targeted the wrong people.",1
64,Dude what? Antifa pretty much only organizes as a response to Nazi protests.  Point me to where some body of antifa said we should Holocaust all the rich people and put them in camps.,2
65,Ah I see you're an expert on right wing propaganda against Antifa.,1
66,Thanks mate :,1
67,"I wouldn't call white nationalists/supremacists a non-violent ideology at all. There have been several mass-murders and killings done by people who explicitly say they are white supremacists. Many of them literally want a white ethnostate, which can only be achieved through violence.    Antifa occasionally punches them with the goal of stopping that from happening. You can argue that's wrong or ineffective, but calling antifa fascist or authoritarian is nonsensical. Many of them are anarchists which is the exact opposite of authoritarianism.",1
68,"With that logic I bet enjoy watching muslims be attacked/harrashed as well. After all some terrorists are muslim.    You can't lump people into groups that easily.    You also shouldn't fight violence with violence, and especially don't try to make things violent because the other group 'might' become violent later. Sometimes antifa are the aggressors, don't forget that.",0
69,"Like I said you can think that it's wrong, my main point was that calling antifa authoritarian or calling white nationalists ""non-violent"" is inaccurate.      ;    If someone is openly a neo-nazi, then I think we should be intolerant of that person so that publicly advocating for genocide and hate crime remains unacceptable in our society. If some people think that occasionally punching them or the people that proudly march next to them is the best way to communicate that, then I'm personally not going to lose much sleep over it.",0
70,"The biggest problem isn't antifa attacking white-nationalists tho. It is when they attack 100% non-violent conservatives. I wont justify violence against non-violent journalists, simply because they disagree with their political view.    You are free to have your own opinion, but it becomes very dangerous when you justify violence against non-violent people. Just because you disagree with conservative political views, it doesn't make those people less human.",0
71,"This is some intense concern trolling. White nationalist groups consistently attack minorities and kill them.  Far left extremism in the US killed 0 people in 2018, while far right extremism is far and away the largest group that is actively targeting and hurting people.",0
72,"He is not really a communist, closer to a facist actually but against old people and technology.    Communism relies a lot on technological advancements.",2
73,Luddite anarcho-primitivist. What a piece of work.,1
74,"This comment has been removed.      Please keep all source-related comments, such as discussion of future events, comparisons with the source material, or talk about the source material in general, in the Source Material Corner.    ---  Have a question or think this removal was an error? Message the mods.     Don't know the rules? Read them here/r/anime/wiki/rules.",0
75,"a guy with hair that glorious can't be  that bad , right?",1
76,its always sunny in stonedelphia,2
77,"What an interesting villain too. Not just megalomaniac ""I want to control the world"", but rather, ""I want to purify the world of the people who make life worse for everyone.""    In other words, acting as the God of the world, not for reasons of power, but to make the world a better place. Always the best of intentions, leading to the worst outcomes.",1
78,The Gang awakens a demcrap,2
79,"That moment you INSTANTLY know we're doomed because Bruno Kars the Pillar Man is FAR too over powered to actually stay with the group. I get senku, but they would literally never have a problem again if he stayed good. Which made me kept side eyeing every line he said.     And given his whole view of ""Just bring back the good ones, and we'll purify humanity of asshole."" A lot of them make sense. Just a lot of ""You'll never have to worry about bla bla 'IF I'M AROUND""      Flag wave ",1
80,"Why do you think he suddenly ""forgot"" a fourth use of sodium carbonate?",1
81,"What does that imply? Sorry, I'm as dumb as Taiju",1
82,That the fourth use can be used to harm someone.,2
83,he was also crafting something that looked like a crossbow at night while the others slept. so conflict inbound.,2
84,"and the next episode is literally called ""The Weapons of Science.""",2
85,Didn't notice that,2
86,"I was thinking it would be used as chalk for writing with so the episode title was a ""the pen is mightier than the sword"" deal.  Tsukasa could force Senkuu into writing all his knowledge down and would no longer need him alive.  Granted that would take a lot of time and stone tablets, so yeah it's probably a more direct weapon...",2
87,His knowledge of how to be insanely strong?,2
88,"Meaning, if Senkuu shared the fourth use of calcium carbonate as writing, and Tsukasa wanted to create his perfect world which Senkuu opposes, then Tsukasa could have Senkuu record all the knowledge he possesses and then remove him as an obstacle.",2
89,"My bad. I got the character names mixed up. But even still, as a writing material, it would make more sense to use chalk or crushed rocks. Instead of going through all the trouble of getting those shells just so you can make paper or writing utensil.",2
90,Agreed 😅,1
91,Yea I was thinking gunpowder or caustic acid,2
92,It implies that the 4th thing is something that senku doesn't want Tsukasa to know.,2
93,Gunpowder I'm pretty sure. The reason why he is not saying it is because he specifically wanted CaCO3 as a deterrent for Kars.    Edit: Ok I just watched ep 3. Mb.,2
94,He left it out on purpose to prevent any more tension with Tsukasa.,2
95,"  Sodium Carbonate is lethal after ingesting as little as 4 grams and is known for its water solubility.    Didn't Taiju and 	Senkuu inhaled some of it when former one was was pouring it to this long vent? They choked few times during that time. I don't think it was only smoke since in previous scene agriculture we see how dusty  the product they made is.",2
96,"What they inhaled was most likely just high concentrations of CO2.    They kinda went quickly over that part, but to expand without complicating it: the most common seashell you'll find is CaCO3, but you can also find all sorts of permutations depending on what created it.    For the purposes making mortar, ceramic and potentially glass, what they want is CaO Calcium Oxide. Basically just remove some of the oxygen and carbon. How do you do that? Just burn it! Above 400 degree Celsius CaCO3 splits into CaO and CO2.",2
97,r/theydidthescience,2
98,That's probably gonna be the case every week.,1
99,"More likely he's going to use it to make explosives. You can mix it with the bat shit/dirt in the cave to eventually make purified potassium nitrate.    Calcium Nitrate in solution plus Calcium Carbonate potash lye -  evaporated calcium carbonate and  potassium nitrate:    CaNO32 4H2O + H20 +K2CO3 -  KNO32 + CaC03 4H20    He has everything he needs nearby, and combined with him making that crossbow I'm thinking he's either going to make some sort of impact explosive launched from the crossbow or just straight up gunpowder",2
100,"Wait, that’s  potassium  carbonate. That’s from ash, so easily obtained, but what about the calcium nitrate? Calcium carbonate + nitric acid? What happens if you simply mix lye with nitric acid instead?    gotta love how this anime’s threads are turning into the Anarchist’s Cookbook...",1
101,"Nitric acid reacts with calcium carbonate to form calcium nitrate. The leeching process turns calcium nitrate into potassium nitrate.     Put soil from the caves into troughs that have drains/spigots on them. Pour water over cave dirt; let stand for a few days fully saturated water dissolves the calcium nitrate from the soil. Drain and retain water from the vat. Pour water through fresh batch of soil and let stand. Repeat a few times and you now have what is known as petre water. Boil the petre water and add potash lye K2C03; the calcium precipitates out. After soaking, strain the lye to remove sediment.     Boil the solution until salt crystals form boiling creates salt and saltpeter., then scrape off salt crystals. Replace evaporating water. Strain again and let cool slightly this removes last of the salt, leaving saltpeter in solution, boil down to concentrate and thicken. Strain again.    Cooling produces saltpeter crystals. Let this dry in the sun. You now have potassium nitrate crystals ready to ignite.      DO NOT TRY THIS AT HOME YOU WILL BLOW YOUR DUMB ASS UP OR AT BEST BURN YOUR HOUSE TO THE GROUND",1
102,"Ok. But my question was also, why use calcium carbonate at all? Why not just mix nitric acid and potash lye? Is the reaction easier to control this way?",2
103,  potash lye    Is not Calcium Carbonate. Calcium Carbonate is a by product of a process for making explosives but you do not use the Calcium Carbonate itself for that from my understanding.    I mean potassium comes from the word potash. It was made in pots from ashes.,2
104,"Are you talking about   sodium   calcium carbonate more or less chalk,   sodium   calcium oxide lime, or   sodium   calcium hydroxide lye?    I don't think   sodium   calcium carbonate alone is actually as poisonous as you are saying.    Edit: Yeah, it looks like you're mistaken. The LD50 for an adult male would be somewhere from 250-300 grams, not 4. And that's just extrapolating based on rats. also, heres the one for calcium carbonate, the one mentioned in the show, which is even less toxic. Edit2: sorry I got a little mixed up. Yes, sodium carbonate is not as toxic as the other commenter was claiming, but we should have been talking about  calcium  carbonate, because that is what they were talking about in the show. It is also calcium oxide and calcium hydroxide. Everything else I said is still applicable, after the corrections.     I just had come back from a wiki dive about the calcium ones, and when I read and responded to somone writing about sodium carbonate, it just stuck in my head. Sorry for the confusion.    Edit3: Screencap of the correct compound ",1
105,  in its powdered form can be thrown like pocket sand    Well it looks like Senku doesn't need anything else then. Pocket sand is the ultimate self defense weapon.,1
106,at night while the others slept he was making something that looked like a crossbow. poison darts are most likely his plan. or at least some form of overkill tranquilizer,2
107,  keep a bag of it at your hip at all times. Prehistoric Taser.    More like prehistoric   POCKET SAND  ,1
108,"I believe he is going to use Calcium Carbonate to make steel weapons, as it appeared that he was making a crossbow while the others were sleeping.  Another reason I believe this is likely is because he was talking about how it was going to bring back technology.  Going from the Stone age to Iron age is a pretty big leap in tech IMO.",2
109,"Lol, lye is not anywhere close to that dangerous. You might get chemical burns, but it would be a terrible tool to actually try to kill someone with. Better off finding a poisonous plant, or just straight up hitting them with a rock.",1
110,"I was like, SPOILERS! Then I read the comment and was like, ok science but still low-key spoilers. Idc tho",1
111,"Quicklime has been used as a gas weapon in historic times, blinding and chocking people.    There’s actually more than 4 uses for calcium carbonate anyway, it’s used in glass production, mining and can be heated to create a very bright light - hence “limelight”’s use in theatres.",2
112,From what I understood he didn't want that Jojo guy to learn the fourth use,2
113,I love how you refer to him as Jojo guy,1
114,if i remember my chemistry lessons from old youtube videos correctly then its time to make some fucking guns.,1
115,Gunpowder,2
116,"Hey, just a heads up, it's calcium carbonate, not sodium carbonate. I fell into the same trap, but here's the screencap ",1
117,It’s still an oxidizer.,2
118,That is Calcium Oxide.,2
119,You can make some kick-ass tortillas with it.,1
120,"Can't you use sodium carbonate to harm someone firearms, I think? Also, remember how Mr smarty pants said he didnt trust mr girly hair? I think that senku here wants to have something to keep the "" 1 primate high schooler"" under control, to keep his gang safe since tsukasa won't hesitate to destroy statues he ""didn't deem worthy"". Just a theory, personally I like the poison theory.    Edit: changed guns to firearms, since guns is too specific, and I don't think you can pull out a random pistol in their situation",1
121,"im thinking it's a way of defense against TsuKARSa, but afaik, calcium carbonateNot sodium main uses don't involve any thing that could be used to defend.    What interesting, though, is that calcium carbonateto be more exact, the lime, CaO, in limestone can be used with silica to make glass with the help of sodium carbonateSoda, soda lime glass to be exact. Glass is chemically stable, that's why all the chemical stuff are stored in glass beakers and stuff. Although , i'm not sure how stable soda lime glass is compared to the borosilicate that chemical beakers are made out of. With glass, Senku could probably make a lot of other chemicals that he wouldnt be able to now.        Edit:  So i rmb Senku's line ""in this world without guns, he's unstoppable"". I did some research into gunpowder and shit. While you can't make gunpowder with calcium carbonate, there's an interesting equation : CaNO32 Calcium Nitrate + KCl -  CaCl2 + KNO3. KNO3 is saltpeter, a major constituent of black gunpowder. Calcium nitrate can be made from calcium carbonate through various ways. Although this equation doesnt yield much KNO3 and not used to produce it industrially",1
122,I’m pretty sure you mix charcoal sulfur and lye together to make a very weak gunpowder irl. It’s also something that eats the fats in your body so it can dissolve your skin. It’s a bonding agent in concrete. If you put it in water the steam that comes off is an acid so you gotta be careful when whitewashing a house.,2
123, cough   cough  calcium carbonate  cough ,2
124,That kind of speech is exactly what a bad guy would say to justify his action,1
125,nan,2
126,"Huehue, Bruno   M  Kars",2
127,Looks a bit like Bruno Illuso to me.,2
128," And given his whole view of ""Just bring back the good ones, and we'll purify humanity of asshole.""    This might not be the worst thing in the world if it were actually possible to determine that, but currently the only information they have is a vague idea of what the people looked like before they were petrified. Kinda hard to tell who is evil and who is good.",1
129,"""Bruno Kars the Pillar Man""        I'm straight up dead.  Kudos.",1
130,So Tsukasa is the boomer hunter?,2
131,Rise of millenial,2
132,Millenials are like 30 by now.,2
133,   like 30    You forgot a couple zeros there,2
134,"3030, damn we're old",1
135,"3730, really. But, who's really counting? What's important is, we need pensions!",1
136,"Well, Senku's still counting if that counts....",1
137,3700 years later and you have your eye on the ball.  Good work!,1
138,Well...   I mean he did...,2
139,30,2
140,Listen here you little shit,2
141,3730's by now.,2
142,It's like 23-38,2
143,AWAKEN MY MILLENNIALS,2
144,the ultimate zoomer,2
145,He's clearly part of the Anprim gang. Complete with the genocide of those unworthy to live in the new paradise.,2
146,"Nah he’s ok with technology, he’s clearly a Maoist seeking to ensure a cultural revolution prevents a return to the old form of society.",2
147,"I wouldn't say he's a Maoist at all, he mentioned taxes as a negative thing, I doubt he'd be okay with a massive Communist state. I agree with the assessment above, he's an anarcho-primitivist.",2
148,"Since there's not a state that needs to be dismantled it sounds like he just wants a stateless classless society which is pure anarchism/communism without the need for any revolutionary or class theory, which is a big part of what differentiates different leftist theories.",2
149,"Hm, I'll abstain from commenting further because I'm afraid I might mix some of what we saw in this episode with my understanding of his ideology from later on in the manga, but I'll just say, he just doesn't strike me as a communist, and maybe we should discuss this again a few episodes down the line.",2
150,"Those words have no meaning here. Comrade Shishiou is using violence as a mean of imposing his doctrine of the liberation of the proletariat, in the future proletariat's favour, upon the beourgeoisie. He is a revolutionary.",1
151,"He's not a Maoist, you can't do a mass line with three guys.",2
152,Didn't you see that he used a spear? A true anprim would hunt fish with his teeth.,1
153,he definitely harbors some anarchist principles but doesnt seem opposed to technology. He just doesn't wanna see the world fall back into a capitalist one by any means necessary. I really hope they explore this more because It's actually quite relevant.     ;    He has the potential for amazing character development.,1
154,"Is his reasoning better than it seems at first though? Like yeah he had one traumatic experience with an old guy, and suddenly every adult is literally tainted and needs to be put down?",2
155,It did happen in his formative years so it was probably the seed that made him develop his ideology. But does he not realize his sister would have never gotten surgery if it wasn't for technology? A bit of an idiot yeah.,1
156,"Well, he lived in a society, after all.    That's how the true monsters are created.",1
157,RISE UP!,1
158,The real hero of the show.,2
159,Looken like a pillar man,2
160,Tsukasa is a Knights Sabers of the distant future.,2
161,Zoomers rise up,2
162,THEY ARE THE BOOMERS AND WE ARE THE HUNTERS,2
163,So the name of this anime is actually... Soap.,2
164,What the hell kind of a name is soap?,2
165,How'd a muppet like you pass selection?,2
166,Oh thank god. Scrolling down I thought I was the only one who got the reference.,1
167,Same,2
