,Comment,Sentiment Rating
396,"Thats what hooked me on the Manga was he is most certainly  not  a wizard. Sure, you know how make PB&Bread - PB - Jelly but to go do it Bear Grills style with nothing but a loin cloth is some next level shit. Manga Spoilers""Bread Arc"".    So remember, every flair/pin/poster/decorative is something he had to plan -  farm -  craft to put it there.",1
397,I really likes the road maps too for every new project,1
398,And also him just casually lighting a bunch of gasoline in a sink in the first episode,1
399,"Yeah I like how the only description I can think for him is ""mad scientist"" but he's literally not one",1
400,Is Tsukasa the antagonist?    I'll be real sad if he is :c,0
401,"I mean, it was really obvious from the beginning that he'd be the villain.     A He's built/looks like a major villain    B Senku mentioned that he would be unstoppable if he wanted to be evil    C He wants to murder billions of people because they might be mean",2
402,It’s extremely foreshadowed,2
403,"As soon as i saw it was the same eery guy in the intro, i was 10billion percent sure he was the villain",1
404,"Right? I was like, hmm, isn't this the guy with the ominous walk from the intro? Isn't he obviously evil?",1
405,I can't think of the last time a character named Shishio was not a villain.,1
406,"Fun fact: Shishiou literally means ""Lion King."" Between this and the reference to his sister loving the Little Mermaid, I feel it might be a reference.",1
407,"Also, I can think of one major hero named Shishioh:    Guy Shishioh, the King of Braves!    Double Hero Points: He's voiced by Nobuyuki Hiyama, who would go on to voice Adult Link in the Legend of Zelda: Ocarina of Time.",1
408,"They have weapons in the intro, with two people defending that aren't him, and he's shown walking with the screen toned red. How villainous can you get",1
409," Senku mentioned that he would be unstoppable if he wanted to be evil    ""Let's first revive the people who are hardest to stop if they turn on us"" Geniuth",2
410,"at the time there was seemingly little choice      although they'd been outrunning the lions seemingly fine until that point, soooooooo  ",1
411,Plus the opening,2
412,Also if you just pay attention to the OP it seemed very clear.,1
413,"Also, he appears red on the OP. That's a big villains sign for me",1
414,Don't forget about the entire red background when he's in the op too,1
415,Damn art schools,2
416,"I guess he didn't get in, huh?",2
417,If we're going that route isn't he more Mao than Hitler?,2
418,r/unexpectedhitler,2
419,Nothing important then.,0
420,"Yeeeeaaaah, just saw the end of the episode.    Well that is disappointing.",0
421,"Not waking them up doesn’t equal killing them and he’s the right one. What’s the point in returning to the world where people privatize land and expect you to pay for simply living. Where something that was initially common is now taken by self-righteous individuals. A world divided between rich and pour, those with power and the helpless ones. Senseless. Utterly senseless.        TD;LR Senku is the one in the wrong",0
422,Yeah I don't think avoiding uber-capitalism is  a priority in their stone world. His emotions are causing him to think irrationally.,1
423,"On a certain level, I do like just  how far  Tsukasa has put the cart before the horse.     We need to make soap so that we don't die from infections because there are no doctors in this world.     Cool, that's cool. So hey I've been thinking, what if we murdered everyone except the young to create a new world order?",1
424,  JustStoneAgeThings,2
425,"His concerns are not wrong, but this should be season 2 shit. You know, then the sum of humanity is more than just three dudes.",1
426,"  Not waking them up doesn’t equal killing them and he’s the right one.    He isn't content on not waking them. He is literally killing them in the episode, so he places zero value on the human life of a major percentage of all humans. This will be hundreds of millions, if not billions, of people he intends to let rot or kill as his mood dictates.      What’s the point in returning to the world where people privatize land and expect you to pay for simply living. Where something that was initially common is now taken by self-righteous individuals. What’s the point in returning to the world where people privatize land and expect you to pay for simply living. Where something that was initially common is now taken by self-righteous individuals. A world divided between rich and pour, those with power and the helpless ones. Senseless. Utterly senseless.    You only end up exactly where we are today. We could choose to live the way you describe tomorrow, but we don't, because we choose not to and for good reasons. The modern large scale attempts to get rid of privatization and have people own everything as one collective ended in tyranny, mass poverty, and some of the worst ecological disasters known to mankind. We didn't end up with the current capitalistic system randomly, we have it because it works better than anything we've tried before. The divide between rich and poor has also always existed, but the poor in modern developed societies live in warm houses, have plenty of entertainments, never go hungry, live long healthy lives and get medical care. Attempts to fix this modern capitalistic system tends to lead to societies where the upper middle class doesn't live as well as the poor do in capitalistic societies.",2
427,"That’s not exactly right though. We could  not  choose to live that way tomorrow because there is a specific cultural legacy we must deal with. For example, private property would need to be expropriated by force; but in a culture in which commons were the norm people would go along with it. Tsukasa isn’t wrong that this IS a chance to completely turn around history. The problem is whether it’s worth the horrific sacrifice he is willing to make for it, or if he can build a better society at all.",2
428," He isn’t content on not waking them    I have to disagree with you here, the person he killed was the fisherman from his story, someone who he had grudge against and was under influence of strong emotions at that moment. But the rest of the adults? He has no reason whatsoever to kill them, he doesn’t seek revenge over the whole mankind. He never said himself that adults should be killed, therefore stating so isn’t groundless      The reason why the system isn’t changing isn’t that it wouldn’t be beneficial. We as humans can’t even  choose  the system they have because the world is ruled by a handful of rich and those who acquired power and it’s convenient for them to make things stay the way they are, because they gain from it. The past systems like socialism or capitalism didn’t work not because of the societies but because of individuals. Communism is a actually a good system but extremely idealistic for the world we live in, since there will always be people who think they deserve more than others. Such system would only work in a small community where peer pressure would take effect. The other systems that have collapsed would also probably work but only under certain circumstances.      What you described as “poor” is actually how people in the middle class live. The real poor people are the ones in slums, in crumbling houses without heating and barely any money to sustain themselves or homeless. Their standard of living is below average, often not because they are at fault. And there are far too many of them. Look at Brasil for example- the society is basically divided between people living in slums, those who live in regular houses or flats and those who own their mansions. But it’s the same for developed European countries or America, the amount of poverty regions and homeless people is honestly horrifying. And then again there are those extremely rich people who can afford to own 10 different sport cars for God knows what sake. How can a system that allows and even supports this state of things be positive?",2
429,"  the person he killed was the fisherman from his story someone who he had grudge against and was under influence of strong emotions at that moment. But the rest of the adults? He has no reason whatsoever to kill them, he doesn’t seek revenge over the whole mankind. He never said himself that adults should be killed, therefore stating so isn’t groundless    It wasn't, btw. It was just a random middle-aged guy. The guy in the flashback and the statue he smashed look nothing alike.    And yes he was about to start killing more. He was literally mid-swing on the next guy until Senku stopped him.",2
430,"Alright, for me they looked kinda similar, but still there is something like “murder with passion” and it happens when a person is under influence of strong emotions. At that time he was. I doubt he is going to do that again since he shouldn’t resent all of the adults, or well, at least I’m hoping the story doesn’t go that way and we’ll see a clash of ideal rather than “we woke up a bad guy oh no now we good guys need to fight him”",1
431,"because its a terribly naive perspective. not waking up the bad guys wont mean all evil will be gone and they'll be in fairyland. and they don't have any property or is there any concept of rich and poor, there is no civilization or government or currency to make it so, everyone's starting from ground zero, infact in their stone world its people like Taiju and Tsukasa that are ""rich"" because of their physical prowess, people who can make others do what they want cause of their strength.",0
432,"I mean of course that doesn’t been all evil will be gone, but many will want to return to the old system they are used to. But same goes for youth. They have a chance to start from scratch and not repeat the mistakes humanity made so far, create a new better system that doesn’t exploit the resources so much and so on",2
433,Creating a better system while considering the past flaws doesn't need you to kill or not save the old people. They have no power anyway.,2
434,"But as of now he is sentencing everyone over a certain age, assuming that young people themselves wont do exactly that, he is behaving like a tyrant.",2
435,"Yeah, and that is a mistake, bc what he says about young people being pure-hearted is bullshit. It’s not like his thinking is faultless, but the sole ideal of creating a world without privatization and a new system is good in itself",1
436,Can’t they not revive the bad boomers but revive the good ones?,2
437,"The problem is, nobody knows which ones from milliards of humans are good and which are bad. The same goes to adults and youth too. When he says that the youth is still pure-hearted is bullshit, some of them shouldn’t be revived as well if he wants a stainless society. The best thing that can be done is to revive just a few and create a society from that with new ideals.",1
438,The killing people stuff is stupid but without it he is 100% a good person.    Like unironically even with the killing stuff the sort of world he wishes to create is good.,1
439,a lot of good villains want to do good from their perspective.,1
440,"Yes, finally somebody who gets it",1
441,Do you like... watch the show?,2
442,"Still, why confirm it? This serves me as a reminder yet again to never read r/anime discussion threads lol",1
443,It's not like he spoiled anything. Tsukasa is definitely the villain - it's even blatantly hinted at in the opening/,2
444,"I don't even watch openings because so many openings spoil stuff, uh I'm just gonna turn notifications off now",0
445,Careful subaru dies,0
446,"That's your own judgemental mistake. The PVs and the opening makes it very clear this guy ain't good. And no I'm not gonna use the source material discussion, cause I'm not discussing about the source here.",0
447,"That's your fault for not watching, cause it was meant to be watched before the show, that's how TV shows work.",0
448,Amazing,1
449,Had you not  seen  the ominous as fuck OP?,2
450,"I haven't read the manga so I don't know anymore than you, but I thought this episode made it pretty clear he was going to be an antagonist.    That anarcho-primitivist eugenics spiel he went on wasn't exactly subtle.",1
451,this edit spoiled the shit out of me,1
452,"He is obviously going to be a villain though. It’s mentioned that he is too strong. And he wants to kill everyone who isn’t young, so that should be a red flag.",1
453,Ahhhhh come onnnn this is r/anime not r/manga,0
454,"I haven’t read the manga, I just assumed that he’s the antagonist because he wants to kill everybody but the youth. And it’s even said that he’s “too strong” for them.",1
455,"""RISE, MY GALACTUS!""",2
456,"And your edit spoiled me, nice.",2
457, joe rogan enters chat ,2
458,Your edit also spoils it for those reading your comment since it confirms what you’re saying -_-,0
459,"Actually you're the first person to confirm it, I took it as a joke cause they stone pillar manned a super buff murder dude",0
460,"Yeah I was actually joking, I haven’t even touched the manga",1
461,"Damn, I just love that right from the start one could tell that Tsukasa was going to be troublesome based on his appearance alone. But killing a fucking lion, and destroying boulders barehanded? Hopefully, that fourth thing that can be made with those shells is some weapon as that guy is unstoppable at this point.",1
462,my assumption is gunpowder,2
463,"Gunpowder doesn’t require calcium carbonate, and you would have to go out of your way to make gunpowder using it.    Gunpowder needs Potassium Nitratecan get it from bat shit, sulfurthere’s a Volcanic valley in Japan relatively near Tokyo where sulfur can be aquired, and Charcoalextremely easy, it’s essentially just charred wood    This is just speculation but the 4th use he is alluding to May be the purification of iron ore to Iron in a blast furnace where the calcium carbonate forms a slag with the impurities from the iron ore, leaving the Iron mostly purified and in a state useful for weapons.",2
464,"this guy steels      I wasn't sure because I'd been seeing the gunpowder alternative, but civilization wise the production of steel is absolutely essential",2
465,Correct 10 billion points to you.,1
466,.......I don't see how weapons are going to help much when they're untrained with them and they're literally up against a guy who kills lions and breaks boulders with his bare hands...,0
467,"I mean, I would prefer to have a weapon rather than fight him unarmed.",1
468,Mine's rubber.,2
469,"  fourth        It's explosives, the powder can be used as an explosive.",2
470,"senku builds a crossbow while they sleep, maybe the shells were a part of that...",2
471,"I knew Tsukasa was gonna be an issue when he wakes up from stone and his first words are ""What's the situation?"" That is not the reaction  of a sane person.",1
472,"Well, he made a crossbow to go along with whatever that 4th thing is...so...logically it will probably be something to put on the tip of an arrow right?    Senku is also just really smart, so he'll eventually make most things we had in the modern era.",1
473,My guess is that it'll become a form of gun powder,2
474,"Don't you just love it when the new guy starts ranting about the abuses of the ruling senior class, suggests the establishment of a new anarchic civilization, and contemplates the killing or at least not bringing back to life of an entire age group due to perceived impurities?     I'm not being sarcastic nor am I slaying the show. The new guy seems really interesting.",1
475,"And I love that he needs Stone to make his wish come true, so it's not like killing him and he definitely can will do any good, also he needs to learn everything he can from stone, and using torture or whatever isn't gonna do it for now. He has to play along with stone and somewhat outsmart him.    Also the better way for him to prosper is reviving someone as clever as Stone, and he probably can assuming he knows the people of their school and of course they will find a way to locate them even after 3000 years",1
476,"The one flaw in this plan is the ""as clever as Stone"" part. I don't think such a person exists. You need someone with an encyclopedic knowledge of every scientific process, because all the reference books have rotted away.",1
477,"I said that because the lab stone was on episode one was full of scientists, so he could persuade one in the process. Of course not with his knowledge but at least someone with high IQ",2
478,"No one on the level as Senkuu though, He's got basically all of science explored by mankind ingrained in his brain",2
479,"He is the ultimate scientist, It's awesome that I can entertain myself and learning useful things I neglected in school LOL",1
480,Who is Stone? Are your referring to Senku?,2
481,Nah. He obviously means the soap.,1
482,yeah I was fixed in that name it's dope though that's the same as calling Gon by Hunter every time. My bad.,1
483,"It's a really interesting dynamic they're setting up here.     Tsukasa has a valid point that bringing back the old world means restoring its injustices as well, and they have a real opportunity here to make something better. Senku is a scientific genius, but he may not be considering the social and political ramifications of his actions. He may be the  de facto  leader right now, but not everyone they revive is going to respect that. The adults especially are not going to want to submit to a child.     Senku, on the other hand, rightly objects to Tsukasa's extreme methods. He also realizes that choosing not to revive someone if they have the ability to is essentially murder-by-omission. Senku also has at least  some  social awareness, being able to motivate Taiju and recognizing that Tsukasa may be a threat. He may be able to come up with a decent plan now that he is aware of the problems.",1
484,"I love it because like all good antagonists and radicals, he's partially right! A libertarian in the traditional sense, not in the American sense, i.e. non-Authoritarian society WOULD be better and would be much harder to pull off if you revive the corrupt oligarchs and powers-that-be, but of course his MEANS involve murdering said powers that be. Is it justified political violence or crossing over into the realm of purification based on one's views?    That's the ideology of a top notch antagonist, I'm PUMPED to see where it goes!",1
485," A libertarian in the traditional sense, not in the American sense, i.e. non-Authoritarian society    The usual term in political science is anarchist.     For the others: contrary to popular belief, anarchism isn't about absolute chaos, but about the elimination of hierarchy. This includes social hierarchy e.g. of a government over its citizens, of one race/gender over another, of one nationality over another and economic hierarchy e.g. of employer over employee, of capitalist over worker, of rich over poor. For this reason, libertarians and anarcho-capitalists are generally not considered anarchists, as they advocate for economic hierarchy.    If you want to find out more about anarchism, I would suggest /r/anarchy101, ""Anarchy Works"" by Peter Gelderloos, or ""The Conquest of Bread"" by Peter Kropotkin.",2
486,  but of course his MEANS involve murdering said powers that be.    Technically not if you just never revive them.,2
487,I accidentally went and binged the entire manga after seeing the first episode    We in for a gooooood fuckin time.,1
488,  I accidentally went and binged the entire manga    hate it when that happens     taigasigh,0
489,it happened to me too.,2
490,Is the manga complete? I didn’t look up the show before watching to avoid spoilers and just finished episode two. Is this probably going to be a very long anime or relatively short you think based on manga?,2
491,I think you replied to the wrong person - the manga reader was the parent comment to mine.,2
492,"Nope, the manga isnt complete but you can read other words by the mangaka - Bochi.     Just be careful you dont end up in the hentai section, since he does draw hentai at one point and you probably realized by now that most of the female drawn by him looks like pornstar.",1
493,  accidentally    Yeah totally,1
494,"Binged until chapter 7 and had to force myself to stop.    Lads settle in, shits goin get good.",1
495,"Aint seen nothing yet, shits dont get REAL good until a certain watermelon comes along",1
496,"Oh hey, I wasn't the only one!",1
497,Who would have thought seeing 1 anime episode would lead me to read a 120 chapter manga in two days?,1
498,I read the first 2 volumes couple of months ago and I ordered volumes 3-5 like 3 weeks ago and they finally arrived this Wednesday and I finished volume 3 right before today's episode aired :D,1
499,Happened to me with the promised Neverland too,1
500,been following it weekly since ch1...one of the best manga i ever read,1
501,Do you agree with me that if it only gets 12 eps it will be shitty?,1
502,"This is 2 cour show, so we getting 24/25 episodes.",2
503,"The sheer quality of the anime is too good for it to be shitty.    It'll be disappointing if it's shorter, but I'm not sure if we can get to any good stopping points in 12 or 24 episodes tbh.",1
504,"I was quite tempted to do that too, but I wanted to come into each episode fresh so I held off. I'm considering reading Vinland Saga though since the next episode won't be for another 2 weeks...",1
505,Same lol,1
506,"I did the same after watching the first ep, but only had time to read to chapter 50.",2
507,"Guy this is a spoiler, delete it. We're in an anime only thread.",2
508,"Since it will inevitably be animated this season, I think spoiler rules mean I can't say. It's all science though so you can find out easily enough.",2
509,Oh God oh fuck they revived Kars,0
510, Aztec dubstep starts playing ,1
511, AYAYAYAY,2
512,Inbefore they send him off to space again,2
513,To be fair my weeaboo senses are telling me he will eventually deserve it.,1
514,"Good episode, new character that looks like an alternate version of Kars with Illuso's hair and Bruno's voice. Also rip lion.     Premiere of first ED, which is catchy as well.",1
515,"He casually killed a grown alpha male lion with one punch. He didn't even turn his back, Power Rangers style. His  strongest primate highschooler  title wasn't a mistake.     dancewithit",1
516,  strongest primate highschooler    Is this set in the Danganronpa world?,2
517,"With those character designs, possibly.",2
518,maybe Tsukasa is an entomologist,2
519,Tsukasa gentleman! Tsukasa would never kill someone!,2
520,It's good they haven't developed a toilet paper yet.,2
521,Tsukasa is basically a Danganronpa character.,2
522,Ultimate Highschool Level Primate,2
523,Senku: Ultimate Highschool Level Scientist    Taiju: Ultimate Highschool Level Menial Worker,2
524,Imagine the ultimate unskilled worker. He'd probably make $14.00/hr part time.,2
525,"Yuzuriha: Ultimate spoiler""Highschool Level Tailor""",2
526,He's Gonta's long lost brother,2
527,"I haven't played V3 yet, so my first thought is Sakura instead.",2
528,I'll just say you're in for a wild ride.,1
529,"Well, for now I'm playing the full Zero Escape trilogy, so I'll get to V3 in due time I guess. But that's good to know :D.",1
530,Taiju has a real Kiyotaka energy to him as well,1
531,"Yeah, I thought I recognized that voice. Stone World Communist Kars should be an interesting villain!",1
532,Really thought Yuzuriha was going to get revived this episode.,1
533,After the first episode I thought that she won't be revived until the very end,1
534,"Which is really dumb imo. I feel like Taiju is going to constantly stop every attempt at reviving her because it's not ""perfect"" yet. Like ""She doesn't have any clothes!"" then ""She needs a bed/room first!"" and ""What if she wants to try her favorite food when she gets revived! We need to develop that first!"" I really hope I'm wrong about it though because Senku should beat the logic into him about that not being more important than her life.     If that's not the reason why, then my guess is that Tarzan is going to fight with Senku over genociding the adults. Senku says no. Tarzan kills all the bats and destroys the only current method of reviving people. The rest of the characters in the OP are other people who revived on their own and the main characters just run into them over time.",0
535,"She will be sad if she finds out her headphones are useless, we must invent electronics first!",0
536,"And what about her favourite music? I can remember it, let's free some singers first!",1
537,Okay how did those stay on for almost 4000 years??,2
538,Camphor tree.,2
539,"Dude's gonna end up insisting that they recreate society to the point it was before the stoning, while she's just sitting in the stone like ""ffs just let me out already"".",1
540,"Speaking of which, those must be some ecologically-dangerous headphones if they fully don’t decay even after 3700 years.    Damn, plastics.",1
541,"Well, I assume that Tarzan wants to revive people as well as long as they are not adults or something so I think we are safe with him not trying to kill the bats. They also will probably find another way to free people as the bat poop stuff seems like it would take too long to get enough of it to rebuild civilization.  But yeah I also hope that reviving her isn't posponed because of stupid reasons but judging on the fact that she isn't really seen much in the OP I assume thats what is going to  happen.",1
542,All the bats?    Good luck to him,1
543,"I wouldn't be surprised if he just sets up camp in the cave, after they figure out why he is so damn extra.",1
