,Comment,Sentiment Rating
714, they weren't.     That's objectively false.      there was lots of anti bolshewik propaganda in both fascist germany and italy.    Even your reasoning here makes zero sense. How does this mean they weren't influenced by Marxism? Bolshevism is not Marxism. Being against is is not evidence of them not being influenced by Marx.    And none of this changes my main point that Communism is a far more murderous ideology than Fascism.,0
715,"As a direct result of the globalization of capitalism, the world is by far the best that it has ever been in history. The lowest level of poverty, highest level of health, highest level of intelligence, highest level of population, lowest level of war, lowest level of crime, etc. There has never been a better time in the history of history to be a human being, and it isnt even close.     ""In 1820, the vast majority of people lived in extreme poverty and only a tiny elite enjoyed higher standards of living. Economic growth over the last 200 years completely transformed our world, with the share of the world population living in extreme poverty falling continuously over the last two centuries. This is even more remarkable when we consider that the population increased 7-fold over the same time. In a world without economic growth, an increase in the population would result in less and less income for everyone. A 7-fold increase in the world population would be potentially enough to drive everyone into extreme poverty. Yet, the exact opposite happened. In a time of unprecedented population growth, we managed to lift more and more people out of the extreme poverty of the past.""    ",1
716, but looking at hundreds of years of most brutal capitalist colonialism    As opposed to thousands of years of even more brutal imperialism?  Shits been going on for millennia.,2
717,"It’s not mass genocide, it’s simply not bringing them back to life.",2
718,That sounds like mass genocide with extra steps.,2
719,"It’s not, they are in a limbo or comma of sorts, neither dead or alive. Unconscious. Genocide would mean killing them but nobody is going to do that",2
720,  Genocide would mean killing them but nobody is going to do that    Tsukasa straight up punched a guy's head off,2
721,"The is something like “murder with passion” when you are under influence of very strong emotions. At that time he was, but I doubt he wants to kill further or at least I hope the manga doesn’t go in that direction",2
722,He was literally going to do it again.  To some poor sap that he doesn't even know.,2
723,Senku literally points out that breaking a statue like Tsukasa did and was immediately willing to do again is equivalent to murder since you can't revive them at that point.,2
724,Watching this show makes me so sad that sun Ken rock didn't get an anime ;;;,0
725,"Yeah, but given some of the subject matter it covers, I think that's only slightly more likely than Akumetsu getting an adaptation.    And I really doubt some of the tonal shifts from ultraviolence and corruption or the entire idol arc into gag comedy would work particularly well in an adaptation.",1
726,"Oh shit, someone that knows Akumetsu.",1
727,"It's one of my go-to manga recommendations for anyone I think might be into it. Sometimes violent political screeds can be fun, especially if they're about real-world events and many of the targets are thinly-disguised caricatures of the IRL political/corporate figures involved.    What's really funny is that once I started getting into Persona 5, my reaction was basically ""holy shit, this is just Akumetsu with less blood"", because it's pointing fingers at a lot of the same conceptual issues.",1
728,"I'd recommend Akumetsu to people but I'd make sure to tell them it can be rather dialogue-heavy and may appear edgy for most people.    Regardless, it's incredibly fun and I enjoyed watching Akumetsu's creative assassination methods.",1
729,"It got a little boring plotwise after the n-th ugly corrupt politician, but the damn if the truth about the immortal Akumetsu and the ending didn't make me shed a tear.",1
730,"god I love that series. It's really wish fullfilment-y, but hey, it's my guilty pleasure.",1
731,Sun-Ken Rock is too adult for TV. Lots of scenes with sex or nudity.,2
732,When has that stopped them?,2
733,"Too korean, jk lol",1
734,"If it did, I'd hope the ending would be changed.",1
735,"Man, Tsukasa is like a sexy, OP Tarzan.",1
736,   Side chesto!   ,2
737,Nice muscle!,1
738,"The dude is fucking ripped. He looks like he can pound someone's face in, not even trying.",1
739,He pounded an adult male alpha lion without trying. He can punch you in the face and kill your unborn child.,1
740,I just want to know which conditioner he uses,1
741,"I know, right? That dude's hair is glorious.",1
742,The conditioner he uses it's called good genes and you get it by being lucky with your parents.,1
743,"Laughed way too hard when he jumped off a fucking tree and caught a bird mid-flight. That's not just sexy, op, or Tarzan, that's some supernatural shit",0
744,"Like, his muscles and power will appeal to boys, his beauty and majesty will appeal to girls, and his ideals will appeal to socialists.",1
745,socialists? nah,2
746,"I love how caring a person Senku is, & I love how his caring is presented differently. It's always masked by sarcasm, or apathy, but not in a tsundere ""it's not like I care, baka"" kind of way. More of a obviously feigning apathy or as plain logic ""I dont care who we revive first, so you choose"" ""you can't be a shield & die here, I can't keep going without your brawn!"" He pretends that it's not because he actually cares, but it ten billion percent is, & I think that Taiju understands that best of all.",1
747,"I'm guessing the ""fourth use"" of lime is weapons-related, and Senku's distrust of Tsukasa is making him weary of revealing his plans to someone who could be dangerous. Very smart to be cautious when you have everything to lose.",2
748,Lime is used in blast furnaces to purify iron ore.    So my speculation is iron tools... including weapons.,2
749,Best obviously not antagonist is here and hype for super high school strongest primate,1
750,  super high school    Yo is that a motherfucking danganronpa reference??,1
751,Along with the super high school scientist,2
752,HOPE! DESPAIR! HOPE! DESPAIR!,2
753,Sakura was actually also called the strongest primate in the Japanese version.,2
754,Is there a reason why some animals got turned to stone but not all of them?,2
755,or maybe whoever created the petrifying beam just really hated monty python.,1
756,"Not so much theories as obvious spoilers couched as speculation. There's no way anyone could deduce that just based on the first episode, let alone dozens of people, and in almost the exact same words.",2
757,"Really? So far we've only seen one animal getting petrified. Lions weren't petrified. Fishes weren't petrified. The flying goose weren't petrified, so it's clearly not all birds. And have we seen a stray sparrow flying by itself yet? I don't think so.",2
758,"Well, it might be some god's wrath to these two species. Or alien invasion. Or some comet blowing up these particles or any fantasy stuff. But why i keep only seeing 'someone experimenting the swallow before doing it to human' theory in here?    Clearly it is a spoiler as no proof shown that the stone catastrophe are man made withint the first episode, but somehow the comments here are completely convinced that it is.",2
759,The ghost of Mao led a new two pests campaign against humans and swallows.,2
760," But why i keep only seeing 'someone experimenting the swallow before doing it to human' theory in here?    god wouldn't need to ""test"" it        aliens are still experimenting, so... that still falls under ""someone""    comets or some other weird thing wouldn'y specifically and only target humans. makes no sense. it COULD be true, but it'd be terrible writing.     whether it's aliens or humans i have no idea, but it's obvious from the first episode when people started finding petrified birds of the same species RIGHT before every human and only humans were petrified that they were the test subjects    who was doing the testing, why, etc, have no clue    I'm 100% anime only. I haven't read a manga in the last decade.",2
761,"Of course, god and aliens doesn't test these stuff. They intentionally makes these two species to be stone for whatever reason they may have. Only human or scientist test their stuff.",1
762,"eh... it's possible aliens would test it though. like, we test things out on a different species in a controlled environment before we use most of the things we use on ourselves. eg lab rats",1
763,"Yeap, just the way those comments was written screamed ""I have read the source material""",1
764,"I figured that, and I haven’t read the manga. We had just one species of all of the species of animals on earth turning to stone before the wipe, and after they are still the only animals other than humans to have had this happen to them. Something or someone must have initiated the stoneification, so it makes sense that they would have tested it first to figure out the rules of the power and check how it works. The show has already shown that it pays close attention to the scientific method when it comes to figuring things out, so it makes sense that it would have antagonists also use this and add foreshadowing to that fact early on, as the author has shown himself to be quite intelligent.",2
765,"Only Swallows and Humans were affected, so I think it’s safe to say that the swallows were a test run.",2
766,"maybe swallows were the real target, and they took out humans by accident after they finished the job.",2
767,Humanity was a price worth paying to destroy the swallow menace.,2
768,Test run? How sure are you? It might be natural disaster like some asteroid or volcano eruption causing ashes to affect swallow first before the human? Or it could be some fantasy setting where a gate appear out of nowhere connecting to other world? Or some alien invasion?    Or you definitely know this because you've read the manga?,2
769,"bro the manga doesnt even know how jack shit about how everyone turned to stone yet, he's just running off a common theory that the petrification was intentionally done by someone or something",1
770,"i assume whoever turned humanity into stone has control over what get turned into stone, and was testing it out on birds first",2
771,Science!,2
772,"My guess is that the stone-petrifying technology was some invention that was meant to save humanity from being killed by some mass extinction event or climate-gone wild like the flooding of Tokyo in ep. 1. The stoned humans were maybe meant to wake up in many several thousand years and then rebuild civilisation, but by chance some of them wake up early.",2
773,Seems like the culprit tested it with birds got an OK and then modified it to only affect humans.,2
774,Of course the first person who they bring back is sketchy...really hope he doesn't like become the main bad and like steals Yuzurihara or something...,2
775,"People that say these kind of things  always  turn out to be super nice, chill dudes, though.",1
776,"Yeah like Hitler, really nice guy.",1
777,"To be fair, he did kill Hitler",1
778,But he also killed the guy that killed Hitler D:,2
779,I hear his art wasn't half bad. Though he didn't manage to get into art school.,1
780,"  steals Yuzurihara or something...    Oof, thanks for giving me something to fear over the next week. . .      kumikotears",0
781,Tags: NTR,2
782,Yeah I mean it's not like you can meet the final antagonist early in the game or anything,1
783,"This comment has been removed.      Please keep all source-related comments, such as discussion of future events, comparisons with the source material, or talk about the source material in general, in the Source Material Corner.    ---  Have a question or think this removal was an error? Message the mods.     Don't know the rules? Read them here/r/anime/wiki/rules.",0
784,What the hell happened here,0
785,LMAOOO I'M CRYING,1
786,"Damn, that ED is killer.",1
787,It is! I heard the first 20 seconds with the guitar and instantly got addict to it!,1
788,I like the clash of ideals going on here. That was one of a handful of points I really wanted the show to address sooner than later. In what direction do they plan to steer humanity going forward and how will that be achieved?    I initially expected Tsukasa to be just this antagonistic figure judging from the OP but when he woke up I quickly saw him as this calm guy having a deep connection to mother nature. Eventually he developed into a more complex & flawed character that I thoroughly enjoy for now.     He wants the youth and only the youth to survive as they are not the source of his agony in his previous life. They are more prone to adapt t.   Senku on the other side loves things that wouldn't have been possible without the countless efforts of adults so he is aware of the benefit they bring. I think he wants to return to the world prior to this event whereas Tsukasa wants to reshape it from the ground up. Two distinctly different approaches clashing right here and I love it.     I can't see them split up right away though since they kinda need each other for now. But I think once they are able to awaken people in a higher frequency and a decent population has accumulated then they'll walk different paths.,1
789,"Ok, this line should immediately raise a bunch of red flags about Tsukasa. I will say this: I would not want him as my enemy. The guy kills lions with his bare hands.",1
790,Which is why we need a crossbow.,2
791,And the secret 4th use of something-or-other carbonite!,2
792,"It can be used to purify iron, maybe that.",2
793,So steel it is mmm,2
794,"This comment has been removed.      Please keep all source-related comments, such as discussion of future events, comparisons with the source material, or talk about the source material in general, in the Source Material Corner.    Untagged or improperly tagged spoilers are not allowed.    ---  Have a question or think this removal was an error? Message the mods.     Don't know the rules? Read them here/r/anime/wiki/rules.",0
795,"I think it was implied that the 4th use is to harm someone, and he didn't want Tsukasa to know about that in the inevitable case that he betrayed them",2
796,The guy obliterated a rock in half with a single punch.,2
797,c r o s s b o w,2
798,I hope the damn arrow its made from cryptonite then.,1
799,Just don’t get hit /s,2
800,This world is IMPERFECT,1
801,"Assuming they survive this post petrification age, are they gonna use the existing technology to build their society or are they gonna invent everything from scratch? I have no doubt that Senku can do it, given how smart he is, but it would save literally thousands of years to work on extant stuff. Like, imagine living without cellphone or god forbid, internet.",2
802,"It's been over 3,500 years, the chances of something that hasn't decayed beyond use would be astronomical.",1
803,"They should look for nokia phones, probably fine",2
804,WITH enough battery life to play snake a few dozen times.,2
805,Or look for Samsung Galaxy batteries for instant fire needs,2
806,"If Tsukusa ever gets out of line, Senku just throws it at him like a grenade",2
807,"Those would have exploded and burnt out ages ago. They're good fire starters, but they're far from durable.",2
808,"What they should do is make pizza and then make a Pizza Hut, so it can be a reference to Code Geass and then one fo the guys says ""Pizza time"" and then we find out that this show is actually a spider man anime spinoff.",2
809,"that's when it fades to blacks and as the screen returns we hear, ""Hey you, you're finally awake.""",2
810,You could use some stuff indirectly eg completely rusted through iron beams would be an excellent high grade iron ore but yes you're not going to be able to use anything directly like that.,1
811,"I wonder if there is a chance that there is any underground still bunkers or other ruins still intact? I bet they there may be some ruins in certificated areas that still looked at how they used to, but of course, they will not be useful as they will be buried underneath tons of sand.",1
812,Piramids still around although more wind eroded. There will be stuff underground left although Tokyo area being low and partially reclaimed land not a good area to expect to find stuff. Desert areas way more likely to have useful stuff left.   Dumps will be a great resource but again the Tokyo area no a good place for them to remain intact. And Japan still very geologically active so lots of underground things would be damaged to some degree over time.,2
813,Oh fuck what if they excavate a subway?,2
814,"manga""Japan being geologically active gets explored later when they realize all their knowledge about the geography of the land is now invalid due to the eruption of Mt.Fuji changing the landscape""",2
815,"One major issue for them in that sense is being based in Japan, being on the ring of fire means that earthquakes & volcanic eruptions can happen across pretty much the entire country.    You want either some huge stone/concrete structures something Japan is also generally lacking or something underground of reasonable strength in a less geologically active region.    Best case scenario would be if they could somehow get to a seed bank which has been designed to withstand some mass extinction situation, Norway has the most reliable one but I suspect there are some Russian institutes that would survive. Still means getting across the Sea of Japan and travelling from there which is easier said than done.",2
816,Aren't the pyramids around that old? I wouldn't be shocked if there were a few structures still around in a recognizable form. Not that they would be helpful for anything much.,2
817,"Pyramids are around 4,500 years old now so some of them should be left.",2
818," It's been over 3,500 years, the chances of something that hasn't decayed beyond use would be astronomical.    Plastic does not biodegrade, so he would have a source of plastic bottles among other items made of plastic.",2
819," Plastic does not biodegrade    I'm pretty sure this means microscopic pieces of plastic, the bottles themselves don't last that long.",2
820,"Huh...interesting.    Still, i wonder how plausible would be to find the ruins of a store with at least some bottles of plastic that are usable.",2
821,"Yep biodegrade is a somewhat misleading statement because that only covers bacteria or some other organism consuming something.  Plastic though does break down over time due to it's nature and Sun and seawater break it down fairly fast, unfortunately the microscopic flecks of plastic have been found in small orginziims even at the bottom of the sea but unknown how harmful that is.   I would guess some plastic remains in dumps if they are dry and have no air exposure but that plastic might be quite weakened. Metal items are a better bet in dumps though.",2
822,Interesting considering the first scene is him turning plastic back into gasoline.,1
823,"Plastic still breaks apart. While it takes a VERY long time to break down at the molecular level, plastic will still fragment. So after 3500 their may be plastic left in the world, but it will all be basically plastic dust.",2
824,In addition to the other concerns raised by other responses it's also possible that in 3700 years something  has  evolved to eat it.,2
825,They do need to hit the dump if they can find one. Lots of stuff partially decayed. Biodegrade refers to bacteria and other things consuming substances. Plastic does break down over time due to it's nature so water bottles and the like might remain but not be strong enough to use anymore even if buried in a dump. Seawater and Sunlight breaks plastic into tiny parts. Unknown if the oil eating and other sea bottom bacteria eaters can eat plastics yet although the bi products of oil being consumed are toxic to more common lifeforms for awhile.   Dump aluminum cans and other aluminum products still be good though if not to much water or air has passed though. Aluminum does rust it just rusts slowly.,2
826,Gold doesn't really react in nature. It's malleable without heating and we know where all the famous gold storehouses would be. There are of course other metals that are highly likely to survive thousands of years without much corroding beyond use.    Even piles of rust can be turned back to iron with a hot enough fire and a reducing agent.,2
827,If they need something to get around in I'm sure a Toyata Hilux still works.,2
828,Decay for sure in their wet humid environment. Put in a tomb under the ground in the desert lots of stuff still be around but I don't expect anything electronic to still be usable.,2
829,"It seems weird that there isn’t much that survived. Isn’t the big problem with stuff like plastic that it lasts forever? 3000 plus years is a long time but I would expect properly stored metal stuff, plastic and stuff like bunkers to have survived.",2
830,"Honestly, just do what most people in Minecraft, but you know minus the blocks and shit.",2
831,"Yeah, punch those trees!",1
832,"Senku can punch trees, use a tree sapling and clone that tree sapling and then make a tree sapling empire!",2
833,Tsukasa could probably fell a whole forest with a punch by the looks of things,2
834,"Need to find their own Sven, Joergen, Water Cow and Water Sheep too.",2
835,"dig downward until you hit lava, die, lose all your shit, then quit?",2
836,"That's exactly the appeal to the manga, and will hopefully for the show, building stuff literally from scratch in ways that just make you go : wow so he just MacGyvered that in a believable way.",1
837,Gonna leap through that Doraemon's technological timeline!,2
838,"This comment has been removed.      Please keep all source-related comments, such as discussion of future events, comparisons with the source material, or talk about the source material in general, in the Source Material Corner.    ---  Have a question or think this removal was an error? Message the mods.     Don't know the rules? Read them here/r/anime/wiki/rules.",2
839,You don’t have time to miss those things working from sun up to sun down making sure you can survive the week,2
840,"This comment has been removed.      Please keep all source-related comments, such as discussion of future events, comparisons with the source material, or talk about the source material in general, in the Source Material Corner.    ---  Have a question or think this removal was an error? Message the mods.     Don't know the rules? Read them here/r/anime/wiki/rules.",2
841,"It would take plenty of time but remember that this is anime, so they're allowed to bend rules like the amount of time it would take.",2
842,"Haha just gotta say, read the manga. It answers all your questions, multiple times.",1
843,That line would’ve been very senku like tho,1
844,probably for the best they skipped it,1
845,"This comment has been removed.      Please keep all source-related comments, such as discussion of future events, comparisons with the source material, or talk about the source material in general, in the Source Material Corner.    ---  Have a question or think this removal was an error? Message the mods.     Don't know the rules? Read them here/r/anime/wiki/rules.",0
846,So the real doctor stone was the soap they made along the way,2
847,"This anime is secretly a mindcontroling weapon to make children interested in   SCIENCE!  not complaining, this shit is pretty educational    Senku already prepared himself to Tsukasa betrayl, but i doubt he can do anythinng agaisn't that guy, he's fuckingsuper human, theres no human alive who ever managed to win agaisnt a full grown lion in a fair fight like he did and with such ease, or catch boars bare handed wtf. But i see his point on reviving greedy people, but i have t agree with Senku, in order to recreate civilization, you need as many people as you can, and i'm pretty sure everyone wont have time to worry on collecting taxes and shit.     ;    Plus Taiju is dumb as a rock... at least he's nice hearted unlike Tsukasa.",0
848,"Fucking hell, they revived a pillar man. Everything about him screams ayayaya.",1
849,"Well, I'm just wondering if they'll actually set up Tsukasa as an antagonist. His character design and his motivations seem to imply coming head to head with Senku and Taiju. But I wouldn't mind a red herring here.",1
850," But I wouldn't mind a red herring here.    Next episode just opening with Tsukasa going ""oh yeah what was I even thinking this is obviously immoral of me and I shouldn't be making such impetuous decisions about society at large based on one bad experience in my childhood"", and then they go make friendship bracelets.",1
851,I was more thinking of a mutual understanding of each other's viewpoints and then breaking off. Never really conflicting much with each other afterwards. But I suppose that could also be me overthinking it and wanting to see some strange resolution.,1
852,"We don’t call it “antagonist”, we call it “opposition”. Political correctness, remember!",1
853,"I dunno, seems pretty antagonist thing to when you start murdering people.",1
854,Isn't that just what antagonist means? The person opposing the protagonist,1
